Unnamed: 0.3,Unnamed: 0.2,Unnamed: 0.1,Unnamed: 0,created_at,id_str,full_text,quote_count,reply_count,retweet_count,favorite_count,lang,user_id_str,conversation_id_str,username,tweet_url,pattern_counts,label
1132,1132,1132,1132,Mon Feb 12 16:51:41 +0000 2024,1757085075056029875,sedih sih sebenrnya wajah menangis keras gue pengin pak anies menang te- jadi presiden gue sekarang titik capek banget buat lihat segala hiruk pikuk milu orang baik banyak benci wajah menangis keras kaya memang enggak pantas punya pimpin baik kayak pak anies,0,0,0,0,in,1057683853001670656,1756948728093855872,LarasPuspita18,https://twitter.com/LarasPuspita18/status/1757085075056029875,{},
1133,1133,1133,1133,Mon Feb 12 16:47:38 +0000 2024,1757084057379197177,sedih enggak ikut milu kali personally awal pengin pilih prabowo salut sama persistensi resiliensi orang kali coba pengin jadi presiden cuma enggak jadi deh elu alias najes bosss,0,1,0,0,in,116205535,1757084057379197177,ilyashenkov_,https://twitter.com/ilyashenkov_/status/1757084057379197177,{},
1134,1134,1134,1134,Mon Feb 12 16:42:17 +0000 2024,1757082708214534314,siapa presiden hidup te- lanjut tugas coblos sesuai ingin calon pilih kalah larang kecewa ingat hidup te- lanjut jangan larut milu,0,0,0,0,in,122037039,1757082708214534314,arginhasta,https://twitter.com/arginhasta/status/1757082708214534314,{},
1135,1135,1135,1135,Mon Feb 12 16:40:49 +0000 2024,1757082340965462323,milu batal jrx jadi presiden,0,0,1,0,in,1274255724151861249,1757082340965462323,315jt,https://twitter.com/315jt/status/1757082340965462323,{},
1136,1136,1136,1136,Mon Feb 12 16:39:04 +0000 2024,1757081898311127507,kalau presiden sekarang lewat mendagri tunjuk sana-sini pj kepala daerah perlu pilkada macam nemu atur ingat dulu kontroversi ribut kayak bagaimana pas atur pilkada serentak ketuk palu jelang milu ribut,0,1,0,0,in,375347788,1757080968324894897,abdoelafif,https://twitter.com/abdoelafif/status/1757081898311127507,{},
1137,1137,1137,1137,Mon Feb 12 16:38:58 +0000 2024,1757081872834896207,mau ju- apa nih sekarang kirakira bkl dimainin - issue ham tanda centang putih tebal - mahkamah konstitusi tanda centang putih tebal - dinasti politik tanda centang putih tebal - makzul presiden tanda centang putih tebal - orasi civitas akademika tanda centang putih tebal - release film dirty vote tanda centang putih tebal lah tunggu tanggal februari beres milu damai,0,0,0,1,in,221692524,1757081872834896207,mishbahuddin17,https://twitter.com/mishbahuddin17/status/1757081872834896207,{},
1138,1138,1138,1138,Mon Feb 12 16:37:43 +0000 2024,1757081561227497477,malas komentar politik sih paling mentingin jujur adil lupa kalo milu punya langsung umum bebas rahasia capek chat orang usaha tarik jalan lu- ceunah pilih presiden asa masuk kubu alir sesat kudu ruqiah,0,1,0,0,in,1321452015482851331,1757081561227497477,aruaryas,https://twitter.com/aruaryas/status/1757081561227497477,{},
1139,1139,1139,1139,Mon Feb 12 16:35:37 +0000 2024,1757081029180113015,politik gentong babi jokowi prabowo-gibran ungkap dirty vote curang milu ungkap film dirty vote film sebut salah satu ungkap politik gentong babi guna presiden joko widodo jokowi menang paslon nomor urut prabowo,11,13,130,414,in,435004096,1757081029180113015,Aryprasetyo85,https://twitter.com/Aryprasetyo85/status/1757081029180113015,{},
1140,1140,1140,1140,Mon Feb 12 16:33:52 +0000 2024,1757080591949033482,paling bahas menang milu memang presiden peduli bangsa peduli bagaimana anak jadi raja,0,0,0,0,in,1619301851232604161,1756880822156906891,AidinAzmi,https://twitter.com/AidinAzmi/status/1757080591949033482,{},
1141,1141,1141,1141,Mon Feb 12 16:32:42 +0000 2024,1757080297198563723,enggak tau konteks bikin film apa apa mau milu reset biar februari pilih dprdpd presiden biar pak prabowo,0,0,0,0,in,525094287,1756861762148970530,satriagaul3,https://twitter.com/satriagaul3/status/1757080297198563723,{},
1142,1142,1142,1142,Mon Feb 12 16:32:03 +0000 2024,1757080134937719151,genuinely gue takut banget milu besok rabu tradisi mantau hitung suara and when everythings presiden baru for the next years if lucky allah gue takut banget sama masa depan gue negara woy,0,0,0,1,in,1732058233492389888,1757080134937719151,tangewrione,https://twitter.com/tangewrione/status/1757080134937719151,{},
1143,1143,1143,1143,Mon Feb 12 16:23:14 +0000 2024,1757077914800333277,enggak maksa istri pilih paslon pilih pjs gubernur orang enggak kenal bansos susun sama dpr laksana presiden masak garagara milu henti walah maksud menteri pdip mosok wis tapercoyo wae sama rakyat,0,0,0,0,in,1606177723499827200,1756942912758362413,MdZigyt,https://twitter.com/MdZigyt/status/1757077914800333277,{},
1144,1144,1144,1144,Mon Feb 12 16:22:15 +0000 2024,1757077665381810590,milu tahun akhir gue putus pilih pasang calon nomer urut kalo golput bahaya memang mau presiden langgar ham,0,0,0,0,in,1503678544534069248,1757077665381810590,lgxrbrb,https://twitter.com/lgxrbrb/status/1757077665381810590,{},
1145,1145,1145,1145,Mon Feb 12 16:18:52 +0000 2024,1757076817054478734,kaca milu banyak musuh jadi teman sodara bahkan keluarga sendiri hilang tali silaturahmi banyak jadi tumpah darah beda pilih akhir menang jadi presiden ri kalah jadi tri rakyat gigit jari,0,0,0,1,in,571381774,1756877543402299846,Takemicii_,https://twitter.com/Takemicii_/status/1757076817054478734,{},
1146,1146,1146,1146,Mon Feb 12 16:15:30 +0000 2024,1757075966978138298,allah masalah milu enggak henti-hentinya buat aku kaget aku baru tau nama jual beli suara ampun presiden jt kata sadar enggak kalo benar untung lo hari perak lama tahun,0,0,0,1,in,1531880951160049664,1757075966978138298,Shoshhisher,https://twitter.com/Shoshhisher/status/1757075966978138298,{},
1147,1147,1147,1147,Mon Feb 12 16:06:32 +0000 2024,1757073710677393804,tuju pak ganjar enggak perlu jadi presiden membantusaya harap doa pasca milu pak ganjar tetap bantu meski bukan bapak presidennyapak ganjar keren,0,0,0,0,in,1606177723499827200,1756898902006190242,MdZigyt,https://twitter.com/MdZigyt/status/1757073710677393804,{},
1148,1148,1148,1148,Mon Feb 12 16:05:12 +0000 2024,1757073376932442343,baru kali benar benar doa orang jadi presiden bahkan benci fitnah beliau ku mintain luluh hati padahal milu milu belum cuek bebek kali bobot jangan lolos allaah wajah menahan air mata,0,0,1,0,in,321862175,1757073376932442343,arumsetyorini,https://twitter.com/arumsetyorini/status/1757073376932442343,{},
1149,1149,1149,1149,Mon Feb 12 16:02:10 +0000 2024,1757072612323397704,salah satu salah rakyat suka abai gue salah orang tolak plt give away presiden dulu nyata imbas nya milu sekarang,0,2,1,36,in,1528970085356154880,1756931499054764332,PlaysAufa,https://twitter.com/PlaysAufa/status/1757072612323397704,{},
1150,1150,1150,1150,Mon Feb 12 15:56:06 +0000 2024,1757071086423011817,politis satu akar rumput satu bukti beberapa pilkadapemilu presiden,0,1,0,5,in,108623215,1757069782002946257,pahaatas_mcd,https://twitter.com/pahaatas_mcd/status/1757071086423011817,{},
1151,1151,1151,1151,Mon Feb 12 15:54:00 +0000 2024,1757070557940695172,kuasa tentu hukum miris te- lu tanya film baru rilis skrg sekarang gua balik nanya knapa putus kait ubah batas usia cawapres baru ganti milu betul sih anak presiden mau maju salam akal sehat,0,2,0,0,in,1479414782323150851,1756937746122514482,ravenono25,https://twitter.com/ravenono25/status/1757070557940695172,{},
1152,1152,1152,1152,Mon Feb 12 15:53:27 +0000 2024,1757070420665397334,bukan pola deh tebak lama bang cuma banyak sadar orang rumah awal gapercaya kalo mekar buat menang pilpres milu lalu majority menang dsana soal enggak cukup te- pola presiden kunker deh lihat arah,0,0,0,0,in,1478396485100355593,1756991924366672158,passionategosp1,https://twitter.com/passionategosp1/status/1757070420665397334,{},
1153,1153,1153,1153,Mon Feb 12 15:48:10 +0000 2024,1757069090584457226,inget milu besok enggak cuma soal presiden doang legislatif nah kalian cosplay jadi danny ocean ngumpulin geng buat pilih paling jago rampok taut,0,1,38,41,in,991578771311411200,1757069090584457226,louislugas,https://twitter.com/louislugas/status/1757069090584457226,{},
1154,1154,1154,1154,Mon Feb 12 15:45:02 +0000 2024,1757068300142702764,ohhh arti aku kalo milu tahun memang curang pak antar pak jokowi jadi presiden,0,0,0,0,in,1695863785662394370,1756709589737930945,KMegawanto,https://twitter.com/KMegawanto/status/1757068300142702764,{},
1155,1155,1155,1155,Mon Feb 12 15:44:24 +0000 2024,1757068143384764795,rakyat kumpul cabut mandat presiden dulu minta lalu tangan rakyat milu,0,1,0,2,in,1539046958543048706,1756975728577728708,hartina_lusi,https://twitter.com/hartina_lusi/status/1757068143384764795,{},
1156,1156,1156,1156,Mon Feb 12 15:40:21 +0000 2024,1757067124768686544,guys udah hari milu ayo satu tuju semua arah sama jadi lebih baik wujud damai doa periode presiden lanjut bakal mulai gera indonesia lebih inklusif,0,1,0,1,in,585406020,1757067124768686544,goceae,https://twitter.com/goceae/status/1757067124768686544,{},
1157,1157,1157,1157,Mon Feb 12 15:37:36 +0000 2024,1757066431114690789,calon presiden pilih mahasiswa aceh umum pandang mahasiswa sama pilih masyarakat aceh seluruh milu jadi normal curang serang fajar anies mungkin besar menang aceh,0,0,0,0,in,1460142601449840652,1757066431114690789,Simanjunta9Nico,https://twitter.com/Simanjunta9Nico/status/1757066431114690789,{},
1158,1158,1158,1158,Mon Feb 12 15:31:55 +0000 2024,1757064998654996645,presiden tuh ha- netral jokowi malah sok ikut campur milu enggak punya etika,0,0,0,0,in,1679033474458750976,1757064998654996645,faridanina_,https://twitter.com/faridanina_/status/1757064998654996645,{},
1159,1159,1159,1159,Mon Feb 12 15:31:34 +0000 2024,1757064910599774460,makin dekat milu makin pusing pilih siapa rasa lebih mudah cari pacar pilih presiden,0,0,0,0,in,1156472593995583488,1757064910599774460,elinivana,https://twitter.com/elinivana/status/1757064910599774460,{},
1160,1160,1160,1160,Mon Feb 12 15:30:41 +0000 2024,1757064691736563866,sama kalau bilang curang curang nya presiden nya jokowi presiden baru pilih curang lah wong pilih baru luar negeri indonesia gelar te- bilang curang bukan fitnah selenggara milu,0,0,0,0,in,2885505196,1756989667256443254,ferrypalex,https://twitter.com/ferrypalex/status/1757064691736563866,{},
1161,1161,1161,1161,Mon Feb 12 15:28:54 +0000 2024,1757064239536316502,gue harap milu presiden cukup putar aja kalo x tps libur wajah menangis keras gue harap libur payment kerja sistem hari diitungnya wkwkwkwk wajah menangis keras,0,0,0,0,in,52291697,1757064239536316502,renaldyil,https://twitter.com/renaldyil/status/1757064239536316502,{},
1162,1162,1162,1162,Mon Feb 12 15:26:42 +0000 2024,1757063686978695589,bahkan salah muslim milu ada pas hari penting agama wajah pusing pusing alih-alih salah presiden kpu serang malah muslim biasa kayak aku,0,0,0,0,in,1365349729454854145,1756869111282549133,DobbyisFairy,https://twitter.com/DobbyisFairy/status/1757063686978695589,{},
1163,1163,1163,1163,Mon Feb 12 15:26:09 +0000 2024,1757063550554755237,dirty vote film dokumenter ungkap skandal balik wacana milu presiden satu putar kaca pembesar arah kanan,0,0,0,1,in,827998103013715968,1757063550554755237,CakRasyid,https://twitter.com/CakRasyid/status/1757063550554755237,{},
1164,1164,1164,1164,Mon Feb 12 15:25:25 +0000 2024,1757063364315087014,tanya ada uu sempurna buat abuse of power incumben baik presiden maupun kepala daerah pemilu-kada menang calon tentu utama anggota keluarga dekat hindar baik mungkin,0,0,1,1,in,613737730,1756539086943465890,Aminuddin001,https://twitter.com/Aminuddin001/status/1757063364315087014,{},
1165,1165,1165,1165,Mon Feb 12 15:22:06 +0000 2024,1757062529661165697,buchtar tabun presiden knpb opm ulmwp seru segenap juang buat ribut milu indonesia katong tunjuk papua baik papua tanah tuhan,0,0,0,0,in,1528572840001568768,1757062529661165697,SebastianLodu,https://twitter.com/SebastianLodu/status/1757062529661165697,{},
1166,1166,1166,1166,Mon Feb 12 15:17:53 +0000 2024,1757061470150680915,beda milu esok dulu tak milu langsung gelar kali milu jaman orba angkat presiden jaman orla tuju sama pilih pimpin republik sejak presiden pertama hingga akhir tak pernah presiden benar culas,0,3,0,2,in,945732456,1757061470150680915,primaageng,https://twitter.com/primaageng/status/1757061470150680915,{},
1167,1167,1167,1167,Mon Feb 12 15:17:10 +0000 2024,1757061286880547166,uang kaget bjir bukan milu presiden,0,2,0,3,in,1605200784492498944,1757061286880547166,aigaasm,https://twitter.com/aigaasm/status/1757061286880547166,{},
1168,1168,1168,1168,Mon Feb 12 15:16:12 +0000 2024,1757061046106468358,milu sekarang enggak nyanyi ganti presiden padahal sekarang waktu tepat loh wajah tersenyum,0,0,0,0,in,206680776,1757003760575070576,dekudzz,https://twitter.com/dekudzz/status/1757061046106468358,{},
1169,1169,1169,1169,Mon Feb 12 15:15:25 +0000 2024,1757060850115063944,menang milu sama hancur laku curang mungkin jadi kyai maaruf amin obat luka beberapa bulan layak hadir bj habibie era transisi tuju reformasi enggak kyai jadi presiden,0,0,0,0,in,1279796649372479491,1713913948419010874,DSuryadmaja,https://twitter.com/DSuryadmaja/status/1757060850115063944,{},
1170,1170,1170,1170,Mon Feb 12 15:13:31 +0000 2024,1757060369519177805,tolak politik bansos presiden netral tolak curang milu,0,0,0,0,in,1734224554548150272,1757060369519177805,baladamintalang,https://twitter.com/baladamintalang/status/1757060369519177805,{},
1171,1171,1171,1171,Mon Feb 12 15:12:08 +0000 2024,1757060021790396863,milu bulan syaban moga rakyat indonesia milik presiden amanah bulan syaban tahun bukan presiden wakil presiden hasil akal akal galak suka ngeluh,0,0,0,2,in,1359209148,1757060021790396863,CH4__15R,https://twitter.com/CH4__15R/status/1757060021790396863,{},
1172,1172,1172,1172,Mon Feb 12 15:10:20 +0000 2024,1757059567069048944,aneh rilis masa tenang milu kalau dar awal kritik pimpin presiden segala macam enggak laku belum,0,1,0,0,in,1741993957,1757059554448425169,chosaram_,https://twitter.com/chosaram_/status/1757059567069048944,{},
1173,1173,1173,1173,Mon Feb 12 15:06:39 +0000 2024,1757058640983511334,milu bukan kompetisi kak siapa pilih jadi presiden rakyat indonesia tahun depan semua hak kritisi visi misiprogram semua capres cawapres kalo memang nyeleneh sini paham jadi enggak lah kalo suruh diam aja,0,0,0,0,in,727732152,1756937746122514482,kisserIrh,https://twitter.com/kisserIrh/status/1757058640983511334,{},
1174,1174,1174,1174,Mon Feb 12 15:06:27 +0000 2024,1757058593705316586,wakil presiden kh ma ruf amin saran perintah perhati baik kritik sampai lalu film dirty vote kena curang milu,0,0,0,1,in,1506857852891136000,1757058593705316586,NajwaChoiri,https://twitter.com/NajwaChoiri/status/1757058593705316586,{},
1175,1175,1175,1175,Mon Feb 12 15:06:06 +0000 2024,1757058505125900432,hasil milu curang ulang strategi akhir menang anak presiden cawe panjang kuasa milu formalitas modus lama surepay dogma rakyat atas menang lanjut quick count,1,0,10,18,in,1667213278240706560,1757058505125900432,alfatih212426,https://twitter.com/alfatih212426/status/1757058505125900432,{},
1176,1176,1176,1176,Mon Feb 12 15:03:53 +0000 2024,1757057945085632891,pasuk harihari jelang milu percaya siapa presiden pilih hanya buah jalan allah u negeri jadi lebih baik kuasa alam semesta bumiamp langit allah swt - kemenkumham jabar r andika dwi prasetya,0,1,0,0,in,727879641164193792,1757057840039223695,lapas_sumedang,https://twitter.com/lapas_sumedang/status/1757057945085632891,{},
1177,1177,1177,1177,Mon Feb 12 15:03:23 +0000 2024,1757057819965292839,guna hak pilih sesuai alamat ktp-el mulai pukul sd jangan lupa bawa ktp elektronik milu tahun pilih presiden wakil presiden dpr ri dpd ri dprd provinsi dprd kabupatenkota informasi lebih lanjut hubung,0,1,0,0,in,1366956492532813826,1757057817788482007,KPUTulangBawang,https://twitter.com/KPUTulangBawang/status/1757057819965292839,{},
1178,1178,1178,1178,Mon Feb 12 15:01:37 +0000 2024,1757057375989895206,part libat perintah bawaslu omg hello milu kali enggak wasit semua main presiden main wajah menangis keras akademisi jaga moral enggak didengerin mau libat siapa wajah menangis keras,0,0,0,0,in,1587700636376006658,1756885530875502770,yourmelody0705,https://twitter.com/yourmelody0705/status/1757057375989895206,{},
1179,1179,1179,1179,Mon Feb 12 15:01:26 +0000 2024,1757057330221642167,wakil presiden maruf amin bakal beri suara pilih umum milu tempat mungut suara tps rumah pribadi cimanggis depok rabu lusa lt,0,0,1,3,in,23343960,1757057330221642167,kompascom,https://twitter.com/kompascom/status/1757057330221642167,{},
1180,1180,1180,1180,Mon Feb 12 15:00:14 +0000 2024,1757057027355152766,aksi sebut protes presiden nilai cedera demokrasi kait selenggara milu proses salah satu paslon disebut-sebut langgar etik,0,1,0,0,in,1186946650595418116,1757053069932876260,voidotid,https://twitter.com/voidotid/status/1757057027355152766,{},
1181,1181,1181,1181,Mon Feb 12 14:58:26 +0000 2024,1757056574248653293,akun media sosial aliansi rakyat gerak seru aksi gejayan panggil protes nasib demokrasi makin mundur duga curang proses milu era perintah presiden jokowi,0,0,0,0,in,1244292531090624512,1757056570809340116,YudhaShanny2,https://twitter.com/YudhaShanny2/status/1757056574248653293,{},
1182,1182,1182,1182,Mon Feb 12 14:56:09 +0000 2024,1757055997724786757,milu nyata se seram yaa gajadi punya cita cita jadi presiden dehtakut begini salah salah gampang pikir soal kalo hujat wajah menangis keras wajah menangis keras wajah menangis keras,0,0,0,0,in,1235167683055734784,1757055997724786757,luviepici,https://twitter.com/luviepici/status/1757055997724786757,{},
1183,1183,1183,1183,Mon Feb 12 14:55:41 +0000 2024,1757055880598814868,rugi banget kalo beliau enggak jadi presiden usaha pak anies jadi presiden indonesia milu kali orang membungkuk simbol wanita,0,0,0,1,in,1611202864705310722,1757055880598814868,sunsetjinnie,https://twitter.com/sunsetjinnie/status/1757055880598814868,{},
1184,1184,1184,1184,Mon Feb 12 14:53:01 +0000 2024,1757055211397685557,gue baru tau kalo pas milu pilih presiden pilih dpr dpd dprd wajah ketakutan berkeringat wajah ketakutan berkeringat wajah kecewa namun lega wajah kecewa namun lega wajah kecewa namun lega wajah kecewa namun lega,0,0,0,0,in,1536377423029145600,1757055207559860690,dresores,https://twitter.com/dresores/status/1757055211397685557,{},
1185,1185,1185,1185,Mon Feb 12 14:52:37 +0000 2024,1757055110881161372,kalo enggak ngaruh ayem tentrem enggak ngerahin begundal meng klarifikasi tuduh film trsb fitnah beda reaksi video sebut rupa kilas balik janggal milu sikap presiden fakta enggak sedikit unsur fitnah,0,0,0,3,in,1691865573293268992,1756981075061117280,Bashu2950331,https://twitter.com/Bashu2950331/status/1757055110881161372,{},
1186,1186,1186,1186,Mon Feb 12 14:49:55 +0000 2024,1757054432360219066,lah bro malah jokowi hebat enggak langgar uu milu uud soal usung pasang calon presiden wakil presiden enggak ikut libat tentu nama fasilitas agenda politik beberapa kawan arti pak bersih dong,0,0,0,1,in,1725727497579614208,1756526028858728759,RadenTheoOFC,https://twitter.com/RadenTheoOFC/status/1757054432360219066,{},
1187,1187,1187,1187,Mon Feb 12 14:49:55 +0000 2024,1757054431819083803,dulu pro pak prabowo meski beliau kalah kali milu tetap yakin biau paling cocok jadi presiden ri kalau beliau mampu,0,0,1,2,in,1723010678980747264,1757013536591712447,YermiasP77,https://twitter.com/YermiasP77/status/1757054431819083803,{},
1188,1188,1188,1188,Mon Feb 12 14:49:15 +0000 2024,1757054263782727738,kritik perintah selenggara milu kok panas panik takut kalah takut penjara,0,0,0,2,in,1663683191763525632,1757016299228828030,Presiden_Swasta,https://twitter.com/Presiden_Swasta/status/1757054263782727738,{},
1189,1189,1189,1189,Mon Feb 12 14:48:41 +0000 2024,1757054121566523718,wakil presiden ri maruf amin nilai film dokumenter dirty vote ungkap duga curang milu rupa bagi dinamika politik aspirasi masyarakat aspirasi turut perlu dengar respons baik,0,0,0,0,in,1630082867182321664,1757054121566523718,NewsDinda,https://twitter.com/NewsDinda/status/1757054121566523718,{},
1190,1190,1190,1190,Mon Feb 12 14:44:13 +0000 2024,1757052998227042362,jangan tutup mata sama apa kasih sama presiden milu arah aiqnevsoomqhrk baca berita enggak tanggung jawab,0,0,0,0,in,555821689,1757052995982987671,just_audi_aja,https://twitter.com/just_audi_aja/status/1757052998227042362,{},
1191,1191,1191,1191,Mon Feb 12 14:43:35 +0000 2024,1757052837157339460,bapak kampanye masa tenang milu mungkin rasa bekas presiden,0,0,0,1,in,530920037,1757052837157339460,kri_tik_us,https://twitter.com/kri_tik_us/status/1757052837157339460,{},
1192,1192,1192,1192,Mon Feb 12 14:42:28 +0000 2024,1757052554322796905,milu sama valentine sama sama tanggal jadi bingung mau nyoblos kamu apa presiden,0,3,0,1,in,1645815702010593286,1757052554322796905,rapintheskyyy,https://twitter.com/rapintheskyyy/status/1757052554322796905,{},
1193,1193,1193,1193,Mon Feb 12 14:37:44 +0000 2024,1757051366529528218,jujurly milu belum gue enggak mikir siapa jadi presiden kayak yaudah gue mikirnya gakan pengaruh signifikan hidup gue meski pikir sedikit salah wajah tersenyum lebar sekarang benar se-khawatir takut pilih orang enggak tepat,1,0,0,0,in,896684700,1757051366529528218,mostlywonuu,https://twitter.com/mostlywonuu/status/1757051366529528218,{},
1194,1194,1194,1194,Mon Feb 12 14:35:26 +0000 2024,1757050785144435109,nih arti bang psl ayat uu milu sebut lama masa tenang bagaimana maksud dalampasal uu milu laksana serta danatau tim kampanye milu presiden wakil presiden lanjut google bang,0,0,0,0,in,115893829,1756702501695631846,Guswanas,https://twitter.com/Guswanas/status/1757050785144435109,{},
1195,1195,1195,1195,Mon Feb 12 14:28:56 +0000 2024,1757049148405387287,pak memang jauh kata sempurna makhluk tuhan cara manusia manusia luar biasa bayang pak anies takdir jadi presiden kaum rakyat kecil perhati tahun milu sj waktu perhati,0,1,35,359,in,1607305971407425536,1757046692132835741,Djambronk_Anyar,https://twitter.com/Djambronk_Anyar/status/1757049148405387287,{},
1196,1196,1196,1196,Mon Feb 12 14:28:44 +0000 2024,1757049100657414255,eayah bewaslu awas awas sekaligus pengwas kecut ganggu milu langgar etik mk kpu presiden netral kampanye ugalan libat menteri menteri,0,0,0,0,in,1565707365735088128,1756873800766140774,andemha67,https://twitter.com/andemha67/status/1757049100657414255,{},
1197,1197,1197,1197,Mon Feb 12 14:26:07 +0000 2024,1757048441383895185,gue sih tonton filem kalau konten masalah milu enggak elok kait rekam jejak jokowi presiden memang punya etos kerja baik manuver politik kisruh jadi murni tanggung jawab orang politikus patut tanya,0,0,0,0,in,1604434777687601152,1757038020837183705,SifrojiA,https://twitter.com/SifrojiA/status/1757048441383895185,{},
1198,1198,1198,1198,Mon Feb 12 14:22:08 +0000 2024,1757047439629127723,gua sering nontonin pak rg beliau gemas milu periode lalu masyarakat sangat dungu lihat ada negara pilih presiden bukan kapasitas pilih u- negara besar,0,2,1,9,in,1568252851796996097,1756880038383988808,_niermala1990,https://twitter.com/_niermala1990/status/1757047439629127723,{},
1199,1199,1199,1199,Mon Feb 12 14:21:51 +0000 2024,1757047366514053348,jadi radio pemkot bahkan salah satu partai bukan iklan milu cuma salah satu calon presiden partai identik sama surabaya,0,0,0,1,in,218887410,1756990440937775293,andrsdwang,https://twitter.com/andrsdwang/status/1757047366514053348,{},
1200,1200,1200,1200,Mon Feb 12 14:20:26 +0000 2024,1757047013253005460,aneh banget enggak sih bansos milu lebih banyak pas pandemi covid aneh banget enggak sih masa presiden turun langsung bansos aneh banget enggak si aneh banget loh wajah menangis keras,0,0,0,0,in,1476941803462926337,1756820137184022784,Kucingmanizt,https://twitter.com/Kucingmanizt/status/1757047013253005460,{},
1201,1201,1201,1201,Mon Feb 12 14:18:28 +0000 2024,1757046517012283832,maaf teh ilka jadi saing rayyan presiden milu satu putar,0,0,0,0,in,4705303568,1757046517012283832,atharazkai,https://twitter.com/atharazkai/status/1757046517012283832,{},
1202,1202,1202,1202,Mon Feb 12 14:17:19 +0000 2024,1757046226380636441,pilih calon presiden milu begini aku pj gubenur banten al muktabar,0,0,0,0,in,775598663024259072,1757046226380636441,KabarBanten72,https://twitter.com/KabarBanten72/status/1757046226380636441,{},
1203,1203,1203,1203,Mon Feb 12 14:17:09 +0000 2024,1757046185242906737,bejir enggak ikut berita politik milu kemarin acara doa sama biar jadi presiden sokap coba wkwkwk,0,1,0,0,in,1052926842284298240,1757045067746095536,koviiyay,https://twitter.com/koviiyay/status/1757046185242906737,{},
1204,1204,1204,1204,Mon Feb 12 14:16:43 +0000 2024,1757046077310799970,wakil presiden ma ruf amin saran perintah perhati baik kritik sampai lalu film dirty vote kena curang milu,0,0,0,0,in,105859650,1757046077310799970,h4disupriyanto,https://twitter.com/h4disupriyanto/status/1757046077310799970,{},
1205,1205,1205,1205,Mon Feb 12 14:15:58 +0000 2024,1757045888218976270,ayo datang tempat mungut suara hari rabu februari guna hak pilih jangan lupa bawa ktp elektronik milu tahun pilih presiden amp wakil presiden dpr ri dpd ri dprd provinsi amp dprd kabupatenkota,0,0,0,0,in,767657420680114176,1757045888218976270,kpu_malang,https://twitter.com/kpu_malang/status/1757045888218976270,{},
1206,1206,1206,1206,Mon Feb 12 14:15:00 +0000 2024,1757045642772304207,wakil presiden ri ke- jusuf kalla sebut film dokumenter dirty vote sutradara dhandy dwi laksono tangkap persen duga curang lama proses milu pilpres,5,21,24,27,in,1664572693180747777,1757045642772304207,faktacom_,https://twitter.com/faktacom_/status/1757045642772304207,{},
1207,1207,1207,1207,Mon Feb 12 14:13:51 +0000 2024,1757045356121235804,benar pks via pak kritis susun uu milu kait pilkada amp tarik efek kepala daerah kosong tunjuk presiden,1,2,19,101,in,267655183,1756953306600280418,enjang_as,https://twitter.com/enjang_as/status/1757045356121235804,{},
