Unnamed: 0.3,Unnamed: 0.2,Unnamed: 0.1,Unnamed: 0,created_at,id_str,full_text,quote_count,reply_count,retweet_count,favorite_count,lang,user_id_str,conversation_id_str,username,tweet_url,pattern_counts,label
331,331,331,331,Tue Feb 13 14:27:09 +0000 2024,1757411089933914418,gubernur jakarta jadi tunjuk presiden ntar milu mungkin balik milu tutup presiden pilih mpr rakyat cuma pilih partai tahun kemarin sempat rame isu milu balik milu tutup ala orba kalo menang bukan mustahil,0,0,0,0,in,1642689976579284992,1757278142937661787,Nate_rising,https://twitter.com/Nate_rising/status/1757411089933914418,{},marah
333,333,333,333,Tue Feb 13 14:26:15 +0000 2024,1757410861814063582,jangan lupa februari besok bukan hari valentin hari mungut suara milu ingat tempat mungut suara tps masingmasing coblos calon dprd kabupatenkota dprd provinsi dpr ri presiden wakil presiden guna hak suara kamu,0,1,1,1,in,1895912052,1757410861814063582,HinduSultra,https://twitter.com/HinduSultra/status/1757410861814063582,{},senang
335,335,335,335,Tue Feb 13 14:24:51 +0000 2024,1757410509836484815,caption infografis ayo ikut partisipasi milu halo keluarga jakarta tangan melambai warna kulit cerah tanggal februari partisipasi pesta demokrasi kotak dengan surat suara kilau pilih presiden anggota dpr dpd dprd hak tanggung jawab,0,1,0,0,in,4891065976,1757410509836484815,dppappdki,https://twitter.com/dppappdki/status/1757410509836484815,{},senang
342,342,342,342,Tue Feb 13 14:14:16 +0000 2024,1757407845417398293,assalamualaikum wr wb jelang milu gelar besok rabu februari pasang anies-gus imin amin optimis menang pilih presiden wakil presiden moga baik,0,1,0,0,in,926653618098397184,1757407845417398293,zuheni,https://twitter.com/zuheni/status/1757407845417398293,{},senang
344,344,344,344,Tue Feb 13 14:13:18 +0000 2024,1757407602047090768,tahun lalu pindah ktp cimahi data pakai buat milu data waktu aku tinggal cilegon pas mau aju pindah tps eh lewat tanggal aju nya jadi enggak ikut nyoblos legislatif bsk cuma presiden pakai ktp kata oke bek,0,0,0,0,in,267673171,1757407602047090768,Adysdys,https://twitter.com/Adysdys/status/1757407602047090768,{},netral
346,346,346,346,Tue Feb 13 14:11:13 +0000 2024,1757407079302660330,ayo pikir dulu masak besok nyoblos yakin nih enggak mau pimpin kayak gin rugi dong presiden rakyat bela rakyat btw moga hari milu besok jalan lancar curang amp rakyat indonesia pimpin baik tangan diangkat dan dirapatkan bersama,0,0,4,6,in,1746616936115617792,1757407079302660330,LailaNurKamala,https://twitter.com/LailaNurKamala/status/1757407079302660330,{},marah
347,347,347,347,Tue Feb 13 14:10:30 +0000 2024,1757406899975434408,juang amin tinggal selang lg jelang milu rabu mll doa pr kiai masyayikhamp slrh rakyat paslon optimis mjd presiden amp wapres bukti nyata kampanye trkhr jis juta lebih tiket habis dpesan hai waktu mnt,0,0,0,0,in,2832177266,1757356659750621501,hisapm66,https://twitter.com/hisapm66/status/1757406899975434408,{},netral
348,348,348,348,Tue Feb 13 14:10:08 +0000 2024,1757406807184536014,dasar putus presiden republik indonesia nomor tahun hari mungut suara pilih umum tahun hari libur nasional laksana pilih umum milu rabu februari layan kantor tanah kota pontianak tutup,0,0,0,0,in,1016490370157314048,1757406807184536014,kantahpontianak,https://twitter.com/kantahpontianak/status/1757406807184536014,{},senang
350,350,350,350,Tue Feb 13 14:08:30 +0000 2024,1757406397489103031,laksana milu gelar besok rabu februari pasang anies-gus imin amin optimis menang pilih presiden wakil presiden,0,0,0,0,in,1594190966172561408,1757406397489103031,samidur2024,https://twitter.com/samidur2024/status/1757406397489103031,{},netral
351,351,351,351,Tue Feb 13 14:07:54 +0000 2024,1757406246557385068,natsir anggota dpp foksi nyata film sebut ulas curang milu anggap rugi salah satu pasang calon presiden calon wakil presiden tarung kontestasi sebut,0,1,0,0,in,1741112451423432704,1757406237048901844,culcrix,https://twitter.com/culcrix/status/1757406246557385068,{},netral
352,352,352,352,Tue Feb 13 14:07:46 +0000 2024,1757406210637127852,lebih baik nya sang oposisi lelah enggak kuat bisnis mandeg n tawar jabat strategis gabung deh berkoalisihihihihihipemilu nya baru mulai besok omyg jelas filter calon presiden n cawapres jadi catat buruk sejarah demokrasi indonesia,0,0,0,0,in,820916849650995200,1757003760575070576,Bayouiraone1,https://twitter.com/Bayouiraone1/status/1757406210637127852,{},senang
353,353,353,353,Tue Feb 13 14:07:33 +0000 2024,1757406156933464097,milu depan mata strategi kampanye pasang calon presiden efektif raup suara calon pilih bagaimana respon pilih tanggap strategi kampanye masing-masing pasang calon presiden,0,1,0,0,in,280895955,1757406156933464097,PolitikBRIN,https://twitter.com/PolitikBRIN/status/1757406156933464097,{},netral
355,355,355,355,Tue Feb 13 14:05:36 +0000 2024,1757405667936305351,polresta magelang gelar apel geser pasu rangka aman tps tahap pungut hitung suara milu legislatif presiden tahun wilayah hukum polresta magelang selasa lapang drhsoepardi kota mungkid,0,0,0,0,in,951639105183522816,1757405667936305351,polseksawangan_,https://twitter.com/polseksawangan_/status/1757405667936305351,{},marah
356,356,356,356,Tue Feb 13 14:05:29 +0000 2024,1757405638840263142,yuk sukses milu tahun ikut pilih presiden baik,0,0,0,0,in,1425510624885231622,1757402175708581952,Manusia_cerdik,https://twitter.com/Manusia_cerdik/status/1757405638840263142,{},netral
357,357,357,357,Tue Feb 13 14:05:19 +0000 2024,1757405596272185603,cek ombak besok milu presiden kalian mau coblos siapa,0,0,0,1,in,1680483469925974017,1757405596272185603,rich_ichad02,https://twitter.com/rich_ichad02/status/1757405596272185603,{},netral
358,358,358,358,Tue Feb 13 14:03:05 +0000 2024,1757405033652768843,gpp senang mau nyoblos milu presiden tiga gue anjayyy lihat dewasa pertama kuliah dua mulai kerja sekarang jadi buruh beberapa tahun beda kondisi beda concern seru,0,0,0,1,in,45103932,1757402606262263989,nndp_,https://twitter.com/nndp_/status/1757405033652768843,{},senang
359,359,359,359,Tue Feb 13 14:02:53 +0000 2024,1757404982066712824,hubung apa film cerita cara presiden guna anggar negara penting keluarga amp kroni anggar bansos kucur milu lebih besar negara krisis landa covid,0,0,0,0,in,2810316746,1757262089285243263,andyydepp,https://twitter.com/andyydepp/status/1757404982066712824,{},netral
361,361,361,361,Tue Feb 13 14:00:44 +0000 2024,1757404439873466767,iya benar banget asli banteng makanya hasil milu lihat periode kemarin pak jokowi jadi presiden banteng sosok beliau,0,1,0,0,in,51573859,1757401210158715121,allunamaharani,https://twitter.com/allunamaharani/status/1757404439873466767,{},senang
364,364,364,364,Tue Feb 13 13:58:39 +0000 2024,1757403918055920100,uhuy x ikut pilih presiden kemarin milu kali ikut aktif lalu medos ikut kampanye paslon nama politik curang jadi bagi cuma inti siapa menang enggak masalah asal bukan usak demokrasi mengangkat tangan,0,0,0,0,in,238917287,1757403918055920100,dradikhap,https://twitter.com/dradikhap/status/1757403918055920100,{},takut
367,367,367,367,Tue Feb 13 13:57:14 +0000 2024,1757403562361901079,buka megawati menang milu deh bang santer isu perempuan jadi presiden mangkanya beliau jadi presiden,0,0,0,1,in,1174879308,1757249567601631641,goestamardie,https://twitter.com/goestamardie/status/1757403562361901079,{},senang
370,370,370,370,Tue Feb 13 13:54:50 +0000 2024,1757402955458752675,tiga kali gue ikut milu milu kali turut stake-nya tinggi bener bukan cuma perkara pilih presiden doang sistem pilih presiden depan kayak begini balik kayak dulu,0,0,0,1,in,1396766942908719108,1757402955458752675,morningmomochan,https://twitter.com/morningmomochan/status/1757402955458752675,{},senang
372,372,372,372,Tue Feb 13 13:54:35 +0000 2024,1757402892645040448,februari aku usia mungkin hasil milu keluar lama tahun depan nasib gen indonesia tangan presiden baru aku doa moga adil adil jari tengah wajah menahan air mata,0,0,0,0,in,890081262005874688,1757402892645040448,androgynycat,https://twitter.com/androgynycat/status/1757402892645040448,{},takut
374,374,374,374,Tue Feb 13 13:52:28 +0000 2024,1757402360379494515,bismillaaah allah moga hitung suara milu tahun curang moga negeri menang presiden amanah adil amp bijaksana rakyat aamiin melipat tangan melipat tangan,0,0,0,0,in,3311998068,1757402360379494515,niaasmawirya,https://twitter.com/niaasmawirya/status/1757402360379494515,{},netral
377,377,377,377,Tue Feb 13 13:51:10 +0000 2024,1757402032267460950,moga allah mudah segala u- lancar milu menang bpk anies rasyid baswedan presiden amin rabb,0,0,0,0,in,1735926203360657408,1757402032267460950,wariyaa32,https://twitter.com/wariyaa32/status/1757402032267460950,{},senang
378,378,378,378,Tue Feb 13 13:50:43 +0000 2024,1757401921332404467,jelang milu gelar besok rabu februari pasang amin optimis menang pilih presiden amp wakil presiden lebih kampanye akhir jakarta internasional stadium jis juta orang ikut hadir,0,3,1,2,in,839661295800496128,1757401921332404467,DidahFaridahAli,https://twitter.com/DidahFaridahAli/status/1757401921332404467,{},marah
379,379,379,379,Tue Feb 13 13:50:31 +0000 2024,1757401868928757817,lah kapai buang duit buat milu kalo form bukti kagak langsung tunjuk siapa the next presiden selesai u- gila duit dibagiin sini kisar - ribu perorangm tadi teman gue diapet wajah tersenyum lebar dan berkeringat benarbenar duit gede jalan gue fix golput wkwkwk,0,1,0,0,in,1452903590,1757400264410325058,pempekteri,https://twitter.com/pempekteri/status/1757401868928757817,{},netral
380,380,380,380,Tue Feb 13 13:50:04 +0000 2024,1757401757242753441,milu selesai datang masa dukung kalah teriak dukung menang tuh kan siapa presiden pilih wajah gembira dengan mata bahagia,0,0,0,1,in,1078986413775904768,1757401757242753441,nandaarfb,https://twitter.com/nandaarfb/status/1757401757242753441,{},senang
381,381,381,381,Tue Feb 13 13:49:11 +0000 2024,1757401533812203665,presiden joko widodo jokowi resmi naik tunjang kerja tukin pegawai bawaslu lalu pres no tahun ditandatangani februari arti atur tetap hari coblos milu,0,0,0,0,in,1460142601449840652,1757401533812203665,Simanjunta9Nico,https://twitter.com/Simanjunta9Nico/status/1757401533812203665,{},marah
383,383,383,383,Tue Feb 13 13:48:24 +0000 2024,1757401339284607452,badan awas milu bawaslu ri aku syukur putus presiden joko widodo naik tunjang kerja tukin asn bawaslu lt,0,0,0,5,in,23343960,1757401339284607452,kompascom,https://twitter.com/kompascom/status/1757401339284607452,{},netral
384,384,384,384,Tue Feb 13 13:48:10 +0000 2024,1757401278060376325,momen politik tahun indonesia selenggara pilih umum milu legislatif presiden-wakil presiden,0,1,1,4,in,1235415112904617984,1757401122510389343,FNKSDA,https://twitter.com/FNKSDA/status/1757401278060376325,{},senang
385,385,385,385,Tue Feb 13 13:47:58 +0000 2024,1757401230144618754,indonesia siap guna ai robot kotak dengan surat suara amp buku ide presiden dpr edisi milu tunjuk minat manfaat teknologi ai laksana milu indonesia robot kotak dengan surat suara,0,1,0,0,in,61208352,1757401230144618754,Lintasarta,https://twitter.com/Lintasarta/status/1757401230144618754,{},senang
386,386,386,386,Tue Feb 13 13:46:43 +0000 2024,1757400915336995064,besok februari first time ikut milu siapa jadi next presiden wakil moga amanah visi misi,0,1,0,0,in,1470349934612271105,1757400915336995064,avomachado,https://twitter.com/avomachado/status/1757400915336995064,{},netral
388,388,388,388,Tue Feb 13 13:46:17 +0000 2024,1757400803013488759,- ketidaknetralan presiden uu atur - gagal bawaslu awas milu - kpu masalah tahap verifikasi evidence partai gelora - shadowing partai politik partai ummat partai pkn partai gelora - langgar etik ketua kpu,0,1,0,0,in,1329612378841829376,1757400788555772158,isrydd,https://twitter.com/isrydd/status/1757400803013488759,{},senang
390,390,390,390,Tue Feb 13 13:45:20 +0000 2024,1757400566588903500,u- berkas milu mungkin golput tetap hak kritik kerja bakal presiden memang rasa janji tepat progres nihil,0,0,0,0,in,3308652828,1757400566588903500,saturneedish,https://twitter.com/saturneedish/status/1757400566588903500,{},senang
391,391,391,391,Tue Feb 13 13:44:27 +0000 2024,1757400343774982383,jelang milu gelar besok rabu februari pasang anies-gus imin amin optimis menang pilih presiden wakil presiden realita jis,0,0,0,0,in,1627138310878658560,1757400343774982383,Jakajako452Jaka,https://twitter.com/Jakajako452Jaka/status/1757400343774982383,{},senang
393,393,393,393,Tue Feb 13 13:43:42 +0000 2024,1757400153764282821,malam punya pilih siapa pilih jadi presiden milu ikhlas hati hancur pihak-pihak usaha jadi oposisi kuat kontrol perintah,0,0,0,0,in,67545055,1757400153764282821,anndyriyan,https://twitter.com/anndyriyan/status/1757400153764282821,{},netral
394,394,394,394,Tue Feb 13 13:43:32 +0000 2024,1757400110953275892,rileks diri pak semangat pak moga bapak menang jadi presiden api milu kemarin pilih jokowi saat milu besok pilih ganjar,0,0,0,0,in,1556893854892457985,1757325275485151440,galangmhndra,https://twitter.com/galangmhndra/status/1757400110953275892,{},senang
395,395,395,395,Tue Feb 13 13:42:50 +0000 2024,1757399937195901142,karpet merah investasi proses jauh partisipasi publik justru eksploitasi sumber daya alam manusia presiden jokowi justru laku penyalahgunaan kuasa syarat capres-cawapres milu mahkamah konstitusi cawe-cawe bentuk,0,1,0,0,in,198228819,1757398447202902403,bem_unpad,https://twitter.com/bem_unpad/status/1757399937195901142,{},senang
397,397,397,397,Tue Feb 13 13:39:56 +0000 2024,1757399208838283618,besar dinasti politik jokowi bukan fokus u- negara presiden jokowi justru sibuk laku intervensi langsung milu saat ada masa perintah presiden jokowi sedang carut marut turun kualitas demokrasi indeks,0,2,2,1,in,198228819,1757398447202902403,bem_unpad,https://twitter.com/bem_unpad/status/1757399208838283618,{},senang
398,398,398,398,Tue Feb 13 13:39:45 +0000 2024,1757399159521611816,milu gue rada diam kaya enggak terlalu garang nyerocos nyata pilih awal diumumin kandidat bakal presiden cawapres hari jadi ubah sudut pandang gue tiga calon presiden awal kecewa harap,0,1,1,0,in,203827788,1757399159521611816,napbilaa,https://twitter.com/napbilaa/status/1757399159521611816,{},senang
403,403,403,403,Tue Feb 13 13:37:56 +0000 2024,1757398703739224497,pesta pilih presiden cepat selesai enggak capek banget sama timeline ribut saling sindir saling hate satu sama kembali timeline gua milu anjing wajah terlalu lelah jari tengah,0,0,0,0,in,1572307986277888003,1757398703739224497,vlucages,https://twitter.com/vlucages/status/1757398703739224497,{},senang
404,404,404,404,Tue Feb 13 13:37:14 +0000 2024,1757398529373561117,jujur gue reng minat sama milu soal gue ketemu presiden jajar kepala lain gue capai konklusi kalau semua atas penting penting sendiri jadi mau paslon berapa kalo jajar bobrok sama aja,0,1,0,0,in,1409153749205934084,1757398529373561117,momoyayaya,https://twitter.com/momoyayaya/status/1757398529373561117,{},senang
405,405,405,405,Tue Feb 13 13:36:36 +0000 2024,1757398368622653628,tahun lalu lawan pak jokowi pak prabowo jadi maksud mending pak prabowo jadi presiden skrg lah milu sekarang pak prabowo nyalonin diri tuh yaudah pilih wkwkwkwk,0,0,0,0,in,1361266974563602432,1757398368622653628,monologakun,https://twitter.com/monologakun/status/1757398368622653628,{},senang
406,406,406,406,Tue Feb 13 13:36:27 +0000 2024,1757398328617451523,pengin papua lebih baik mata pilih anies tokoh radikal garis keras dukung bayang anggota opm aktif kampanye ikut milu anies presiden dengar rangkul,0,0,0,2,in,87234890,1756996335201587459,alpha_n,https://twitter.com/alpha_n/status/1757398328617451523,{},senang
407,407,407,407,Tue Feb 13 13:35:33 +0000 2024,1757398105962762697,sahabat sekali segala rendah hati mohon unt milu besok pagi niat ihlas coblos calon presiden no anies r baswedan atas rela ucap terimakasih melipat tangan,0,0,0,1,in,1205142527528951808,1757398105962762697,Santoso6910,https://twitter.com/Santoso6910/status/1757398105962762697,{},netral
408,408,408,408,Tue Feb 13 13:35:29 +0000 2024,1757398085217431861,gue deg deg an gara gara besok milu akhir bakal ganti presiden resmi jadi top of the policy maker this country either beri harap hidup depan patah semangat tahan jadi backbone negara rapuh wajah menangis keras wajah menangis keras wajah menangis keras wajah menangis keras,0,0,0,0,in,1282664724333641731,1757398085217431861,slythercards,https://twitter.com/slythercards/status/1757398085217431861,{},senang
409,409,409,409,Tue Feb 13 13:34:38 +0000 2024,1757397871664746668,cuma keluar uneg milu inti siapa pilih kalian tanggung jawab atas ada sdm bangun infrastruktur memang penting please presiden lanjut lebih fokusdan gedein anggar bina kembang sdm,0,2,0,1,in,71760193,1757395013112402301,alansialan,https://twitter.com/alansialan/status/1757397871664746668,{},netral
411,411,411,411,Tue Feb 13 13:33:55 +0000 2024,1757397694480580796,tadi sore ikut aji ustadz tipis-tipis bahasa milu besok kata beliau siapa tetap jadi menang taat pimpin siapa presiden tetap manusia keluh,0,1,0,0,in,2472146192,1757397694480580796,YOOAMIMI,https://twitter.com/YOOAMIMI/status/1757397694480580796,{},senang
414,414,414,414,Tue Feb 13 13:32:49 +0000 2024,1757397414833787015,moga bapak menang milu besok pak jadi presiden indonesia aku bapak pimpin negara te- juang pak bapak pimpin tegas enggak mudah atur pihak mana jelas prestasi bapak indonesia cinta hati merah isyarat kemenangan warna kulit cerah,0,0,0,1,in,1188070937368788992,1757397414833787015,pekadeh,https://twitter.com/pekadeh/status/1757397414833787015,{},netral
416,416,416,416,Tue Feb 13 13:31:12 +0000 2024,1757397009508835392,tahu siapa dalang balik wacana jokowi periode tunda milu hingga panjang masa jabat presiden big data ndasmu wajah tersenyum sombong,0,0,1,3,in,1683573670822948864,1757079013506601333,DaddyMinusSugar,https://twitter.com/DaddyMinusSugar/status/1757397009508835392,{},senang
417,417,417,417,Tue Feb 13 13:30:52 +0000 2024,1757396923495891141,gue jokowi enggak gagal jadi presiden indo soal keluarga gue rasai sendiri bantu sembako blt which is era jokowi enggak adik kip lumayan buat bayarin buku tiap semester fyi gue enggak dukung jokowi waktu milu dulu jempol ke atas warna kulit cerah,0,0,3,26,in,1062585300109545472,1757381619365859837,heinnana,https://twitter.com/heinnana/status/1757396923495891141,{},senang
420,420,420,420,Tue Feb 13 13:29:24 +0000 2024,1757396557673169115,kalo sekarang segala deh dilakuin buat kuasa se yakin apa lu tahun pilih presiden kalo terlalu lebay begini dah se yakin apa next milu jalan se wajar obrak abrik keluarga jawa,0,0,0,0,in,1139919625703972865,1757396552505844117,Ur_baaeee,https://twitter.com/Ur_baaeee/status/1757396557673169115,{},marah
421,421,421,421,Tue Feb 13 13:29:13 +0000 2024,1757396510113943823,sahabat sekali segala rendah hati mohon unt milu besok pagi niat ihlas coblos calon presiden no anies r baswedan atas rela ucap terimakasih iring doa moga allah selalu tunjuk semua jalan benar amin melipat tangan,0,0,1,1,in,776096807726178304,1757396510113943823,Handoko_purwo95,https://twitter.com/Handoko_purwo95/status/1757396510113943823,{},netral
422,422,422,422,Tue Feb 13 13:28:43 +0000 2024,1757396384419053761,jelang milu rabu februari pasang anies-gus imin amin optimis menang pilih presiden wakil presiden,0,0,2,2,in,950256620541390848,1757396384419053761,FeriantoGatot,https://twitter.com/FeriantoGatot/status/1757396384419053761,{},netral
424,424,424,424,Tue Feb 13 13:27:45 +0000 2024,1757396138960060711,pilkada laksana serentak nder mungkin tahun depan paling nek wis iki milu presiden wapres pilkadae pilih bupatiwalkot sama gubernur paling,0,1,0,0,in,794103463395225600,1757395354742624359,berrysmilk,https://twitter.com/berrysmilk/status/1757396138960060711,{},senang
426,426,426,426,Tue Feb 13 13:25:10 +0000 2024,1757395490646503755,prediksi ricuh milu curang hingga campur tangan tuhan sebentar masyarakat indonesia rasa pesta demokrasi pilih presiden wakil presiden periode - baca,0,0,0,0,in,1674289887053512704,1757395490646503755,indigo_cumicumi,https://twitter.com/indigo_cumicumi/status/1757395490646503755,{},netral
427,427,427,427,Tue Feb 13 13:23:59 +0000 2024,1757395192557244645,kapai repot-repot milu pak lantik langsung jadi presiden mau hemat anggar kata,0,2,0,1,in,1246646720408072194,1757387647000178925,RakadotID,https://twitter.com/RakadotID/status/1757395192557244645,{},senang
430,430,430,430,Tue Feb 13 13:21:09 +0000 2024,1757394478154031309,besok milu salah satu hari banyak hari jalan pilih presiden periode baru enggak expect apa apa gue keluarga dukung amin kalau amin enggak takdir lindung bangsa gue keluarga cuma kencang sabuk termksh,0,0,0,0,in,1485283182069305344,1757394478154031309,Michazhr94,https://twitter.com/Michazhr94/status/1757394478154031309,{},netral
431,431,431,431,Tue Feb 13 13:20:39 +0000 2024,1757394352261976291,besok milu ayo siap hati masingmasing yaa kalo pilih menang bahagia jangan lupa tetap kritisi tagih janji ditengahtengah kagum yaa kalau kalah yaa ikhlas junjung presiden baru api api api,0,1,0,0,in,1512435208187899911,1757394352261976291,Ms_Anonymsjd,https://twitter.com/Ms_Anonymsjd/status/1757394352261976291,{},senang
434,434,434,434,Tue Feb 13 13:20:00 +0000 2024,1757394191016169967,milu paling buruk jatuh perintah presiden jokowi,0,0,0,0,in,1451086969333706752,1757330596655948234,YojiIis,https://twitter.com/YojiIis/status/1757394191016169967,{},marah
435,435,435,435,Tue Feb 13 13:20:00 +0000 2024,1757394189459820642,jumlah tugas bawa periksa kotak suara distribusi perlu pilih umum milu jelang milu jakarta februari pilih presiden indonesia tahun gelar februari,0,0,0,0,in,3271146871,1757394189459820642,XHIndonesia,https://twitter.com/XHIndonesia/status/1757394189459820642,{},senang
436,436,436,436,Tue Feb 13 13:19:47 +0000 2024,1757394136876093572,yuk kawal milu jangan lupa besok ada milu guna hak suara kamu baik pantau quick count milu sobat bisnis,1,4,0,0,in,118646322,1757394136876093572,Bisniscom,https://twitter.com/Bisniscom/status/1757394136876093572,{},netral
437,437,437,437,Tue Feb 13 13:19:04 +0000 2024,1757393956844057018,woeee good milu invention walaupun telat buat gaktau besok bakal nyoblos siapa presiden sesuai dapil masing you can open this website pilih daerah tempat kalian bakal surat suara bakal dapat besok,0,1,1,10,in,1393463002607734785,1757393956844057018,sealedpromise,https://twitter.com/sealedpromise/status/1757393956844057018,{},senang
440,440,440,440,Tue Feb 13 13:18:20 +0000 2024,1757393773171290202,inshaaallah besok ustadz hadiah indah lgyaitu anies baswedan jadi presiden muhaimin iskandar jadi wakil presiden ustadz jadi dpr ri pks menang milu,0,0,0,5,in,1417832843737067521,1757374738815701036,keynara181,https://twitter.com/keynara181/status/1757393773171290202,{},senang
442,442,442,442,Tue Feb 13 13:17:36 +0000 2024,1757393586285597181,milu bahkan akhir kemarin gibran omong tenang pak sini gua dukung prabowo lihat debat lihat kampanye enggak tau paling jijik lihat presiden ikut kampanye akhir mundur dukung prabowo,0,1,0,0,in,91588310,1757393586285597181,Tiyyo,https://twitter.com/Tiyyo/status/1757393586285597181,{},senang
443,443,443,443,Tue Feb 13 13:16:05 +0000 2024,1757393204230734028,jelang milu besok rabu lalu doa kiaimasyayikhamp rakyat paslon optimis mjd presiden amp wapres bukti nyata kampanye trkhr jis juta lebih tiket habis dpesan hai waktu mnt sj pilih cerdas,0,0,1,1,in,1592051454176419841,1757356659750621501,FirdausSelatan,https://twitter.com/FirdausSelatan/status/1757393204230734028,{},senang
444,444,444,444,Tue Feb 13 13:12:59 +0000 2024,1757392423385497950,jelang milu gelar besok rabu februari pasang anies-gus imin amin optimis menang pilih presiden wakil presiden know,0,0,0,1,in,1204235875611103232,1757392423385497950,udisuhaedi,https://twitter.com/udisuhaedi/status/1757392423385497950,{},senang
446,446,446,446,Tue Feb 13 13:11:22 +0000 2024,1757392019310465283,ah enggak apaapa lah bg cuma langgar atur masa tenang milu atur soal kampanye menteri presiden hrd cuti dulu kampanye enggak info kok enggak tau cuti gibran tetap terima jadi cawapres padahal cukup umur oke santai aja,0,1,0,3,in,1193905088596545536,1757048126932951486,Perusuh_Handal,https://twitter.com/Perusuh_Handal/status/1757392019310465283,{},netral
448,448,448,448,Tue Feb 13 13:10:36 +0000 2024,1757391823730090448,next milu ha- lebih mudah u- pindah tps via online gagal deh pilih presiden,0,0,0,0,in,1114560560,1757391823730090448,penadahkangen,https://twitter.com/penadahkangen/status/1757391823730090448,{},senang
449,449,449,449,Tue Feb 13 13:10:00 +0000 2024,1757391672827363714,jumlah tugas bawa kotak suara distribusi perlu pilih umum milu jelang milu jakarta februari pilih presiden indonesia tahun gelar februari,0,0,0,1,in,3271146871,1757391672827363714,XHIndonesia,https://twitter.com/XHIndonesia/status/1757391672827363714,{},senang
453,453,453,453,Tue Feb 13 13:08:14 +0000 2024,1757391230957494633,mekar kaltara kan tahun asumsi gue orang bodoh nih tuh pak surabaya baru milu jadi ganti presiden kan akhir ikut milu nya tahun enggak sih,1,0,3,4,in,1649491638312640512,1757275254601461986,Jokerzzz25,https://twitter.com/Jokerzzz25/status/1757391230957494633,{},netral
456,456,456,456,Tue Feb 13 13:06:23 +0000 2024,1757390764672495680,kenceng doa milu jalan jujur adil indonesia lebih baik pak anies amp gus imin jadi presiden wakil presiden ri,0,5,0,0,in,703803567929331714,1757390764672495680,fauzie_amril,https://twitter.com/fauzie_amril/status/1757390764672495680,{},senang
457,457,457,457,Tue Feb 13 13:05:29 +0000 2024,1757390538943480007,jasa coblos milu sini murah jamin amanah via transfer baca presiden k dpd k dpr ri k dpr prov k dprd k paket coblos suara k serius dm hak gue gakepake gue golput mending bayarin sini murah nego,0,0,0,0,in,1159811885329309697,1757390538943480007,frdnabidzar,https://twitter.com/frdnabidzar/status/1757390538943480007,{},netral
