Unnamed: 0.3,Unnamed: 0.2,Unnamed: 0.1,Unnamed: 0,created_at,id_str,full_text,quote_count,reply_count,retweet_count,favorite_count,lang,user_id_str,conversation_id_str,username,tweet_url,pattern_counts,label
748,748,748,748,Tue Feb 13 07:44:54 +0000 2024,1757309858389557594,serius tanya mungkin konyol memang serang fajar kayak bagaimana sih te- orang serang fajar kriteria kalau enggak salah ingat ikut milu presiden pertama tahun enggak pernah lihat begini wajah tersenyum lebar dan berkeringat,0,3,0,0,in,158907881,1757309858389557594,anjanijajan,https://twitter.com/anjanijajan/status/1757309858389557594,{},netral
749,749,749,749,Tue Feb 13 07:44:14 +0000 2024,1757309692827857253,jelang milu presiden bagibagi bansos salah satu beras bain pndukungnya anggap tndakan benar akhir banyak caleg tiru lngkah presiden bagibagi beras endingnya beras langkah,0,0,0,0,in,1371809524177268736,1756988586904220064,Ampundj90813724,https://twitter.com/Ampundj90813724/status/1757309692827857253,{},marah
750,750,750,750,Tue Feb 13 07:43:14 +0000 2024,1757309440666239480,lampu mobil polisi uang bersayap presiden joko widodo naik tunjang kerja pegawai bawaslu hari jelang milu putus sebut tuang atur presiden pres nomor tahun ini daftar tunjang kerja menunjuk ke bawah,1,0,0,1,in,46693036,1757309440666239480,inilahdotcom,https://twitter.com/inilahdotcom/status/1757309440666239480,{},marah
751,751,751,751,Tue Feb 13 07:43:04 +0000 2024,1757309398387724376,milu seram banget sumpah tingkat presiden salah omong kelar,0,0,0,0,in,1482245747957731329,1757309398387724376,Beau_2203,https://twitter.com/Beau_2203/status/1757309398387724376,{},marah
752,752,752,752,Tue Feb 13 07:42:43 +0000 2024,1757309309732692328,presiden jokowi tekan penting integritas kpps antusiasme masyarakat jelang milu,0,0,0,0,in,1515216896408559617,1757309309732692328,KabaSurau,https://twitter.com/KabaSurau/status/1757309309732692328,{},netral
753,753,753,753,Tue Feb 13 07:40:59 +0000 2024,1757308872413642940,pasal mana langgar mas pasal ayat uu milu sebut lama masa tenang bagaimana maksud pasal uu milu laksana serta danatau tim kampanye milu presiden amp wakil presiden larang menjanjikanmemberikan imbal pilih,0,0,0,0,in,1313671561178570752,1757048126932951486,DirgaMd1,https://twitter.com/DirgaMd1/status/1757308872413642940,{},netral
754,754,754,754,Tue Feb 13 07:39:10 +0000 2024,1757308416975044826,tanya timing hari milu ganti pj langsung tunjuk presiden dong too fishy,0,2,0,5,in,812474640727609344,1757293806083514590,Miebobabaso,https://twitter.com/Miebobabaso/status/1757308416975044826,{},netral
755,755,755,755,Tue Feb 13 07:38:10 +0000 2024,1757308164851335549,presiden jokowi pesan tugas kpps jelang milu kata,0,8,1,4,in,71436318,1757308164851335549,KompasTV,https://twitter.com/KompasTV/status/1757308164851335549,{},netral
756,756,756,756,Tue Feb 13 07:37:16 +0000 2024,1757307938967105741,presiden keluar kepress naik gaji tunjang bawasli selaku aparatur libat milu enggak naik gaji dokter,0,0,0,0,in,212920650,1757307938967105741,FahriAACkw,https://twitter.com/FahriAACkw/status/1757307938967105741,{},netral
757,757,757,757,Tue Feb 13 07:37:05 +0000 2024,1757307894318674397,resmi presiden jokowi naik tunjang tugas bawaslu jelang milu,0,0,0,0,in,1171370786,1757307894318674397,Inanewsindo,https://twitter.com/Inanewsindo/status/1757307894318674397,{},netral
758,758,758,758,Tue Feb 13 07:36:07 +0000 2024,1757307649526538549,halo umum hubung tetap putus presiden pres no tahun hari milu tahun hari libur nasional layan kantor tanah kabupaten madiun tutup hari rabu tanggal februari,0,0,0,0,in,953183761604083715,1757307649526538549,kantahkabmadiun,https://twitter.com/kantahkabmadiun/status/1757307649526538549,{},netral
759,759,759,759,Tue Feb 13 07:35:34 +0000 2024,1757307511148105755,besok deh milu aku bingung pilih presiden wkwk,0,1,0,0,in,1199986451909230592,1757307511148105755,sseojla,https://twitter.com/sseojla/status/1757307511148105755,{},netral
760,760,760,760,Tue Feb 13 07:34:34 +0000 2024,1757307259389161757,film dirty vote sebut langgar laku paslon kait presiden jokowi bawaslu sebut langgar milu benar langgar milu laku paslon arti,0,5,11,24,in,1172676209995657216,1757303899160301603,Belok_dong,https://twitter.com/Belok_dong/status/1757307259389161757,{},netral
761,761,761,761,Tue Feb 13 07:34:09 +0000 2024,1757307154279932346,jelang milu presiden jokowi kirim pesan kpps,0,0,0,0,in,58880688,1757307154279932346,pikiran_rakyat,https://twitter.com/pikiran_rakyat/status/1757307154279932346,{},netral
762,762,762,762,Tue Feb 13 07:34:01 +0000 2024,1757307121836900594,coba cek statistik milu enggak pilih legislatif pilih presiden pilih partai koalisi sama jokowi enggak pilih jokowi fungsi legislatif ha- kontrol perintah bukan tukang stempel doang,0,0,0,0,in,1696021858645344256,1757253075402965111,ultrainsthink,https://twitter.com/ultrainsthink/status/1757307121836900594,{},netral
763,763,763,763,Tue Feb 13 07:30:28 +0000 2024,1757306227246440614,kadaluwarsa kok habis milu wajah menikmati bukti memang sekarang capres bikin komitmen bakal adil minimal naikin kasus prabowo wajah menikmati tambah klaim beberapa orang hilang kembalicapres mana selesai kasus jadi presiden wajah menikmati,0,0,1,5,in,1551133078017302529,1757219336073445637,sobatsebat16,https://twitter.com/sobatsebat16/status/1757306227246440614,{},netral
764,764,764,764,Tue Feb 13 07:27:05 +0000 2024,1757305376280871254,koreksi jadi curang masif sistematis brutal selenggara milu presiden,0,0,0,0,in,2386454641,1757305376280871254,shxxisme,https://twitter.com/shxxisme/status/1757305376280871254,{},netral
765,765,765,765,Tue Feb 13 07:26:59 +0000 2024,1757305351001764348,ira uu larang presiden ikut nyoblos milu terima kasih pak ikut partisipasi pesta demokrasi sehat selalu salam damai,0,0,1,1,in,2858263997,1757040816135262240,ones_tan,https://twitter.com/ones_tan/status/1757305351001764348,{},netral
766,766,766,766,Tue Feb 13 07:23:03 +0000 2024,1757304361963987390,allah buru milu allah aku pengin guyub sama konco konco allah buru presiden baru allah kayak omong agama tuh ngafir ngafirin orang ah wajah meleleh wajah meleleh,0,0,0,0,in,171850841,1757304361963987390,sweetly97ies,https://twitter.com/sweetly97ies/status/1757304361963987390,{},netral
767,767,767,767,Tue Feb 13 07:21:02 +0000 2024,1757303852569911644,soal milu serentak jadi banyak pilih kertas abu presiden kertas kuning dpr-ri kertas merah dpd kertas biru dprd prov kertas hijau dprd kabkota,0,0,0,0,in,1181812658263089152,1757290548137009402,haziaaaaaf,https://twitter.com/haziaaaaaf/status/1757303852569911644,{},senang
768,768,768,768,Tue Feb 13 07:18:05 +0000 2024,1757303112887656837,quick discount milu wajah pesta kabar gembira raya milu presiden tahun terbit baca spesial diskon buku mulai hingga lho wajah terpukau catat langsung tanggal februari,11,5,37,86,in,713696309815828481,1757303112887656837,penerbitbaca,https://twitter.com/penerbitbaca/status/1757303112887656837,{},netral
769,769,769,769,Tue Feb 13 07:15:20 +0000 2024,1757302419917353218,keluarga gue bapak gue doang beda pilih presiden jadi kalo bahas milu belio enggak ajak kasihan wajah menangis keras,0,2,0,0,in,1085186886715334657,1757302419917353218,bubunyabaek,https://twitter.com/bubunyabaek/status/1757302419917353218,{},netral
770,770,770,770,Tue Feb 13 07:13:50 +0000 2024,1757302040995533285,makanya deh penting milu lancar aman pilih paling baik baekhyun konser kapan aja presiden tahun sekali fokus milu presiden pilih ngablu kpop gaenak entar janganjangan pajak jadi gede wajah pusing karena mabuk,0,1,0,0,in,1308808336876343296,1757286090669727848,Maytinkerbelll,https://twitter.com/Maytinkerbelll/status/1757302040995533285,{},netral
771,771,771,771,Tue Feb 13 07:13:26 +0000 2024,1757301940726399188,kalau milu curang dulu pak prabowo jadi presiden nyata milu tetap hitung tiap tps quick count hasil sama sesuai awas benarpercaya mana dirty vote hasil tps kpps,0,0,0,0,in,1274159688,1757043490733928452,edwardus4,https://twitter.com/edwardus4/status/1757301940726399188,{},netral
772,772,772,772,Tue Feb 13 07:07:09 +0000 2024,1757300358966366596,unggul ganjar - mahfud pilih presiden luar negeri beri energi positif hadap milu negeri ganjar pranowo - betul rakyat buat lebih rakyat,0,0,0,0,in,1689948590603632640,1757300358966366596,ratunindyaaa,https://twitter.com/ratunindyaaa/status/1757300358966366596,{},marah
773,773,773,773,Tue Feb 13 07:07:05 +0000 2024,1757300342159818901,innalillahi wa inna ilaihi rojiuun rakyat semua ingat wafat tugas kpps amp gt sakit berat milu samasama jaga tugas kpps esok hari tetap sehat selamat rakyat jaga perintah presiden bakal peduli,2,47,264,632,in,1502822366946402304,1757300342159818901,DokterTifa,https://twitter.com/DokterTifa/status/1757300342159818901,{},netral
774,774,774,774,Tue Feb 13 07:06:40 +0000 2024,1757300238002556929,jelas pihak menteri masuk presiden manfaat bansos fasilitas negara milu benar ygy sbnernya jelas salah anak pakdhe lolos jadi cawapres tengkorak,0,0,0,0,in,1509355183163072514,1757300238002556929,lixlya,https://twitter.com/lixlya/status/1757300238002556929,{},marah
775,775,775,775,Tue Feb 13 07:06:31 +0000 2024,1757300199922577509,dilaporin asumsi hakim mahkamah konstitusi dpr presiden ma kalo asumsi tuduh arah presiden anggap beking curang milu logika lawan suara menang mana,0,1,0,0,in,1132777688182034432,1757290910042447944,gitsogut,https://twitter.com/gitsogut/status/1757300199922577509,{},netral
776,776,776,776,Tue Feb 13 07:05:40 +0000 2024,1757299985065074972,banyak enggak tau alur masalah semua mulai gera periode rencana undur milu hingga sekarang akhir calon anak presiden siapa paling keras tolak semua pdip padahal pdip ha- paling untung semua libat kader pdip,0,0,0,2,in,1223179595228180480,1757299985065074972,tjacing,https://twitter.com/tjacing/status/1757299985065074972,{},netral
777,777,777,777,Tue Feb 13 07:04:39 +0000 2024,1757299730189840496,apa hubung sih semua bahas soal covid jadi masa perintah presiden lo jelas usul minta tanggungjawabnya program jadi mandeg dite-in milu butuh biaya gede enggak tau bansos benar jomplang wakwok biar savage om,0,0,0,0,in,2757797459,1757284729324536155,freedeveryego,https://twitter.com/freedeveryego/status/1757299730189840496,{},netral
778,778,778,778,Tue Feb 13 07:02:36 +0000 2024,1757299215485767838,h- coblos milu presiden jokowi naik tunjang tugas bawaslu,0,0,0,0,in,155169715,1757299215485767838,soloposdotcom,https://twitter.com/soloposdotcom/status/1757299215485767838,{},senang
779,779,779,779,Tue Feb 13 07:00:33 +0000 2024,1757298696864301069,presiden dukung tertawa terbahak-bahak milu kok enggak netral blog tertawa terbahak-bahak,0,0,0,0,in,1707019353282252800,1756986103582826517,madridista85362,https://twitter.com/madridista85362/status/1757298696864301069,{},netral
780,780,780,780,Tue Feb 13 07:00:04 +0000 2024,1757298575435059687,guru besar suara sebut partisan lalu presiden hari jelang coblos naik tunjang bawaslu sibuk makan timses anak sayang menguyur bansos masa milu layak sebut apa,0,1,0,0,in,2258721770,1757298575435059687,Muftiqbal,https://twitter.com/Muftiqbal/status/1757298575435059687,{},netral
781,781,781,781,Tue Feb 13 06:59:22 +0000 2024,1757298400448667801,tag jaket boomber racun shopee varsity lakers basket zona jajan zona belanja shopping checkout cowok bawaslu anies ganjar prabowo imin mahfud gibran moots februari kpu kpps golput milu presiden koreansmut,0,0,0,0,in,1671396485454520320,1757298400448667801,vousther,https://twitter.com/vousther/status/1757298400448667801,{},netral
782,782,782,782,Tue Feb 13 06:57:02 +0000 2024,1757297812784693387,teman adek gue ribut sama nyokap nya perkara beda pilih presiden anjirr nyokap nya mara ngomel te- anak enggak kasih makan anak enggak mau ikut pilih sama kayak nyokap nya anjing kata gua tehh milu tahun pecah emak anak,0,0,0,0,in,1618057423109115904,1757297812784693387,pecintakecapss,https://twitter.com/pecintakecapss/status/1757297812784693387,{},marah
783,783,783,783,Tue Feb 13 06:55:04 +0000 2024,1757297316976025634,koordinator staf khusus presiden ari dwipayana jelas alas naik tunjang kerja pegawai lingkung sekretariat jenderal badan awas milu bawaslu,0,0,0,0,in,68930552,1757297316976025634,mediaindonesia,https://twitter.com/mediaindonesia/status/1757297316976025634,{},marah
784,784,784,784,Tue Feb 13 06:54:47 +0000 2024,1757297248202096721,pengeras suara info milu warna kertas suara milu serentak pebruari hati abu-abu abu abu presiden hati merah merah dpd ri hati kuning kuning dpr ri hati biru biru dprd provinsi hati hijau hijau dprd kabupaten kotamadya,0,0,0,0,in,1667088705180561409,1757297248202096721,AlwiHusin,https://twitter.com/AlwiHusin/status/1757297248202096721,{},netral
785,785,785,785,Tue Feb 13 06:53:31 +0000 2024,1757296926851256778,besok milu wag diskusi soal pilih partai apa calegnya siapa apa terlalu banyak pilih kalau presiden mungkin clear,0,1,0,0,in,870684607,1757296926851256778,arielkahhari,https://twitter.com/arielkahhari/status/1757296926851256778,{},netral
786,786,786,786,Tue Feb 13 06:52:45 +0000 2024,1757296737482653932,ha- presiden jokowi jangan pernah se kecap keluar statement perihal milu,0,0,0,0,in,1343849543264129025,1757296737482653932,bubursuroo,https://twitter.com/bubursuroo/status/1757296737482653932,{},netral
787,787,787,787,Tue Feb 13 06:52:36 +0000 2024,1757296699255718131,rabu tanggal februari hari libur nasional rangka pilih umum tahun mungut suara milu liput pilih presiden wakil presiden pilpres anggota dpr ri anggota dpd ri anggota dprd provinsi anggota dprd kabupatenkota,0,0,0,1,in,2728019124,1757296699255718131,dinarpus_jateng,https://twitter.com/dinarpus_jateng/status/1757296699255718131,{},netral
788,788,788,788,Tue Feb 13 06:52:33 +0000 2024,1757296684458287547,jokowi minta kpps kerja jujur adil kait mungut suara milu besok tegas presiden te- dukung kpu bawaslu dkpp,49,347,20,156,in,23343960,1757296684458287547,kompascom,https://twitter.com/kompascom/status/1757296684458287547,{},takut
789,789,789,789,Tue Feb 13 06:50:00 +0000 2024,1757296044516512060,milu bonus demografi artificial intelligence buat tentu pilih moga tulis jadi faktor timbang tentu pilih presiden,0,0,0,1,in,402520083,1757296044516512060,_mdpaul,https://twitter.com/_mdpaul/status/1757296044516512060,{},marah
790,790,790,790,Tue Feb 13 06:49:43 +0000 2024,1757295974559686691,perlu tahu memang hampir seluruh negara dunia kepala perintah pilih rakyat presidenperdana menteri semua pakai milu langsungmelalui wakil gantung bentuk perintah presidensialparlementer amp aspek-aspek lain sc,0,1,0,0,in,1315504143935520768,1757208291971920180,dieeuleliebt,https://twitter.com/dieeuleliebt/status/1757295974559686691,{},netral
791,791,791,791,Tue Feb 13 06:49:30 +0000 2024,1757295918339252726,tanding suwon fc vs persib bandung jadwal februari datang batal tepat hari milu presiden main persib libur tempat mungut suara tps,0,1,0,3,in,1264093518357598208,1757284716036993114,jebreeetmedia,https://twitter.com/jebreeetmedia/status/1757295918339252726,{},netral
792,792,792,792,Tue Feb 13 06:47:44 +0000 2024,1757295473864688107,anies baswedan anggap ramai film dokumenter dirty vote isi desain curang milu calon presiden nomor urut tegas curang -ak demokrasi buat hasil milu jadi cacat mantan gubernur dki jakarta,0,0,0,1,in,46693036,1757295473864688107,inilahdotcom,https://twitter.com/inilahdotcom/status/1757295473864688107,{},senang
793,793,793,793,Tue Feb 13 06:47:04 +0000 2024,1757295306050585043,apa jadi milu abah menang hati merah adil lihat jakarta apa abah laku kampanye cerdas rakyat minta satu bapak amanah jadi presiden adil indonesia,0,1,0,0,in,789856465175519232,1757294332384801089,TerrificJRP9,https://twitter.com/TerrificJRP9/status/1757295306050585043,{},netral
794,794,794,794,Tue Feb 13 06:45:37 +0000 2024,1757294941750063287,milu jeng valentine sarua tanggal jadi asa baringung kieu aden ek nyolok hela sih neng presiden hela nya wajah berpikir,1,0,0,0,in,1482227595597213698,1757294941750063287,aldiyansyah05,https://twitter.com/aldiyansyah05/status/1757294941750063287,{},netral
795,795,795,795,Tue Feb 13 06:45:23 +0000 2024,1757294881431851027,koar ngeluh dirty vote baru keluar pas mau tanggal milu kemaren antum pas tibatiba ngerubah putus buat calon wakil presiden buta huruf kemarin kalian kemarin punya tv memang gblk kalian,0,1,1,2,in,96492485,1757294881431851027,noviannanovha,https://twitter.com/noviannanovha/status/1757294881431851027,{},netral
796,796,796,796,Tue Feb 13 06:43:20 +0000 2024,1757294365658206698,enggak rasa video ambil tahun waktu pilih presiden milu serentak,0,1,0,0,in,122915026,1757294365658206698,turdus_merulaa,https://twitter.com/turdus_merulaa/status/1757294365658206698,{},netral
797,797,797,797,Tue Feb 13 06:41:30 +0000 2024,1757293903487914090,harga beras naik tinggi presiden kasih naik gaji bawaslu awas milu asa kenyang tidur nyenyak asu kuwi sikile papat harap loro mburi loro,1,8,3,11,in,1557384792777588737,1757293903487914090,MandiriBerkah99,https://twitter.com/MandiriBerkah99/status/1757293903487914090,{},marah
798,798,798,798,Tue Feb 13 06:37:02 +0000 2024,1757292781800956395,presiden menandatangani atur presiden pres kait tunjang kerja tukin pegawai sekretariat jenderal badan awas milu,9,0,0,12,in,1471027662529257472,1757292781800956395,kuatbacacom,https://twitter.com/kuatbacacom/status/1757292781800956395,{},netral
799,799,799,799,Tue Feb 13 06:32:39 +0000 2024,1757291675972714759,alhamdulillah pak berita sejuk netralitas polri sangat penting langsung milu jurdil jaga marwah polri presiden jokowi jelas amp terang terang nepotisme amp pihak paslon semangat polri jempol ke atas,0,0,0,0,in,1747495151659036672,1756714473006768466,bagasfailla,https://twitter.com/bagasfailla/status/1757291675972714759,{},netral
800,800,800,800,Tue Feb 13 06:31:57 +0000 2024,1757291502261109116,pilih umum laksana besok rabu februari rupa momen penting demokrasi indonesia milu kali laku serentak pilih presiden wakil presiden legislatif dpr ri dpd dprd provinsi dprd kotakabupaten,0,0,0,0,in,773006882977882112,1757291502261109116,DPU_Temanggung,https://twitter.com/DPU_Temanggung/status/1757291502261109116,{},marah
801,801,801,801,Tue Feb 13 06:31:16 +0000 2024,1757291330353651889,anda anis-bobby prabowo-gibran ganjar-kaesang milu damai presiden menteri gubernur bupati walikota netral wajah gembira dengan mata bahagia,0,0,0,0,in,889749680044638208,1757291330353651889,almildaGilang,https://twitter.com/almildaGilang/status/1757291330353651889,{},marah
802,802,802,802,Tue Feb 13 06:31:06 +0000 2024,1757291288804884919,nder kalau milu presiden otomatis nyoblos caleg dapil dprd dpr gitu kan masa jabat jabat sama presiden bareng lantik bareng,0,0,0,0,in,1365312980720656385,1757291288804884919,tyongsahi,https://twitter.com/tyongsahi/status/1757291288804884919,{},netral
803,803,803,803,Tue Feb 13 06:29:57 +0000 2024,1757290999506944111,pemberitahuan hubung hari libur nasional cuti sama rangka ingat mungut suara serentak milu presiden wakil presiden layan satpas tutup tanggal februari,0,0,0,0,in,1495942681016487940,1757290999506944111,lantasresblikot,https://twitter.com/lantasresblikot/status/1757290999506944111,{},marah
804,804,804,804,Tue Feb 13 06:26:14 +0000 2024,1757290064504295851,periode banteng menang milu legislatif presiden hasil hasil rekam jejak polulis wajah menjulurkan lidah wajah gembira berurai air mata mending ikhtiar coba tawar wajah gembira berurai air mata masak pilih gagal,0,1,0,0,in,1678178122343272448,1757247376107163742,Georgiohan,https://twitter.com/Georgiohan/status/1757290064504295851,{},marah
805,805,805,805,Tue Feb 13 06:24:58 +0000 2024,1757289746030903469,serah cari presiden bukan dpr milu coblos presiden bukan dpr jelas prabowo ajar jadi mau laku politisasi agama dampak negatif sedngkan anis ajar masa lalu,0,1,0,0,in,776232608875159552,1756718908583915635,isna_mpol,https://twitter.com/isna_mpol/status/1757289746030903469,{},netral
806,806,806,806,Tue Feb 13 06:24:58 +0000 2024,1757289742318899467,baru kali se-degan mau milu khusus presiden moga milu jalan damai lancar adil amin tangan diangkat dan dirapatkan bersama,0,0,0,0,in,2348069444,1757289742318899467,luna_chakim,https://twitter.com/luna_chakim/status/1757289742318899467,{},netral
807,807,807,807,Tue Feb 13 06:21:53 +0000 2024,1757288968419524960,presiden jokowi ibu negara iriana joko widodo terima surat undang mungut suara milu rabu besok,0,1,0,0,in,2340155395,1757288966221697492,suaradotcom,https://twitter.com/suaradotcom/status/1757288968419524960,{},netral
808,808,808,808,Tue Feb 13 06:20:09 +0000 2024,1757288533222629723,naik tukin bawaslu presiden jalan turun sikap netral bawaslu pemilukayanya,0,0,0,0,in,1016576640770441222,1757288533222629723,iparadamlevine,https://twitter.com/iparadamlevine/status/1757288533222629723,{},netral
809,809,809,809,Tue Feb 13 06:19:00 +0000 2024,1757288241924120578,edar buletin digital muat tulis kapolri jenderal polisi drs listyo sigit prabowo hendak menang salah satu calon presiden milu berita bohong alias hoax,0,0,0,0,in,1447608691394428929,1757288241924120578,Suroboy96849901,https://twitter.com/Suroboy96849901/status/1757288241924120578,{},marah
810,810,810,810,Tue Feb 13 06:17:55 +0000 2024,1757287971739533496,kalo wowo menang alas buat kalian makzul sih wowoini pernah jadi thd presiden assad menang milu suriahudh baca gera klian dasar begundal negara barat,0,0,0,0,in,171505851,1756968800086524291,mmarleyt,https://twitter.com/mmarleyt/status/1757287971739533496,{},netral
811,811,811,811,Tue Feb 13 06:17:17 +0000 2024,1757287811919868080,masa bakti tuntas tahun loh kok provokator kurang kerja guna hak pilih milu istirahat masa tenang besok baru kalian pilih ganti presiden jokowi,0,0,0,0,in,933886564538740736,1757287811919868080,PutraKeong4,https://twitter.com/PutraKeong4/status/1757287811919868080,{},takut
812,812,812,812,Tue Feb 13 06:14:35 +0000 2024,1757287131096224063,milu presiden dua gue gue benarbenar lupa kalo kertas,0,0,0,0,in,1321272758492295168,1757287131096224063,crispytempuraa,https://twitter.com/crispytempuraa/status/1757287131096224063,{},netral
813,813,813,813,Tue Feb 13 06:13:19 +0000 2024,1757286813956559298,kepala staf tni ad jenderal tni maruli simanjuntak sebut situasi aman jelang hari coblos milu presiden sangat kendali turut kondisi lapang jauh beda medsos cenderung ramai bagai isu,0,0,0,1,in,3306771829,1757286813956559298,CNNIDdaily,https://twitter.com/CNNIDdaily/status/1757286813956559298,{},netral
814,814,814,814,Tue Feb 13 06:13:14 +0000 2024,1757286792913735711,lapaor bapak presiden gus men seru milu damai doa sama pilih mula,0,0,0,2,in,1644167347924779008,1757286792913735711,InmasKemenagAru,https://twitter.com/InmasKemenagAru/status/1757286792913735711,{},netral
815,815,815,815,Tue Feb 13 06:11:35 +0000 2024,1757286375702040755,ustaz adi hidayat ungkap tipikal presiden wakil presiden pilih milu,0,3,2,5,in,55507370,1757286375702040755,tvOneNews,https://twitter.com/tvOneNews/status/1757286375702040755,{},netral
816,816,816,816,Tue Feb 13 06:11:02 +0000 2024,1757286238791557595,fadli zonk purapura zonk zonk betul enggak simak apa tuntut akdemisi prihatin atas -ak demokrasi akibat dinasti keluarga cawe cawe presiden sengkarut marut curang selenggara milu,0,0,0,0,in,1714170894661337088,1756931429760692720,KusumaRadito,https://twitter.com/KusumaRadito/status/1757286238791557595,{},netral
817,817,817,817,Tue Feb 13 06:07:59 +0000 2024,1757285470931947877,gue kuliah lu enggak beda fakta sama opini enggak sih fakta pjs tunjuk presiden sesuai uu milu bawa opini konsolidasi milu bukti kasih satu apa iya semua pjs satu sampel bukan arti benar makanya betul hipotesis,0,2,0,0,in,1399561118725541890,1757077836899483681,ArlyImmanuel,https://twitter.com/ArlyImmanuel/status/1757285470931947877,{},netral
818,818,818,818,Tue Feb 13 06:06:33 +0000 2024,1757285107742949742,besok milu kalo pilih chenle aku mau jadi presiden wajah tersenyum wajah tersenyum,0,0,0,0,in,1713414299178487808,1757285107742949742,haileyqueenme,https://twitter.com/haileyqueenme/status/1757285107742949742,{},netral
819,819,819,819,Tue Feb 13 06:05:18 +0000 2024,1757284796739518752,presiden teken pres naik tunjang pegawai bawaslu h- hari milu the real serang fajarr tertawa terbahak-bahak,0,0,0,0,in,1373195760565587972,1757284796739518752,mocaccinoooo,https://twitter.com/mocaccinoooo/status/1757284796739518752,{},netral
820,820,820,820,Tue Feb 13 06:05:11 +0000 2024,1757284767400349804,belum bapanas ban bantu pangan beras perintah bagi presiden joko widodo jelang milu beban suplai beras pasar,2,11,0,1,in,23343960,1757284767400349804,kompascom,https://twitter.com/kompascom/status/1757284767400349804,{},senang
821,821,821,821,Tue Feb 13 06:03:47 +0000 2024,1757284413011083433,milu pertama aku tahun zaman pak surabaya jadi presiden kalo kalian tahun berapa wajah dengan tangan menutup mulut,19,64,2,12,in,37871310,1757284413011083433,agannyi,https://twitter.com/agannyi/status/1757284413011083433,{},netral
822,822,822,822,Tue Feb 13 06:01:48 +0000 2024,1757283913742094407,aman milu menang presiden lanjut,0,0,0,0,in,1741331383480619008,1757283913742094407,AnggaPutri59910,https://twitter.com/AnggaPutri59910/status/1757283913742094407,{},netral
823,823,823,823,Tue Feb 13 06:01:02 +0000 2024,1757283721600966773,presiden joko widodo jokowi naik tunjang kerja alias tukin pegawai badan awas pilih umum bawaslu jelang milu,5,17,9,22,in,18129942,1757283721600966773,tempodotco,https://twitter.com/tempodotco/status/1757283721600966773,{},netral
824,824,824,824,Tue Feb 13 06:00:32 +0000 2024,1757283593456603422,asa dirty vote ngebahas milu seluruh kpu sama bawaslu presiden bahas kok malah bilang sekali bahas semua paslon jangan paslon tentu aja eh ujung nya sih doi enggak lihat fullnya cuma tonton cuplik via tiktok doang,0,1,0,0,in,992605732515201024,1757283593456603422,arazzaria,https://twitter.com/arazzaria/status/1757283593456603422,{},marah
