,label,tweet,masked_word_count,pattern_counts
990,sadness,maaf segala khilaf beliau masa hidup beliau pulang bulan baik moga almarhum tempat tempat baik insyaallah khusnul khatimah amin,0,{}
991,sadness,salah sangka hasil buah kekecawaan kecewa dasar tak punya alas kuat semua situasi clear jadi lucu ingat,0,{}
992,sadness,dulu wa buat pacar isi fotofoto selfie aktivitas pacar tunjang ldr sekarang pacar hilang foto-foto ganti sama foto citra orang kerja lapang preview desain,0,{}
993,sadness,salah sangka hasil buah kecewa kecewa dasar tak punya alas kuat semua situasi clear jadi lucu ingat,0,{}
994,fear,berlajar prosedur bedah sekali makan sahur ah buka youtube nonton proses bedah dentoalveolar ga sanggup makan nutup laptop udahlah makan dulu makan deg deg an,0,{}
995,anger,kayak te- netijen kalau kasus leceh seksual selalu korban salah pdhl posisi korban lo sederhana enggak orang mau jadi korban gue respect si sama cara enggak sih laku malu ingat buat,0,{}
996,anger,didik punya budaya malu kalau perkara kelahi kandang lawan kandang macan naluri nenek moyang n,0,{}
997,sadness,semua hancur ketika buah foto akhir aku paham arti foto sebut,0,{}
998,sadness,dulu wa isi kalimat manis redam penat sembul semangat mood booster sekarang gombal hilang ganti omel versi digital bos suka pedas bikin trauma buka wa,0,{}
999,sadness,buka puasa cuman minum sama makan goreng te- tengah malam makan bakso cabe rawit sendok makan lebih habis perut langsung lilit,0,{}
1000,anger,instagram hits hype parah kece lah followers banyak cakep cakep bikin story rajin gilir stok foto habis lari gue ajak hunting sana sini kan anying lu pikir gengsi bawa mati,0,{}
1001,anger,please jangan bawa nama anak muda bro kalau debat pak tak pakai data nyinyir serasa generasi milenial kurang literatur,3,{'USERNAME': 3}
1002,anger,ooo kalo berisik emamg mending sumpel si kalo kntr gue sepi banget ki jepangnya enggak doyan dgrin lagu jadi mau enggak mau pakai sumpel bosan abis,2,{'USERNAME': 2}
1003,happy,alhamdulillah listrik nyala kembalisaya warga sedang takziah diam almarhum warga wafat terima kasih cc,5,"{'USERNAME': 5, 'URL': 1}"
1004,happy,satpam komplek memang perhati banget hampir enggak pernah nanyain pak pulang ga kala jam atas jam malam motor tak kunjung nangkring teras,0,{}
1005,happy,jadi ingat waktu kecil pas awal ajar sepeda awal dipegangin belakang eh perlahan akhir lepas kayuh sepeda sendiri sendiri detik hehe,0,{}
1006,anger,bikin surat hilang kan cuma hari habis datang dukcapil minta dibuatin suket nya usaha dulu dong masak apaapa bilang bulan ngu-nya enggak lama kok kalo benarbenar niat hehe,1,{'USERNAME': 1}
1007,anger,bpip badan beking instruksi presiden enggak perlu bpip pembinaapakah orangorang bpip super pancasilais tau semua apa ucap ketua anggotanyasdh pancasila mending uang efektif guru sekolah,0,{}
1008,sadness,mata kiri nih selalu kena masalah entah bintit sakit benjol ujung pelipis mata memang kecil kalau benjol kanan kiri sih rasa tuhagak siksa butuh buat kerja rodi,0,{}
1009,anger,nyata paling ganggu telinga malam keluar mulut jubir perintah ali mochtar ngabalin perintah representasi tuhan muka bumi makin dekaden nalar demokrasi kalo pandang biar kuasa istana nyata sama pak tua tuh,0,{}
1010,happy,mending suruh makan tali kopling apa duit miliar kalo gua mah mending duit miliar enak duit buat beli tali kopling jadi gua makan tali kopling puas,0,{}
1011,sadness,kabar keluarga madiun gajasdi mudik bekas tiket beli sekian bulan batal and me gapunyaa tiket mudik madiunnn hehhehee,0,{}
1012,sadness,gila anjir froze her eggs before marrying huhu indak nikah dulu sih mbak malah kira anak calon suami huhu,0,{}
1013,love,jangan pernah serah ku kan selalu sini sama sayang lawan dunia jangan pernah rendah kau tak pernah sendiri sama sayang darah sama,0,{'URL': 1}
1014,anger,te- memang klub lo enggak numpang sama pemprov hahaha punya stadion pribadi manajemen baya persija mampu sewa gbk knapa lo ribet hahaha jancoook jancook,4,{'USERNAME': 4}
1015,sadness,sering jadi puasa bukan badan makin ku- malah makin lebar klimaks pas hari raya banyak tanya sekarang gemuk,0,{}
1016,happy,cringe sekali hahaha cuman mau bilang happy kenal sama lu bro walaupun kurang lebih banyak ketimbang lebih hahaha aku sadar sahabat manis rasa terima lebih,0,{'URL': 1}
1017,sadness,rafinha main bola endorse sama mainin gitar tangan kanan kiri kiri kanan dibeliin gitar baru enggak sama emak,1,"{'USERNAME': 1, 'URL': 1}"
1018,anger,tangan malak te- bilang bonek pukul the jak cerita pukul bonek bela ama ramai jadi ribut lalu teman teman kabar bilang kalo bonek serang theja,2,{'USERNAME': 2}
1019,sadness,kadamg kalo kerja kelompok bukan egois ken kelompok sama orangorang gue tau sifat gue gimana bljr gue kayak bagaimana teman guegaenak borr kelompok sama orang rajin belajarsedangkan gue apatuh mah,0,{}
1020,sadness,minggu asa rahasia kabar lewat angin cemas utus rindu buat temu kamar smith,0,{}
1021,anger,modal walikota solobgmn mungkin takluk belantara jkrtadan susul takluk nusantaradia sendiriantanpa dukung taipandan media sosialmustahilkonsekwensi komando taipan,0,{'URL': 1}
1022,anger,bukti beri contoh buat baik nakal ayo bang more talk less while leading,0,{}
1023,love,rasa damai ku lihat matamuada rasa nyaman kau ada samping kau warna harikumembuatku ceria kini semua sirnakau tinggal lukakau pergi bawa paruh jiwakupantaskah kau ku tangis eeeaaa,0,{}
1024,anger,dasar mental maling ringkus salam metal maling tetap maling,0,{}
1025,anger,gub jauh lebih kaco manusiawi makanya pantas pengharhaan tahun penjara bukti,2,"{'USERNAME': 2, 'URL': 1}"
1026,sadness,spade th baru ditemuin tinggal gantung diri aptnya sama bantu padahal suami andy spade apt allah bahkan se sukses kata gin ingat buat lebih banyak syukur n nikmat hidup fix pakai katespade honor her,0,{}
1027,anger,enggak sih situ sekali mikir sendiri kalo mau ngerjain tugas enggak usah soknanya liat dong punya buat acu aja aku mau ngerjain nih bingung situ sering kayak gitu jadi ku tau awal cuman alibi,0,{}
1028,anger,jelas kreatif lanjut suka lempar salah jabat belum bawah pintar bicara utama ngeles kalau begini cuci tangan selesai,2,{'USERNAME': 2}
1029,sadness,omg parah benarbenar insom ngantuk mata gue segar pikir kacau sih kykgini deh efek pikir tegang n hawa suntuk kesel kemarin hiiiiks,0,{}
1030,fear,semua tempat laksana sholat salah satu bangun diri kafir salah satu gereja aku lindung allaah swt goda setan kutuk,3,"{'USERNAME': 3, 'URL': 1}"
1031,happy,justru bagus moga dangdut takluk asia tenggara nya kirim tki dangdut yeay,0,{}
1032,fear,semua tempat laksana sholat salah satu bangun diri kafir salah satu gereja aku lindung allaah swt goda setan kutuk,2,"{'USERNAME': 2, 'URL': 1}"
1033,fear,semua tempat laksana sholat salah satu bangun diri kafir salah satu gereja aku lindung allaah swt goda setan kutuk,0,{}
1034,anger,otak koruptor jelas mungkin pikir koruptor orang gila harta mana orang gila pikir positif,0,{}
1035,sadness,goblok sih nemu wrp jaman dulu deh seduh te- tambah susu coklat deh minun abis iseng lihat sachetannya eh pas lihat wrpnya deh expired wth are lu fucking kidding me,0,{}
1036,anger,lelaki jaga nafsu jaga pandang burung kalian enggak atur salah pakai perempuan pakai makanya,0,{}
1037,happy,dulu sahur buka semua disiapin sama ibuk sama kakak susu siap sekarang ganti aku u- anakanak kakak haru waktu te- jalan,0,{}
1038,anger,situ tau enggak timur tengah sana pakai tutup atas bawah tingkat sexual harassmentnya tinggi tau ga bukan soal buka tutup pakai soal iman nafsu enggak kalian jaga enggak kalia,0,{}
1039,sadness,jadi mayoritas hasil paksa bukan atas ingin sendiri memang benar banyak paksa lihat mayoritas tak mau jadi mayoritas bakal sulit,2,"{'USERNAME': 2, 'URL': 1}"
1040,anger,era an kenal bangsa malu an muncul vi- tak tau malu kembang hingga kini tuju jadi bangsa malu tangkap kriminal malah gaya selebritis depan kamera bpip ha- mampu basmi vi- rasa hasil kerja bpip,0,{}
1041,sadness,berhari-hari tidur jam jam te- kayak memang bawa enggak tidur cepat enggak tau padahal capek gedebugan doang enggak tidur,0,{}
1042,happy,te- dosenny enak diajakin ngomong terharuu enggak sih ngobrolin tesis suruh leyeh dulu malaikat kok turun jadi dosen sih subhanallah,0,{'URL': 1}
1043,sadness,dm marco simic pakai kata-kata senonoh marah aku ngedm lama minta kenal enggak pernah balas duh mbak via vallen mah orang huhu,0,{}
1044,love,hari beberapa jam lalu hening ku sentak bungkam lalu sadar ku aku tengah jatuh hati orang baru ku lihat foto nampaknya polos indah mata buat ku senyum sendiri,0,{}
1045,happy,hehehee pengepo alhamdulillah da kabar baik sekali mlika waktu kuliah kok gendut sekarang kabar bagaimana da kabar mindis mindismu baik,1,{'USERNAME': 1}
1046,love,bunga orang gadis sama beberapa bulan akhir jarang ku rasa lucu aku tak henti jatuh hati pada,0,{}
1047,happy,hepibesdey mbak canteeeekk panjang umur sehat selalu mulia jadi pribadi jauh lebih baik tetap tel jangan jadi simpenan orang,1,{'USERNAME': 1}
1048,sadness,ngehe sekale upload video jam malem jam pagi baru kirim server nya tadi tidur te- sekarang bangun buat sahur - -,0,{}
1049,fear,semua tempat laksana sholat salah satu bangun diri kafir salah satu gereja aku lindung allaah swt goda setan kutuk https,3,{'USERNAME': 3}
1050,fear,benarbenar bikin reak balik kanan menang jejeritan waktu rumah mbak trihanggo malem nyuci lanjut jemur samping rumah kayak siul padahal gelap pas diamatin buset sugus kain mori nya kusam mukaknya hita,0,{}
1051,fear,aneh banget semalem rokok burhan tinggal dasbor motor te- enggak aku apa apa aku taruh te- kan sahur keluar sama iffa motekar eh balik enggak rokok aneh banget padahal las parkir dimotekar enggak dekat motor,0,{}
1052,fear,semua tempat laksana sholat salah satu bangun diri kafir salah satu gereja aku lindung allaah swt goda setan kutuk,2,"{'USERNAME': 2, 'URL': 1}"
1053,sadness,minggu bapak tinggal sedikit buat bapak marah sesal sempat minta maaf bapak tinggal,1,{'USERNAME': 1}
1054,happy,lega banget ngelepas rindu sangat dalam walaupun cuma jemput kamu stasiun main cuma rumah aja but for me its been very happy,0,{}
1055,anger,kok aneh padahal honorer karyawan atur uu tenaga kerja hak wajib nya kayak bapak satu pernah lapang deh monitor sistem kerja masingmasing skpd,1,{'USERNAME': 1}
1056,anger,mundur buah penghianatan belakang pagar tribun te- suara bangkit semangat main lapang suara,0,{}
1057,happy,kepo artis masa kini wkwk alhamdulillah sehat sibuk sama anak satu sibuk sama suami satu sibuk mau nikah rosa sibuk koreanan haha,1,{'USERNAME': 1}
1058,sadness,benar banget dulu awalawal masuk kerja gaji berapa asa ngrasa cukupcukup sama butuh sekarang kurang,0,{}
1059,anger,beri bunga orang nyinyir hidup cara paling bahagia pasti bunga sebut sama pot nya kau lempar astagfirullah,0,{}
1060,anger,gue cewek galak sama sama cewe goblik pakai feeling enggak pakai otak egois bawa asa lebay semena enggak punya empati manja enggak pernah mau salah enggak responsible bahkan lempar tanggung jawab wait sama cowok sih arti gue memang dasar galak wqwqwq,0,{}
1061,sadness,pacar sama kerja samasama sift jujur lumayan enggak ena - gue libur berangkat - gue berangkat libur - sama sama libur habis sift malam capek jadi buat tantang sih kalo lihat orang pacar mudah jalan tiap hari alias bacot huhuhu,0,{}
1062,anger,pray for bla bla bla save bla bla bla emmm doa benar ga apa cuma pansol taek soksokan iba apa ditanyain masalah lu iba kga tau ooo biar lu bilang orang paling care dunia gitu hmm kalo dunia maya taek,0,{}
1063,love,moga tuhan senantiasa serta langkah jadi hubung makin kuat hadap segala uji hidup i love you,0,{}
1064,anger,ribut masalah via vallen sih enggak mau nyinyir gua mah jadi orang main sepak bola bla bla bla eh enggak usah ss kalicoba kalo nge dm orang biasa enggak bakal bla bla bla nyinyir apa bau anyir nying,0,{}
1065,anger,apa korelasi bulan puasa sama parkir kosong marenmaren gue bikin emoshi tyap hari gegara sulit banget parkir gilir enggak bawa mobil kosyoong melomponggggg,0,{}
1066,happy,baru jadi langsung ganti status facebook pacar kalo putus langsung ganti status facebook lajang,0,{}
1067,anger,makanya tutup aurat mu kalo enggak mau leceh pakai wangi wangi bila cium laki laki tanggung dosa,0,{}
1068,anger,bege apa enggak paham sih kasih peluang kok malah bagibagi persentase buat lu kurang lah inti begini sih lu informasi lu rajin hak lu enggak rajin biar enggak usaha mau cari tau,0,{}
1069,anger,yaudah lu ignore mbak via vallen aneh elu bikin perempuan enggak berani speak up sama apa rasain samasama mens tiap bulan enggak punya empati sama sekali,1,{'USERNAME': 1}
1070,fear,seram staf nya wanna nge dm fansite copyright infringement actually benar sih langsung mati fansite culture,0,{}
1071,sadness,berita via vallen dm main sepak bola kes goda sexual harassment lihat komennya bilang lebay enggak publish kayak biasa aja parah nyinyir perempuan miris,0,{}
1072,happy,kemarin lusa waktu break kantin tibatiba bapak ceo duduk samping cerita life after marriage nya satu unik beliau pesan jangan pernah hidup mantan candu narkoba hati thanks god you saved me from the wrong people,0,{}
1073,anger,apa bentuk leceh tetap leceh halah doang yaelah biasa kali sadar enggak sih cat calling masuk leceh loh,0,{}
1074,anger,sama email traveloka te- telfon call center cuman kali enggak faedah sama sekali te- akhir aku nyepam facebook penuh maki sama garuda eh malemnya deh masuk transfer wqwq gantung  apai kayak soale sodaraku ref,1,{'USERNAME': 1}
1075,anger,lebih kalo dengar sini langsung jengkel sekali mana suara speakernya grebek lengking ganggu sih lebih tepat mah,0,{}
1076,anger,kptusan pmrintah mmbyr gj thrdisambut gmbira pns pensiunpengamat jangan provokasipresiden bantu rakyatjgn disalahkancari celah upaya hukumwong bantu rakyat kok impeachmentbantu cari solusijgn ancam,0,{'URL': 1}
1077,anger,syarat apa benar minta traveloka apa enggak beri info lebih detail alamat enggak sesuai ktp gaji kurang besar muka krg tampan kalimat kurang untung kok kesan jadi kayak undi,1,{'USERNAME': 1}
1078,sadness,aku membenco hujan sore aku kecewa pergi mentari mulai sinar lenyap kisah kamu,0,{}
1079,sadness,aku benci hujan sore aku kecewa pergi mentari sinar lenyap kisah kamu,0,{}
1080,sadness,akhir rasa sendiri te- iya sih enggak diharapin masingmasing punya hidup sibuk masing dar cerita susah sahabat memang susah nyarinya jadi syukur punya sahabat dikalan happy susah selalu sisi,0,{}
1081,anger,benar kubu sama aja doyan mempolitisir agama kel wiro sableng parah begitu nasib bangsa-negara tak lewat abad cerah enggak move on agama,1,{'USERNAME': 1}
1082,anger,aneh wanita dilecehin ngelawan malah dibully ini gilir ibu saudara perempuan dilecehin ngamuknya kayak surup setan se-neraka bully korban banyak perempuan,0,{}
1083,anger,sejak dulu kala enggak pernah minat acara jenis acara cuman cengengesan enggak cerdas buang waktu enggak manfaat kok enggak malu bikin acara kayak begitu,1,"{'USERNAME': 1, 'URL': 1}"
1084,anger,lu anggap sexual harrassment wajar arti lu lnte alias lu senang kalo ngelecehin lu via vallen speak up tindak paling benar w warning lakilaki enggak semua cewek laku,0,{}
1085,anger,donggo ini benar pecah belah nkri tindak mana bpip,5,{'USERNAME': 5}
1086,happy,cerita malam mau bubar eh doi banyak tugas mau jumpa eh motor bawa sepupu akhirnyaaaa jumpa jam tengah mata merah mukacapek ngantuk siaaaan gue terima kasih kamu,0,{}
1087,anger,kalo gue cewektuk asih tau rang orangnih cowok suka gampangin cewekjd biar ciwi luar sn baikbaik waspadakl memang suka begitu serah yaorg biasa enggak populer kok bikin sep,3,{'USERNAME': 3}
1088,sadness,akhir selang beberapa lama gue kalah lebih tepat kalah mundur beberapa langkah belakang pov nya lebih clear gue analisa lebih fokus and well shit evidence nya lama papar muka cuma gue nya bego enggak sadar,0,{}
1089,happy,senang rasa digodain anak ngebayangin qasidahan syair tweet kayak iklan viral hahaha,0,{'URL': 1}
1090,happy,congratulation selamat adik cewek atas lahir putri gue kakak turut suka cita syukur senang beri selamat allah swt prosesing salin putri nya malam kakak doa moga putri nya jadi putri shalihah,0,{'URL': 1}
1091,happy,selamat pagi generasi tik tok kadang kepala suka minta getok bukan pengin cekcok mau ajak kamu seru-seru an faedah,1,"{'USERNAME': 1, 'URL': 1}"
1092,anger,hadeee omong sesat pikir kayak mbak enggak sadar pikir soal verbal harrasment sbnrnya cermin twit lama memang anak suka digodain pakai tytyd bagaimana dong kalo vv mayoritas cewek enggak satu selera sama lo terima digituin diem,0,{'URL': 1}
1093,happy,bahagia dong ajak jalan mall suruh jajan pertama jajanin sih mungil kemudian galau lihat baju ungu cantik kalo bilang pengin sih diiyain sama emak kudu waras dikit,0,{}
1094,anger,nama hijrah orang baik pindah tuju tempat lebih baik kalo rizieq orang buat sangat buruk lari diri bukan hijrah negara orang,1,{'USERNAME': 1}
1095,anger,banyak orang marah bilang pks lahir koruptor besar kata oknum goblog terlalu oknum laku kelas kroco kalau kelas kakap presiden kok oknum memang projek tipu-tipu kalau bukan presiden parte,2,{'USERNAME': 2}
1096,sadness,biasa kalo masalah teman cerita entah sekarang jadi susah sedang benarbenar lelah suruh bikin sanlat mikir sendiri hulu hilir walaupun dibantuin satu bapak sibuk kerja,0,{}
1097,sadness,terbege lama minggu aku hidup alarm jam weker jam hp aku bangun mati lalu tidur ujung bangun siang oke syap,0,{}
1098,sadness,terbege tadi alarm jam tengah keluar kamar buat bangunin teman eh teman enggak bangun te- kamar eh tidur bangun pas adzan subuh sahur oke syap,0,{}
1099,anger,enggak perlu minta maaf kalik beda perspektif mah wajar lebay mah hapus twit neg bukan bela simic lama vv enggak lapor pulisi jadi korban leceh mah tetap u- private bdua dm bagaimana awa,2,{'USERNAME': 2}
1100,anger,bikin status sosmed cuma ngejelekin pacarna-cewek macam apa itugiliran beri hadiah ajak jalan kga bikin status muntahin ajan,0,{}
1101,sadness,kabar baik ku pagi tagih uang giat sekolah lu tahun umum naik spp hmm ukk nya selesai baik lebaran enggak sah jajan n jalan rumah sajah,0,{}
1102,sadness,salah banget pagi play hourglass yaampun bakal mellow hari wanna one aku capek missqueen kalo pikir pisah sama kalian tuh ewhh,0,{}
1103,anger,kok ngabalin sebut tokoh enggak salah tuh hidung tambah gede ntar toko sorban kali,10,{'USERNAME': 10}
1104,anger,perempuan macam mana lah opini goblok astaga banyak asih free cowok kali jdnya b gt gila sih kesel baca gue,1,{'USERNAME': 1}
1105,happy,happy birthday sari all the best sehat selalu sukses cita cinta moga sari keluarga selalu lindung tuhan amin,1,{'USERNAME': 1}
1106,happy,tinggal my partner mudik fight sendiri te- jadi tiap malem alhamdulillah bantuin gooks maksi banget brother free kopi dulu yak,0,{}
1107,anger,ri siap naik harga bbmemang rakyat mau apa kalo bbm naikmau beli sukurtdk beli terserahmau demo sila dicidukpmrintah kok lawan,0,{'URL': 1}
1108,anger,sedang jadi orang teman pas kuliah dulu sering banget katai jokowi perintah lah jokowi ngechat gue tanya bagaimana sih tipsnya biar lolos tes cpns,0,{}
1109,anger,ku syukur pas tonton fm ngerekam pakai hp enggak kamera professional doang wkwkwkkw tengkyu mecima bando suruh lepas semua sebal cuman orangorang ngerekam enggak pakai hati aja enggak usah ngerekam lewatin tinggi kepala kamu kali serakah,0,{}
1110,happy,bentar bung akak dulu hahahahaha gempa lokal bung jadi potensi tsunami tsunami lokal enggak perlu risau,2,{'USERNAME': 2}
1111,anger,lo hujat sama lo biar sexual harassment rajalela goblok dilecehin malah suruh marah nolak maki-maki enggak mempan buat laku sexual harassment laku via vallen pengaruh karir sih simic resiko simic lah goblok,0,{}
1112,anger,ajar buat main bola biar lo enggak sembarang sama perempuan enggak usah asa kalian punya kontol paling bagus dunya kalyan bebas rasa tak perempuan nolak speak up rasa leceh kalyan,0,{}
1113,anger,terkadang dekat sahabat pacar perlu dar curhat kalo antem kan -sofi tahun- nah pacar teman aku kadang curhatnya suka enggak tau diri sebel sama pacar aku marah ku sleding kelen,0,{}
1114,anger,semua warga ntt suka banyak antara tak tuju klaim pihak tak pantas tuhan nusa tenggara timur malah caci maki berani kritisi timses vbl amp,4,"{'USERNAME': 4, 'URL': 1}"
1115,anger,puncak marah paling tinggi bukan maki orang peduli sama sekali bahkan kamu coba cari perhati mau tahu sedikit,0,{}
1116,happy,bulan puasa jepang ku minta masak buka makan indonesia hasil imam pakistan beberapa jamaah minta tambah sahurrrr,0,{'URL': 1}
1117,sadness,kepentok dikit langsung kereboot otomatis bbnya kalau terlalu lelet nekan apa enggak jalan satu copot batrenya biar restart produk gagal memang merk masa rame bondong beli hp hany,1,{'USERNAME': 1}
1118,love,banyak mnm air putih malam ma kalo tambahkn garam sedikit tensi mama naik habis tuh langsung istrahat y besok pagi mama check up dokter lebih diagnosa n pengobatanny gws sayang,0,{}
1119,anger,habit acak daulat nkri lalu kabur bilang rendah hati sudut mana kecoak mel,0,{}
1120,happy,padahal asik main nexian messenger nxm dulu sempat chatingan bareng raditya dika wlwlw habis nexian koid te- alih bebe,1,{'USERNAME': 1}
1121,sadness,benar enggak salah salah cuma moodku enggak bagus jadi semua lihat enggak bener dulu selalu moodku suka berubah-ubah jadi masalah,0,{}
1122,sadness,i want bb ku lama balik the bb kepler putih aku cuma mau lihat chat history ku waktu kelas cuma mau baca ulang sekali gapapa i wanna know what did i miss,0,{}
1123,anger,warga pak jalan daerah -ak parah baik perintah celaka gara-gara jalan -ak warga perintah kalau tunggu dulu celaka,0,{}
1124,anger,suara tahun jangan harap suara dewan dukung bubar kpk lebih baik bubar dpr,2,{'USERNAME': 2}
1125,anger,kesal nih kalo klien tanya fee jawab benar lalu kaget lah lu bayar dokter cuma konsultasi hitung menit rela bayar mahal lah sama psikolog mana konsultasi cuma - menit jam bagus kalo ketemu akar masalah hhhh,0,{}
1126,anger,kapai repotrepot cari jawab kalau cukup enggak usah dijelasin macem orang kalau benci tutup mata telinga u- kok repot,0,{'URL': 1}
1127,sadness,update kesel kesel mending update resep makan buat buka sahur entar takut jadi kesel negatifthinking astaghfirullah,0,{}
1128,anger,mkaa jangan katai orang kalau enggak mau dikatainjaga tuh oceh gilir katai bla bla bla baca tuh sapa katai,0,{}
1129,happy,ensenang indramayu pakdhe moga pintu tol dekat pusat kota indramayu mudah akses tol cipali indramayu lalu tol cipali warga sulit nikmat last but not least klalen mangan pindang gombyang ndas manyung pakdhe,1,"{'USERNAME': 1, 'URL': 1}"
1130,anger,dong tingkat layan garagara kurir enggak masuk paket jadi telat antar masalah jnt cabang paskal bandung sih garagara olshopnya cuma jnt kalo kirim ogah pakai jnt layan selal,1,{'USERNAME': 1}
1131,sadness,terlalu banyak salah aku buat alm hingga jelang ajal aku bentak marahmarah beliau moga beliau sudi maaf aku,1,{'USERNAME': 1}
1132,anger,memang goblok kau kafir bilang masyumi vs pki zaman soekarno soekarno bubar masyumi zaman soeharto masyumi izin he anjiang rok ang lai baco ang jiang,2,{'USERNAME': 2}
1133,sadness,foto bareng nikah teman bareng pakboss lihat sih mas makin ku- lihat sedang sakit selang bulan chat perihal kerja and he said sakit rawat rs,0,{}
1134,anger,bung aku i jago komentator analis bal-balan salah satu baik sini nalar logika soal harrasment via vallen dangkal picik malu betul,1,{'USERNAME': 1}
1135,anger,sukarno bubar masyumi lai jaleh dek ang jiang masyumi vs pki sukarno bela pki zaman sih jok bos mega anak sukarno bubar hti alas sama waktu bubar masyumi,2,{'USERNAME': 2}
1136,anger,bung aku jago komentator analis bal-balan salah satu baik sini nalar logika soal harrasment via vallen dangkal picik malu betul,1,{'USERNAME': 1}
1137,sadness,pulang sekolah ceplokin te- mam baso deh cukup dulu mah sesimple boroboro mau pansosan era ig jadi ajang hebat lo bikin otak remaja enggak sehat,1,{'USERNAME': 1}
1138,anger,good job jadwal kereta arah bogor sangat beranta ha- enggak jam gin,2,"{'USERNAME': 2, 'URL': 1}"
1139,sadness,kalo ingat hari worst banget sih betul memang usaha buka hati buat orang yaduuu capek banget tunggu orang tahun enggak dapet eh sekali apes part,0,{'URL': 1}
1140,sadness,btw kemarin senin aing tolol banget antri starbucks mbak manggil atas nama kak roy aing ketawa ketika depan orang nanaon ieumah ingat roy kiyoshi,0,{}
1141,anger,lu ajar kasus lama lu untung enggak usut ha- lu kapok ajar temen-temen lu rasai jatoh,0,{'URL': 1}
1142,sadness,teman ruang bilang mas benjol cm saraf kepala lusa kabar iccu akhir pindah awat baru tau sih mas kena meningitis,0,{}
1143,sadness,sedi aku tuh bacain komennya jahat bgt mau nyumpahin biar rasai kesiannnn begitu memang enggak enak mau tau asa gue jadi langsung rasa enggak harga enggak baik malu minder banyak memang aing orgnya trauma,0,{}
1144,anger,nah maksud dilecehin verbal kayak awak mbak via vallen marah semalu tahap perkosa makanya biar enggak tahap akhir siapa memang berani speak up mau kecil apa tindak leceh biar laku mulai mikir,0,{}
1145,anger,selalu sinis tegur kumpul bapak-bapak kelas doktoral kalau jokes sexual arah harassment orang abuse really enggak korelasi deh sekolah tinggi sama perilaku,1,{'USERNAME': 1}
1146,sadness,aku ingat saling canda tertawa kisah tulis carik kenang paling harga kau aku sama satu kata -cinta sayang lagi-lagi semua hanya kenang tak mungkin ulang terimakas,1,{'USERNAME': 1}
1147,anger,pancasila diuangin thr dipaksain didik dijualin otak dikandangin kampus disatronin periode dibatalin,0,{'URL': 1}
1148,sadness,benar baca komen-komen ig via vallen jadi macam miniatur mentalitas bagi orang indonesia sikap leceh seksual baik verbal atau fisik,0,{}
1149,anger,sebel banget sama pak sekdes ribuuuut minta kirim foto batik pas kirim malah enggak buka -        - malas banget mau buka chat terlalu banyak,0,{'URL': 1}
