,label,tweet,masked_word_count,pattern_counts
0,anger,soal jalan jatibarupolisi gertak gubernur emangny polisi ikut pmbhasan jangan politik atur wilayahhak gubernur soal tn abang soal turun temurunpelikperlu sabar,2,"{'USERNAME': 2, 'URL': 1}"
1,anger,sama cewek lho kayak ha- lebih rasai lah sibuk jaga diri rasai sakit haid panik pulang malam sendiri bagaimana orang asing wajar banyak korban takut curhat bukan bela malah hujat,0,{}
2,happy,pengin gudeg mbarek bu hj foto google sengaja biar teman-teman bayang bagi indah,0,{}
3,anger,jalan jatibarubagian wilayah tn abangpengaturan wilayah tgg jawab wwnang gubtng abng soal rumitsejak gub trdahuluskrg sedng dibenahiagr bermnfaat semua pihakmohon punya otakberpikirlah wajarkecuali otak butekya kamu,0,{'URL': 1}
4,happy,sharing alam aja kemarin jam batalin tiket stasiun pasar senen lancar antri terlalu rame menit beress semua mungkin coba twips jam-jam segitu cc,1,{'USERNAME': 1}
5,anger,sekian banyak thread aku baca thread paling aneh sih tulis sumpah aneh bgt mau katai lebay segala bikin thread hadeh aku enggak jago nulis tulis aku enggak beranta thread mbak,0,{}
6,happy,sharing sama teman tuh memang bgt saat lu rasa masalah lu berat banget nyata teman sendiri punya masalah lebih berat malah masalah enggak apaapanya banding masalah,0,{}
7,sadness,orang kalau pakai ponco buat jas hujan nah pakai buat kasur tadi garagara saking enggak punya apa mamak bilang tuh awal pernik enggak ngalamin bulan madu kayak skrg orang tidur nya pakai ponco gimane mau bulan madu,0,{}
8,anger,contoh gemar sudut teriak paling toleran gemar tuduh gemar men-judge orang dasar versi cukup tau,0,{}
9,sadness,pulang h- lebaran dilema sekali laku apaapa rumah lebaran buka puasa bareng cuman hari sama keluarga sahur,0,{}
10,anger,betul min rakyat indonesia sekarang harap nya tinggal sama tni kalau lihat jelas serang kantor media kata unsur pidana jelas hina presiden indonesia sah cuma lucu lucu an,0,{'URL': 1}
11,anger,kalaupun fansite ngejual hasil jepret uang nya lari idol belikan hadiah kan kpopers baru fansite jaman kamera bening skrg,0,{}
12,happy,sangat syukur doa kakek bung karno sama anak-anak yatim piatu h,1,{'USERNAME': 1}
13,sadness,sulit terima nyata memang bagi anggap interaksi satu orang satu golong tentu langsung kata golong tentu saat ajar utuh klaim diri paling benar,0,{}
14,anger,samanye maling semua enggak sih jancok enggak sih anjing enggak sih siluman monyet hahahahaha satu hati sama sama maling,0,{}
15,anger,ku pengin ngamuk bacain komenkomen netizen mahabenar lord enggak habis pikir komenkomen macam begini bikin kasus leceh seksual tenggelam hukum laku lebih sedih rerata komen jahat perempuan mbaq sehat loh,0,{'URL': 1}
16,love,sempat pernah hadir buat selalu rasa aman nyaman kini jadi suatu hormat pernah dapat,0,{}
17,anger,sedap kali kau bobok kasur ku aku tidur kau ikut tidur mau jadi apa kau baca pakai logat mamak dahlia keluarga badak,0,{}
18,happy,h- mau bank rame banget antri tempat duduk luar toko emas luber enggak lihat mbak jual swalayan antri kasir naudzubilah panjang bener bahagia semua kayak moga moga rs sepi pasien sembuh pulang bahagia,0,{}
19,anger,benarbenar hancur negara kelola amatir kenpak indah statementnya sendiri negara miskin koordinasi jangan asal gagah seta salah anulir mana marwahmu wahai mr presiden,2,"{'USERNAME': 2, 'URL': 1}"
20,anger,budaya cari baca tanya jelas kali kok lama enggak diaturgaada tentu khusus pakai,0,{}
21,sadness,paruh hati iri lihat orang anak duduk jalan sama ibunda paruh hati turut empat lihat orang anak gundah ibunda sakit sabar kawan moga allah beri baik semua,0,{}
22,happy,aku senyum bukan arti hidup sempurna aku syukur apa aku punya apa tuhan ikan ku,0,{}
23,sadness,mau tdr tidur bgn tidur kok kayak rasa aneh enggak enak hati bawa istighfar aja bgn tidur kayak sedih kayak mikir enggak puguh banget coba,0,{}
24,love,kan peluk engkau erat hingga tak orang rebut mu peluk ku happy anniversary sayang,0,{}
25,anger,kalo mau ganti presiden jelas siapa calon te- adu program kerja koalisi ditentuin bisa cuman buat kaos tagar,0,{}
26,happy,sukses n keren banget no kualitasbhn krjaitu citacita punya waris cusukses tims bbpjn barokah limpah,0,{}
27,anger,mau sarjana kali mbokya mulut nya jangan tinggal buat ajar sekira enggak perlu ungkap tambah dosa sakit hati orang mending diem bae lah kasihan nya julidin sama orang,0,{}
28,anger,bagaimana orang enggak nilai jilbabsyaringgak nya kadang gemas sama orang kelas diem bae eh grup wa bisa nyeletuk arah social harassment,0,{}
29,fear,hari jadwal presentasi proker lppm praktikum jadi pak ketua teman sekretaris selaku tanggung jawab sekretaris jadi deg deg an bismillah pak ketua btw pengin upload foto pak ketua jangan dulu yaa,0,{}
30,anger,foto instagram cuma lupa password instanya jadi enggak buka salah perintah instagram pakai password segala tuh lupa kan gue,0,{}
31,fear,drama kemarin sore hari puasa te- pas mandi kaget bcz datang tamu tak undang pas banget woi pas adzan maghrib te- jadi galau dong hari anggap sah puasa apa enggak- -,0,{}
32,sadness,sungguh cinta berat sekali pisah dengan - selalu bikin bawa asa sukses lupa laper,1,"{'USERNAME': 1, 'URL': 1}"
33,anger,pas kirim sih kurir telp ngeluh mager buat nganter alamat bener malah minta ketemu titik tau itu enggak mau susah no puter balik arah sama arah kendara jalan,0,{}
34,happy,akhir lewat semua semua dulu bayang betapa sulit lalu akhir ajar ajar ajar petik semua hikmah petik siap depan,0,{}
35,love,pasang seringkali ibarat rumah rasa nyaman sama nyaman ada rumah kamu jadi apa kamu selalu pulang tuju,0,{}
36,fear,tau kalo rasa sakit hati memamg sulit kala nya jenjang rumah tangga jangan lah publik situasi inimedia jahat enggak selesai masalah lontar kata kata,0,{}
37,happy,ponakan kls sd demen tonton video tutorial masak craft youtube gue kls sd baca novel marga t amp mira w minjem punya sepupu,0,{}
38,happy,bberapa tahun kemudian sejahtera keluarga makmak teus tingkat sampai suami dpet pangkat tinggi kurang paham pangkat tni pokok hidup bekecukupan,0,{}
39,sadness,bukan dukung doa cuma sikap apa pilih upaya mempertahankannyadisini aku jauh bahagia lihat sedih kebahagianku pudarseperti kala terima undang nikah,0,{}
40,happy,jnejnt lama pakai entah kirim paketbeli olshop jastip luar kota beda pulau maksimal hari mau pakai mobil susah cari alamat bingung enggak masuk kompleksgang meski malam sekalipun bain jalan rumah paket kirim baik,0,{}
41,anger,gemas banget sama orang anggap wajar leceh sexual verbal mau verbal fisik apa tetap benar,0,{}
42,fear,apa hukum main musik stad jelas haroooom hukum dosa main begitu kira-kira cakap jadi pena orang ustad buah acara tv intro pakai musik,0,{}
43,anger,apa hebat mardani oeang cuma besar mulut fakta sebut capres lagipula kalau koalisi pks gerindra enggak mungkin lah yaow,0,{}
44,sadness,iya ibu nya lahir anak cewek enggak tahu tahun berapa nya lanjut tadi baru tahun kasih nikmat datang uji buat sih makmak kali mungkin berat tinggal suami tinggal ketika ibu jadi singel parent,0,{}
45,happy,suka twitter soalny perempuan ji semua teman sini biar omel tablengker ndada bahaya bahas monsteration bebas bahas indak puasa bebas wa mau update status stres monsteration dulu blok semua cowok baru mengupdate,0,{}
46,anger,enggak erti sama ciwi-ciwi nyinyir via vallen korban loh susah itu saling support satu sama gurlzz,0,{}
47,anger,hari libur rencana mau tonton jurassic world kaya gajadi deh ingat kondisi enggak fit banget sebel -ak rencana belanga sebel akutu,0,{}
48,anger,nah tunggu anak anteng sabar luas samudra te- bapak dateng bikin anak nang hmmm ingin marah lampias,0,{}
49,love,ku rindu bisik mu telinga kau kata moga kelak kau jadi anak guna banyak orang moga kau selalu sayang orang tua mu,0,{}
50,anger,hasil sekolah asal sekolah mikirlah mahkamah internasional punya wenang adil perkara genosida dsbnya,0,{}
51,anger,lah lu ha- tanya teh asumsi gue mah kacang kulit maksud apa hayo sana kan maksud loooo,0,{}
52,anger,web permata krg profesional program cashback rb token pln waktu klik info masuk program paket kuota data piye iki,0,{}
53,fear,nah takut mas tumpang politik balut agama bahaya soale masyarakat sedang sensitif sebut,0,{}
54,sadness,mau cerita siapa kalau kayak begini hancur hidup pikirin dong bagaimana hati ku aku sedih aku menang tetes air mata kayak lirik lagu sayang pia palen deh wkwkw,0,{}
55,sadness,hari puasa saur enggak pernah siang akhir hari rasai makan saur supeerrr dupeerr ekspress menit imsak baru bangun yassalaaam,0,{}
56,fear,jadi thr apbd punya kuasa takut kalau kalau garis bawah sama kpk jadi ggl thr tahun kok buk tri bilang aman takut,0,{}
57,anger,bantu lptop kali kok enggak buka dokumen not respondingpdhal pernah bawa hp center moga lptop masuk produk gagal gimanabeli maret kalo begini te- kan jadi jgkel sndri,1,{'USERNAME': 1}
58,anger,masuk proses jual pas buka detail kok malah gin produk sedang proses proses tanggal,0,{}
59,anger,semen indonesia nambang loh rembangmalah usaha lokasi meter areal tambang semen pernah protes tahun lamanyaknp kok pas semen protes,1,{'USERNAME': 1}
60,anger,siapa bilang punya anak senang ros sodorin anak tantrum ngantuk enggak mau bobo istigfar kenceng,0,{}
61,sadness,rasa oon tahu bicara orang nah lalai malah balik jadi malah rubah siklus alur waktu jadi,0,{}
62,anger,punya sahabat cowok nih sering nya enggak konsisten te- sering bohong sih kali marah sering bohong enggak mempan apa kodrat suka bohong apa gimana,0,{}
63,happy,kalau tau libur panjang - lebaran - tuh rasa pengin cepat gendong cerrier pakai sepatu te- pergi ketemu alam damai dengan,0,{}
64,anger,siapa bilang kafir gabung sama khilafah bro jangan alih isu siapa selundup kaum bumidatar se-olah pro pancasila,1,"{'USERNAME': 1, 'URL': 1}"
65,happy,btw doa restu orang tua memang giling pas mentok cari literatur tambah nemu dong rumah padahal kemarin panik kudu mesen banyumas berkah ramadan,0,{'URL': 1}
66,anger,salah satu contoh tau terima kasih padahal datang pas kenal wannaone ckckckc dulu juang siapa jawab sendiri sama kok deh wanna ones swing entertainment warns legal action against fansite masters via,1,"{'URL': 1, 'USERNAME': 1}"
67,fear,pagi rasai sakit perut ira mau haid beli kiranti pas cek malah kagak plis atulah haid sekarang aja biar ikut solat ied,0,{}
68,sadness,turut duka cita buat kawan a cak moga keluarga tinggal a beri sabar amp meridoi pergi alm,0,{}
69,anger,jaring mati buka mobile jkn mau puskesmes te- piye mau tunjuk kartu elektoniknya,1,{'USERNAME': 1}
70,anger,lo lahir sekolah bong rasa bapak lo pki bong bandit rampok jenis menganggu orang banyak pak soeharto bilang kejam orangorang pki bandit rampok bong bong bongakkk,0,{'URL': 1}
71,anger,usaha te- sekarang jadi karyawan macam gue bawaannye pengin usaha enggak atur flexible lebih banyak duit faaak,0,{}
72,sadness,salah satu efek rapi sama bom orang mau bikin event negara takut jogja indonesia jadi aku event internasional beberapa negara konfirmasi takut sama rapi sama teror moga rapi lekas reda moga enggak bom,0,{}
73,anger,baik gubernur anies baswedan mosi percaya biar lengser,10,"{'USERNAME': 10, 'URL': 1}"
74,anger,kaum oposisi bikin geger-an media termsk medsos rupiah kuat musim ribut-nya khusus waktu jadi lemah salah semua presiden,1,"{'USERNAME': 1, 'URL': 1}"
75,sadness,puasa pagi kesana kemari mmbawa alamat eh ayuting kalee enggk ding siang tetangga belah goreng telur yah kan bau hidung gue hikss piye sih mbak,0,{}
76,anger,heee aku kemarin lihat hoak tetang pohon plastik pertama kali akun ygdisebarkan lewat fb bukan nol besar sekaligus nonjok muka junjung sdr terima kasih,1,{'USERNAME': 1}
77,anger,min gimana kurir salah kirim malah alamat orang te- tanggung jawab gimana respon cepat thanks,1,"{'USERNAME': 1, 'URL': 1}"
78,fear,pas banget gue habis baca buku bule pdkt bilang cari rumah samamobil dicariin mobil sama rumah mewah sih bule niat kirim uang jt pakai pos bilang sama hadiah enggak masuk akal kirim banyak pakai pos,0,{'URL': 1}
79,anger,masalah uang buat konsumsi buka puasa bareng anak yatim bayar katering,4,{'USERNAME': 4}
80,sadness,niat masjid sholat nya lantai harap obob manjah biasa enggak banyak solat sini fact fullhouse mpe shaf belakang bhay,0,{}
81,happy,paling excited kalo obrol sama orang kreatif siap kalo bakal cengang sama ide mungkin pernah pikir oleh iya aku baru pikir,0,{}
82,anger,miris cipta karya susah payah uras pikirantenagawaktu materi kalah oknum jiplak danatau dar terima beres manfaat karya orang gimmik sensasi bagaimana,1,{'USERNAME': 1}
83,anger,belah mana stereotyping-nya nyata coba tunjuk siapa tahu salah bicara bagus dong kalau banyak kecam makin banyak makin dengar suara benar makin bagus kalau benar kalah keras sama salah atas,0,{'URL': 1}
84,anger,tipikal cowok menye menye banget ni paling enggak ajak argumen salah orang keluh te- nih manusia maha sempurna pengin katai goblok puasa,0,{}
85,happy,tiada henti ny ku ucap syukut alhmdllh sekarang aku bsa uang jadi panitia kemarin alhmdllh trmkah kau bri brlmpah mski tak sbrpa inysllh lma mmbukit amn,0,{'URL': 1}
86,anger,kamu mau omong apakayaknya kamu dendam aniespernah sakit olh gub aniessalah apa anies kpdmuknp dendamkamu klmpok dki puny gubanies bukan tempat kamu maki aniessalah,0,{'URL': 2}
87,sadness,group keluarga omong mudik duuh pengin mudik apa daya suami libur cuma hari hari h lebaran kalo enggak telpon suruh masuk tahun lalu malah habis sholat eid langsung kerja,0,{}
88,sadness,orang pernah kalah tarung politik sulit sembuh raih impi hilang banyak harta,0,{}
89,sadness,nggada sinyal rumah buat banyak berfikir pikir doang pikir mana mana random,0,{}
90,fear,khabar kasus tuduh chat mesum imam besar habib rizieq henti mohon bantu doa moga benar ada moga suci ramadhan buka mata hati bapak menyidikamin,0,{}
91,fear,jangan ngecengin gua gaes orang blog-nya walaupun nulisnya enggak jam dinihari sih,3,{'USERNAME': 3}
92,anger,cari orangorang selalu sudut ansor sabar bagus kalau te- te- fitnah salah jangan tinggal diam saat,0,{}
93,love,halohaa selamat siang denise pulang sekolah nih jangan lupa makan siang iya bagaimana sehat kan kamu kalo memang kurang sehat banyak istirahat sekarang kakak selalu tunggu kok tweet,0,{}
94,anger,lah bodoh mu bong suruh baca mau baca pbb cikal bakal masyumi pbb keluarga besar bulan bintang masyumi dasar bong,0,{}
95,fear,mudahmudahan terupload semua mudik fan modal quota butuh daerah jaring bagus hiksss hitung jam baru slsi kalo mau donlot rumah,0,{}
96,anger,orang dukung khilafah memang black mail,14,"{'USERNAME': 14, 'URL': 1}"
97,anger,jangan sok akrab ye mention mention gue maling dulu benar kalo sukses jadi malingnye baru gue balas mentionan lu lu,0,{'URL': 1}
98,happy,alhamdulillah prof bicara malam adem rasa moga bawa berkah amin rabbal aalamiin,1,{'USERNAME': 1}
99,happy,keren kira-kira enggak bilang pak anti-islam triliun hektar jadi kampus rujuk islam dunia kelas al-azhar proyek ponpes madrasah masjid fasilitas ummat kalo bilang beliau an,1,{'USERNAME': 1}
100,anger,kan datang tanya kemudian obrol tuh sama mbak mbak help desk tetap enggak erti enggak jawab jawab tanya te- mbak lama lama emosi yaudah makin enggak jawab dong te- pulang,1,{'USERNAME': 1}
101,anger,sering tuh gua begitu pas kalo baru ketemu apsara kok awat makin banyak makin gendut sih wah senyum iyain dalem hati bacot lu anjing,0,{}
102,fear,kalo sifat buruk mungkin rubah tambah umur ubah ada kalo biasa buruk mungkin sulit macam jadi hobi enggak sih,0,{}
103,fear,berdesakanbejubelan krl salah satu goda berpuasaapalagi depan nya wanita cantik ngunyah tahu gejrothehe,0,{}
104,anger,nyata cuma slogan doangstelah dkomplen nyata dbatalin pihak nama besar indak jamin profesional yat- sampai pihak official store kalo batalinpdhl samsek enggak batalinjd sekarang tau kal,1,{'USERNAME': 1}
105,happy,happy birthday us and happy th anniv wkwkwk bentar putus huhu aku cari pacar baru,1,"{'USERNAME': 1, 'URL': 1}"
106,fear,te- baca komennya bilang kalo musik haram bla bla nah sini aku tau kalo fanatik kan memang gaboleh kalau dar suka gimana,0,{}
107,happy,rabu -- anakbujangku selesai tempuh didik tak bhakti ibu bakauheni eit nyata piala hehehe,0,{}
108,anger,hidup zaman presiden hebat soeharto beliau buat aman tenang masyarakat tenang kaum pki kaum rampok kaum bandit kaum jadi jabat negara otak kosong kaum suka bapak soeharto,0,{'URL': 1}
109,happy,sama segenap dewan guru terimakasih bimbing anak lama bu moga ibu-ibu semua mudah segala u- ilmu ibu ajar jadi amal jariah pahala te- alir ibu lama,0,{'URL': 1}
110,anger,gue memang cuek sih banget banget malah kalo buat risih enggak nyaman hatihati lah pokok jangan gue ajak nongkrong breng,0,{}
111,sadness,anugerah gigi rapi lahir syukur pakai behel nyata lebih sakit sakit hati,0,{}
112,happy,alhamdulillah piedi rsup kariadi benarbenar u- jadi enggak panas tinggi soal langsung kasih paracetamol botol,0,{}
113,anger,lihat terlalu banyak project jatohnya malah jadi scam fraud asli gue pengin coba deh bawa sama creator creator bawa kabur duit banyak orang masuk gue ranah hukum indonesia,1,{'USERNAME': 1}
114,anger,soal via vallen gue sepakat sama nikita mirzani jangan lebay kalau enggak suka gituin tinggal tolak block orang jangan share jadi konsumsi publik kayak tampil polos tak dosa bagaimana gituu,0,{}
115,fear,baru nge-uh balai desa te- pas mau pulang tadi bu lurah nanya mba ulfah teman satu mana sih kok indak lihat hah teman buk oo bu lurah iya biasa bareng senin indak berangkat lho wait senin,0,{}
116,fear,mbak pps tuh apa-apa mbak ulfa rasa kok enggak sebentar sebentar sih senin enggak berangkat bikin khawatir tt,0,{}
117,anger,hadeh satu cewek pikir jahat jari jari jahat nikmat heh mbak memang nyanyi dangdut auto lonte lonte kena sexual harassment mbaaaak,0,{}
118,sadness,lu ngapa sih galau mulu lu kalo galau banyak diem kalau senang enggak diem mangat dong kak nanas senang nularin orangorang loh wkwk,0,{}
119,anger,juta kali bong kasih tau pak harto kejam pki bandit rampok lo turun kelompok mana bong hahahahaha,0,{}
120,happy,sebentar ketemu krucil-krucil ponakan gemas banget suka nya minta main berantem-beranteman seru sih meski resiko pegel-pegel nanti sedikit-sedikit ajar hitung pas masuk sekolah,0,{}
121,anger,lalu bagaimana negara hilang banyak dapat cukai rokok hutang negara makin banyak ah kan benar coba lihat bagaimana apa dapat sama,0,{'URL': 1}
122,fear,eh numbuhin brewok buat senang diri sendiri sih compliment sama cowok bonus lah enggak rawat dikit langsung tumbuh liar gatel banget,0,{}
123,anger,kosan dekat kantor datang paling telat te- kalo siang tidur selonjor sofa teman kantor kayak begini memang perlu katai tahi sih,0,{}
124,anger,sih enggak enak dewe lepas tanggung jawab backers cuma dasar toc kickstarter selaku sedia platform crowd-funding creators backers toc tetap tunduk hukum laku governing law sih toc gue mau cari legal loophole nya,1,"{'USERNAME': 1, 'URL': 1}"
125,sadness,anak sama habis pisah macam wisuda sekolah foto bareng sama temen-temennya jawat pakai kebaya lalu post ig caption siapa bakal nikah duluan ku langsung tunduk lesu minum extra joss cuk,0,{}
126,happy,awak sih jadi orang slow mau omong a asal ale banyak makan enggak cranky berat naik bahagia masalah apa jadi kayak enggak ibuibu banget sih sekarang,0,{}
127,anger,ganti presiden siapa takuthanya siapa calon apa sih doi onoh ih enggak syudih,0,{}
128,anger,tipu kasihan ibukota negara gue pimpin sama merekamereka haus jabat penting rakyat tai buat,2,{'USERNAME': 2}
129,fear,pergi antar sama teman enggak bawa hp janji biar jemput jam tengah saya tidur jemput enggak nongol bingung mau gmna akhir jalan kaki kamu siang bolong ngeri kali lahh vanashh syekaleh vemirsyahh,0,{}
130,sadness,iya kamu laki-laki sang ambil putus kan aku anggap ajak diskus minta dapat ajak cari jalan keluar sekadar tenang cemas aku jangan hidup sendiri,1,{'USERNAME': 1}
131,sadness,akhir kata aku enggak mau sakit migrain datang byknya masalah butuh tenaga mikir bentar mudik allah coba,0,{}
132,happy,pengin cerita kemarin enggak sempet beberapa hari lalu tarawih masjid enggak konsen banget posisi apes bagaimana gak posisi solat shaf depan mas pakai sarung te- sarung nya jiplak pantat pas banget ketat kampret pengin akak solat syit,0,{}
133,happy,congratulation moga lancar sempat pandang orang orang panggung break a leg,2,"{'USERNAME': 2, 'URL': 1}"
134,fear,enggak jamin deh gana pak police siap enggak kerja pungli jenis korup pungli bagai addicted sekali nyoba enak tambah deh,1,{'USERNAME': 1}
135,anger,looh kok rendah semangat lindung perempuan sih justru jadi cewek kudu tegas galak sama lakilaki kayak gitu block udahngapain share se indonesia tau,0,{}
136,sadness,minggu enggak kabar wkwkwkwk aku sibuk u- rapot sama ijazah anak te- enggak tanya kabar lama minggu sahabat macam apa kamu,0,{}
137,sadness,haaaa syabar ajaaa bom waktu buat ikutttt perintah ajanihhh tumben asih libur kepanjangaaannnnnn,0,{}
138,anger,mohon jangan paksa buat include dmn harap sopan jelas kalo mau bo jangan labil enggak jelas will be block taatin rule utama,0,{}
139,anger,buka pernah amandemen cebong busuk atas berkat rahmat allah maha kuasa lo baca buka uud situ semua dasar negara ri bongo memang bongak,0,{}
140,anger,apa sih susah apresiasi sedikit sama apa dilakuin oranglain asih hak nya tepat waktu kira gap butuh kali yagiliran masalah kerja no mau ijinlibur tetap hajar trs ketjewalah,0,{}
141,anger,tutup mata krn jabat bukan cuma pintar tau etika masa satu kabinet main nyerang berani berani etika memang kabinet gundul,0,{}
142,happy,kapai rame mikir cari baju lebaran memang kalau aku mah tiap hari pakai baju lebaran soal kalo pakai baju sempit ngaaap,0,{}
143,happy,lewat tengah hari moga hari senang yuk semangat,0,{}
144,sadness,gue biasa beli shopee pakai atm manual asal cocok jumlah verifikasi otomatis eh enak jadi teledor pakai akun sepupu gue malah enggak otomatis pesanannnya kecancel allah malih gue kapan renti goblok,0,{}
145,sadness,kaya gue kalo shopee memang jangan nitip akun orang deh mau irit ongkir apa gmana dulu nitip firsta pesan lenti donghan datang boneka pokemon,0,{}
146,happy,terima kasih temanteman hmj d awat stikes al irsyad cilacap bagi bahagia sama mbah kakung mbah putri,1,"{'USERNAME': 1, 'URL': 1}"
147,sadness,gue enggak suka enggak senang sama nama maling cuma gue enggak senang kalau maling digebukin bonyok banget bakar bunuh,0,{}
148,anger,manusia rakus bunda menteri advokat rampok banyak tahu rahasia negara waktu istana sama orba bandit banget,0,{}
149,anger,pln memang php surat edar maintain daerah a jam sekarang jam listrik hidup jg kalau telat dikit bayar tagih langsung denda kalo mati listrik mulu potong gak,1,{'USERNAME': 1}
150,happy,supporter gue enggak suka barca cinta sepakbola gue suka film keren lah,1,"{'USERNAME': 1, 'URL': 1}"
151,anger,konyol banget mbak komentar main ignore kira sepele banget enggak nyaman makanya publish biar asih ajar buat orang mau punya niat goda biar enggak te- niat kalo enggak pengin permaluin reminder bua,0,{}
152,anger,fahri aktivis nol isi mana reformasi mu enggak rubah apa koar koar bebas negeri mustinya golkar lo bubarin harto turun golkar lenggang jaya kata amien raisa bodoh,0,{}
153,anger,thread sembah wanita permisif leceh alami wanita lain alas jadi banyak jadi enggak adu khanmaen,0,{'URL': 1}
154,anger,lebih geli ketimbang kasus sexual harassment timpa via vallen politis amp partai politik manfaat panggung tunjuk dalih bela korban,0,{}
155,happy,kok sih drummer lucu sih muka kayak tengil ngegemesin te- mulai dibiasin receh gue punya bias,0,{}
156,sadness,macet parah kemang belah mobil gue parkir gerobak mie ayam luar biasa gugah selera padahal baru lihat gerobak doank,0,{}
157,anger,pernah ngomel begini te- bang ojolnya malah solot bilang kalau ikut macet jalan normal rugi neng bensin jauh mbak muter balik rugi wth,0,{}
158,happy,hbd my lovely wife amie amoy wish lu all the best moga selalu ada dalam lindung swt panjang umur senantiasa bahagia sama keluarga kerabat sehat selalu makin banyak rejeki selalu jadi wanita hebat keluargaaamiin,0,{'URL': 1}
159,anger,satu mana bong hahaha habibie copot jabat pak prabowo ulah sih wiranto wiranto pakai habibie jadi pangab tragedi tanggung jawab pangab bong bongak tembak polisi,0,{}
160,anger,baik kalau soal ham mau tanya koruptor waktu maling mikirkan hak orang enggak koruptor sendiri langgar ham cuma koruptor bela koruptor politis bebal,0,{}
161,anger,kamu lahir bong tanya sama mak mu biar jelas pki zaman soekarno bong lanjut orba lalu basmi jadi salahsatunya keluarga,0,{}
162,fear,jangan viralkan entar oposisi biasa nyinyir kejang sakit jantung kalau sakit hati memang kronis sulit sembuh,0,{}
163,happy,akak ane lihat wkwk,0,{}
164,anger,coba hubung cakung minta wa balik tanya prosedur beli hari sejak jumat difollow up service maksindo,1,{'USERNAME': 1}
165,sadness,teman nya laki gue almarhumah tahu tinggal waktu hidup ngintil kmna laki alh gue mlangkah ngikut suka nlpon nelpn kantor panjang katakata nya suami almarhumah waktu jatuh cinta ksi enggak dtang rmah duka rs husada orang nya senang ketawa comblang laki ku hdhhh sedih,0,{}
166,sadness,woah buat u- fitnah dimusuhin bikin enggak mau sekolah garagara enggak mau temenan trauma minggu malam besok pagi sekolah bikin malu depan banyak orang aku lewat semua,0,{}
167,sadness,rencana enggak pulang mau garap project nyata enggak sentuh sama sekali tau begini mah pulang weh minggu kemaren hm hikmah ramadhan mungkin memang perlu lewat buat ajar,0,{}
168,sadness,tindak bukan leceh seksual benar kan kata gw ilmu enggak dapet jadi enggak erti deh apa apa masuk leceh sexual,0,{'URL': 1}
169,anger,dear kirim dokumen penting jakarta - surabaya makanya pakai yes kirim senin juni selasa juni sekarang hari rabu sampe kan bikin esmosi byr lebih pakai yes enggak hari no resi,2,{'USERNAME': 2}
170,anger,yaelahh ente partai sapi kurang kelon ente junjung ente kagak punya nyali kalah sama ahok berani hadap kasus lebaran tiba jik pulang kagak peler,0,{}
