,label,tweet,masked_word_count,pattern_counts
2082,sadness,coba bikin pudding coba salah bikin nyata bikin jadi jelly nutrijell coba bikin lap sama jelly nyata rasa plain coba bikin lap nyata nyampur keras apa salah dosa sayang,0,{}
2083,anger,langgan setia tagih bulan mau rp laku bayar jatuh tempo tanggal -- abai bayar cs twitter tagih apa,2,"{'USERNAME': 2, 'SENSITIVE-NO': 1}"
2084,happy,all we know of heaven all we need of hell - pvris gue ikut pvris awal gue rasa album sekarang lagulagunya lebih mature sangar dark fragile konsep seluruh album mv nya keren parah gue suka lagu mercy anyone else sama winter,0,{'URL': 1}
2085,sadness,enggak salah sih akun rp kasih saran doa cepat kabul cuma lebih kasihan sama coba saran nyata malah enggak kabul doa,0,{}
2086,sadness,sadar siapa kamu siapa tak mungkin mjd kangen iya jarang ketemu iya kadang curiga iya aku kamu mimpi waktu mungkin biar kangen ku kamu obat nyata malah jadi arhhhh allah maha tau,0,{}
2087,happy,menggunakn sistem demokrasi bgtulah jlnnya yakin perintah selalu upaya mjd lebih baik lebih baik te- ksejahteraan sama,0,{'URL': 1}
2088,love,inti sih kamu jadi siapa aku tetap sayang kamu tahun sama meski ngitung awal akhir sekarang bulan wkwk,0,{}
2089,sadness,bukan maksud bela dirisemua punya salah mungkin soal kerjaanpertemanan saat bela laku nyata ada sudah,0,{}
2090,fear,ngeri sih memang akun gede followers ribu tuh kalo ngetweet jelek salah dikit hujat langsung banyak aku takut kalian unfollow aku please,0,{}
2091,anger,kamu alay - - kamu sih lay ih akoh molo sih seble x bagai siram luka pakai air,0,{}
2092,fear,sejak kamar ku enggak ku kasih kursi biar sih doi enggak duduk kursi ajar kalo tidur lampu nyala takut kalo tibatiba sih doi muncul pas remangremang gitu,0,{}
2093,sadness,selalu kurang sepakat sama cara orang-orang reduksi kapitalisme batas cipta lagu cinta kapitalisme dunia musik bukan cuma banyak jauh lebih luas eksploitasi ketidaksetaraan gender senjang produksi,0,{}
2094,anger,mau tau rayu cowok kadal wkwkw kamu cantik kok enggak pacar sih kamu suka lagu apa nyanyiinnanti lagu aku mainin spty kamu tuh manis deh bibirnyaaku suka bibir kamu lah basi habis tau,0,{}
2095,anger,vedevah kartu multi trip malah jadi enggak jelas guna kapai gua isi saldo buat kmt kalo akhir tap suruh beli kartu thb etttaaann,0,{}
2096,sadness,cerita kisah kalau istri enggak turun suami mau tahan rumah tangga sih ibu lakilaki mau sih anak meni turun sih istri lapang dada pisahnamun sih lakilaki kekeh tahan istri,0,{}
2097,fear,gue rasa enggak nyaman kamar gue sendiri depan pintu kayak bolak balik mau nelp nyokap takut katai banci help help,0,{}
2098,happy,santun anak yatim buah kewajibanmereka hak bahagia kitalayak bahagiapramuka peduli merekapramuka indonesia,0,{}
2099,love,malam kau aku baring atas rumput renung langit sama nikmat ada tenang tani bunyi alam indah aneh percakapn dar tenggelam cinta nikmat,0,{}
2100,sadness,polres pati duka hari senin tempat rumah duka ds waturoyo rt iv kec margoyoso kabpati laksana giat upacara semayam jenazah almarhum aiptu puryono jabat akhir banit unit sabhara polsek margoyoso,0,{'URL': 1}
2101,anger,semua warga hak nyapres nyawapres warga konstituen punya hak pilih pilih jadi jangan gederasa dulu kalo wajah deh masuk tivi koran tebar bantu kirikanan tunggu jadi petinggi mumpung lebih baik,0,{}
2102,anger,sabar sayang waktu orang orang balas ill pakai sure theyll get it dont hide ur smile dont give me fake smile everything gonna be okay,1,"{'USERNAME': 1, 'URL': 1}"
2103,love,terimakasih pernah buat warna kertas putih pernah rangkai bunga vas kosong pernah nyanyi merdu ruang sunyi pernah jadi satu ikat,0,{}
2104,love,semangat hidup aku ayah ibu keluarga terima kasih atas keluarga tak aku lupa semua kata keluarga ku sayang,0,{}
2105,love,pintar ganteng wibawa sama jago kendaliin suasana buat pusing keliling adoeh cpt ketemu lah beta temu,1,{'USERNAME': 1}
2106,fear,aku takut banget nih soal ratarata pengin fk sekolah aku ratarata anak paralel enggak tau kalo universitas ken beda,1,{'USERNAME': 1}
2107,love,teriak nama deras hujan pandang jauh doa hening malam cinta diam lah mampu tahan,0,{}
2108,happy,terima kasih mbak novitasarilaras service macbook auditorium nurcholish madjid - universitas paramadina,1,{'USERNAME': 1}
2109,love,tetap semangat sayang-sayangkuh meski ku lebih banyak gegoleran rumah ngetawainnangisin kalian ku kan selalu dukung daam sayang,0,{}
2110,love,baring punya rasaseperti rasa nyaman foto rasa sayang aku kamueeaaaa,0,{'URL': 1}
2111,love,jangan tanya sedang apa aku hari laku selalu sama sedang cinta hari,0,{}
2112,anger,cegah radikalisme mohon deskripsi dulu batas radikalisme kalau batas upa kriminalisasi ajar islam nama radikalisme sekuler,0,{'URL': 1}
2113,happy,bahahahahajahahhaaa sakit emanggg wkwkw tahan agustus lisa datang kokas niat lihat lisa ngeri ujung mana,0,{}
2114,happy,tambah -cantik kayak lihat malaikat -gapunya lemah sempurna banget hidup -baik hati sombong -rajin tabung -paling bahagia,1,{'USERNAME': 1}
2115,happy,desain razer mirip banget mbp malah lebih modern bezel tipis n mampu gaming arti spek lebih baik n desain elegan lama lama hipnotis apple pudar contoh nya,1,{'USERNAME': 1}
2116,anger,sangat kuatir dukung penuh nu presiden makanya coba utak-atik delegitimasi istilah islam nusantara kenal kembang nu sejak muktamar jadi soal bukan agama politik,1,{'USERNAME': 1}
2117,love,assalamualaikum warahmatullahi wabarakatuh selamat pagi moga allah kah jumat anugerah damai hati,0,{}
2118,sadness,pengin juang buat banyak cinta mesti laku lagi dia b aku enggaa,0,{}
2119,love,mas hamdan tau kalo istri manja rewel hamil alhamdulillah hamil mas lebih erti kadang suka geleng jangan bosan jatuh cinta berkali-kali istri mas,0,{}
2120,love,happy mensive kaliannn langgeng te- yaa jangan suka antem klop te- wkwk makin saling cinta makin saling sayang i love you,0,{}
2121,love,jauh aku selalu lihat bahagia sayang aku cinta selalu,0,{}
2122,anger,berapa penting akun medsos kppn buat kanpus satker kalau grup tele wa apa relevan rasa enggak sih mending satker tanya langsung grup,0,{}
2123,anger,ideal memang kpk tingkat status ganjar saksi jadi sangka curiga lindung kuasa cair kpk percaya,0,{}
2124,love,sekarang baru ku erti teka teki mu kalimat indah tak pernah ku sadar tulis ku tak sangka jatuh cinta mudah sahabat baru ku,0,{}
2125,fear,gue dulu bingung orang trauma panjang sekarang baru sadar rasai sendiri enggak speak up kadang takut bilang lebay lah bohong lah bla bla ngatasin trauma susah tambah judge orang jadi mending diem,0,{}
2126,love,semangat sayang aku tunggu anak lahir ahahahhaha,1,{'USERNAME': 1}
2127,love,awal temu sama sih mantan pas wgl pertama enggak mau lanjut aku bikin tweetnya bilang terima kasih kayak enggak ngerti jadi tempel te- aku yaudah deh aku jadi demen te- jadi,0,{}
2128,fear,masa-masa sudah lewat walaupun memang enggak fanatik banget sekarang risih lihat indak tarik okesip,0,{}
2129,fear,ularrr paling takut ular allah jangan hantar tetamu hidup ku sungguh aku mampu sabar manusia kaki belit tak mampu sabar bit ular geli,0,{}
2130,sadness,kangen ajar privat kangen ajar tpq kangen rapat jam pagi kangen agenda nginep sabtu-minggu yea my life sok flat now maybe i need cheetos,0,{}
2131,fear,tanggal juni kemarin degdegan umum dospem skrgpun ngawang,0,{}
2132,fear,akhir langsung bingung saling tatap-tatapan muka gitu merinding pasti takut bangeeeeeettt akhir enggak pikir panjang lariiiiiiii deh semua,0,{}
2133,anger,picik banget meng-kait kan soal gempa politik jenis kalau bantu sila via dompet bantu enggak perlu nyinyir medsos,2,{'USERNAME': 2}
2134,fear,masa depan scot langsung cari rumah dong rasa aneh dunia apa gerangan rumah kaget sosok perempuan cantik nan putih umur tahun siapa perempuan,0,{}
2135,happy,pertama kali ketemu pas bayi umur bulan sekarang tahun kelas sd time sok fast nama raditya punya cita cita jadi tugas madam bakar pintar sekohale,0,{}
2136,fear,eh asli gue tonton memang seram banget sih asli tuh enggak mau ngebunuh org cuman jatuh cinta akhir enggak tau kalo ketidaktahuannya ubah jadi malapetaka horor woy,0,{}
2137,anger,komen julid begichu pengin dm sama sih laku pernah dm hayuk hayuk ajak enak enak otak kagak dipake bayang anak ente kena udalaah susah tanggap otak isi dengkul cebong,0,{}
2138,anger,anggap saudara bubar acara ustadz beri tausiah ilmu kamimikir dikit napa,3,{'USERNAME': 3}
2139,happy,alhamdulillah juli is our happy day congratss my sissyy meski gadapet snm jalan buat raih mimpi padahal snm merah menang sengguk peluk dua eh nyata balik ketrima satu nya pilih snm,1,{'USERNAME': 1}
2140,anger,man teman hormat enggak kumpul hp buat apa kumpul bareng asik sendiri kalo mending rumah bae tahan berak,0,{}
2141,love,temu dengan takdir jadi teman pilih jatuh cinta mu benar-benar luar duga,0,{}
2142,love,jatuh cinta ryan gosling sejak the notebook mungkin enggak pernah bosan tonton ulang lah lah land sekarang lebih kali tonton lah lah land mata sayu senyum lembutgosling banget,0,{'URL': 1}
2143,fear,army aku baru terima ju- ilmu teknologi pangan ada kuliah ju- bantu aku tenangin diri soal takut masa-masa kuliah,0,{'idm': 1}
2144,anger,min aju reksa dana tuju tanggal kok enggak voucher gift card cek email,1,"{'USERNAME': 1, 'URL': 1}"
2145,fear,mah takut belok terlalu miring pernah jatuh konyol pernah hampir jatuh masuk jurang ban benjol sekarang ngebut parah tiba-tiba enggak ngontrol gas sama rem bikin hampir mati tabrak tanda apa coba,0,{}
2146,anger,media sosial malah ngeri cuk yakin benar aku lahir nk suroboyo gede nk suroboyo lek baya ku idek wani dep an baya iku harga diri,0,{}
2147,love,sayang seperti salah nih kata bidadari tinggal surga kamu tinggal hati sih,0,{}
2148,happy,bukan perkara siapa lebih handal bagaimana harga saling ingat jaga nama buka cara baik tetap saling bercengkrama kan wit,0,{}
2149,fear,terlalu bodoh sekali bila mudah pengaruh tipu daya setan bila benci cukup sifat bukan objek takut kalau tiba-tiba allah suruh pulang benci hati lebih takut hilang allah apa masuk keluarga,0,{}
2150,happy,selalu bahagia keliling orangorang baik orangtua baik keluarga baik pasang baik teman baik nyata nikmat lebih indah banding materi keliling orang baik terimakasih banyak maha baik,0,{}
2151,fear,sumpah tadi gue tidur jam ba-an gue bangun gara-gara mimpi kejar setan gue mimpi kejar miss gue enggak erti awal nya bagaimana gue ingat awal,0,{}
2152,anger,no signal g full kemarin malam problem lokasi jalan raya legi no ganti isp nya restart hp enggak buka apa apa bantu,1,"{'SENSITIVE-NO': 1, 'USERNAME': 1}"
2153,happy,sakit moga sehat cari kerja temu segera bimbang beri yakin hilang arah ingat allah sehat bahagia selalu,0,{}
2154,love,lahir keluarga bahagia penuh cinta penuh kasih hingga tumbuh jadi sosok penuh karisma memcintai cinta juta manusia,0,{}
2155,fear,tuju pak sama antisipasi giat sotr pak lama jadi justru ujung tawur serta aksi vandalisme cipta aman nyaman warga kasihan pulang kerja larut malam lebih dekat hari raya,1,{'USERNAME': 1}
2156,anger,tuju bang begini bikin hidup enggak tenang yagk pikir kaya bagaimana cari order pengin enak sendiri jadi gw gedek benar bikin opik begitu,2,{'USERNAME': 2}
2157,happy,congraduation angela merici akuu sedih sih padahal kamu sengaja kalah buat aku tetap duluan kamuuu sarjana lho njel rang lot,0,{}
2158,love,sayang banget sama anak yaampuuuuuunnn coba nandingin dance badan karet tulang ten sini maju wkwkwkw,0,{}
2159,anger,tau akun verified netijen indonesia galak deh sih mas habis lahap netijen turut speakup sini bagaimana cara adu sebut pihak lebih kuat kalau anakanak ortu guru bukan cari massa buat nge-hate laku apa beda sama main hakim sendiri,0,{}
2160,sadness,sayang ribu sayang tak satu nyangkut sekarang,0,{}
2161,sadness,mau bilang rindu bukan siapa mau blang cemburu bukan siapasiapa emang benar bukan siapasiapa mana apaapa,0,{}
2162,anger,sekian kalinyaga paham sama akun anonim mulai bablas bebas argumen banyak kritisi enggak pakai nalar hati nurani awal tarik tweetnyamakin kesini makin enggak punya kontrolah,1,{'USERNAME': 1}
2163,fear,rlt minta saran dong aku pesan sepatu po nah biasa datengnya minggu minggu lebih bulan sepatu enggak dateng bayar sih cuma sepatu mau aku pake enak tanya bagaimana sama jual mau pesan takut sepatu dateng,0,{}
2164,happy,ekspor komoditas kebun naik tahun sd keren buat,0,{}
2165,love,sela-sela sibuk kantor kalau tiba-tiba kangen tobio gue seringkali lihat foto video handphone god sayang banget gue sama tobio,0,{}
2166,anger,jadi pimpin gubernur pikir mateng cipta kerja kembang tong sampah buat indonesia anti bocor beli butuh dalem negeri bukan beli impor tong sampah,1,{'USERNAME': 1}
2167,happy,benar awal gua taksir coklat waktu stock kosong tt gue kepo parah sama sound headphone ingin milik terlalu kuat jadi beli stocknya aja akhir gue jodoh steel,0,{}
2168,anger,hehehee kan memang mintaseha-nya tbg gentle kalau memang jalan undur diri u- maupun kader,1,"{'USERNAME': 1, 'URL': 1}"
2169,anger,rame sexual harassment garagara via vallen banyak pro kontra atas laku via kontra mungkin tonton reason why sih tuh cerita kmn minta tolong orangorang nganggep sebut sepele telek,0,{}
2170,fear,maaf prof bukan cuman takut telanjang jauh korupsi kerna dosa punya iman takut allah maha tahu,0,{}
2171,happy,pagi mbak supir tj selalu semangat kalo nyetir dengar lagu macem tadi muter lagu sayang versi bahasa jepang ikut semangat lihat jadi mikir ye sayang banget orang enggak mau nikmat cuma beda bahasa,0,{}
2172,fear,berat badan kg aku minder aku takut bully aku takut bilang cantik langsing bukan sih a n t i aku takut bilang gapura camat,0,{'URL': 1}
2173,love,bagaimana jelasinnya wkwkwk orang pertama kali bikin rasa degdegan pengin kenal lebih te- pengin dekat te- gitu biasa pas kls kalau aku relatif sih wkwkw,1,{'USERNAME': 1}
2174,fear,sih jadi - - enggak berani keluar buat manasin air gegara diceritain siska something memang dasar apel kamu siska bikin takut,0,{}
2175,fear,turut sih lingkung tempat tinggal bully sih adek memang anak preman bapak kakak hobi mabokan antem ngeri jadi takut nyekolahin anak sekolah umum,2,{'USERNAME': 2}
2176,love,selamat ulang tahun idolaku u sekaligus ebesku cinta walaupun jarang ketemu tetap selip doa untuk moga senantiasa beri kesehatanrezeki rendah hati,0,{}
2177,sadness,yuk akhir masuk minggu awal bulan juni enggak asa tengah tahun aj nyata banyak target realisasi skr ajar displin konsisten biar bisnis oriflame makin lancar,0,{}
2178,sadness,kali kali farah suka ingat enggak dite-in kata makin gue perhati makin sulit buat gue lupa soal nihya far gue coba jaman kapan ahelah ujung penuh risiko re suka kgn hmm pahit,0,{}
2179,happy,alam kemarin hari jiwa raga sedang tak irama rungsing awal curhat kawan akhir berkontlemplasi sendiri hasil nyata allah baik banget asih percaya atas soal hidup begitu kompleks,0,{}
2180,sadness,bilang kamis hadap temanteman kerja tadi pagi pas apel tegang jadi akak garagara ngengeblengan orang pegawai mau mimpin yelyel ajak intermezo dulu padahal malu lho,0,{}
2181,fear,jujur gue takut banci ngamen sih pernah jadi soal banci ngebegal seram banget kalo lah marah marah nodong piso,1,{'USERNAME': 1}
2182,happy,ba-an telpon sama teman sd happy banget mau asih gue sempat laku pengin gue laku banget-nget-nget,0,{}
2183,sadness,pasien curhat th cuci darah tetap positif keluarga supportif tinggal anak suami untum rumah sakit enggak ongkos padahal cucidarahnya gratis bayang th cuci darah mashaallah deh nikmat sehat,0,{}
2184,love,rasa gue tanya bilang sayang deh tuh naaaah sayang sayang nya nama mau ketemu mulu mau diliatin mulu orang-orang,0,{}
2185,fear,gue tadi sekolah kucek kucek mata kan habis banyak bulu mata rontok auto panik nih takut kalo gundul belah nah bulu mata tuh tumbuh enggak sih,0,{}
2186,sadness,kata sekarang caci ria kasar kemunafikanutk sekarang lebih pilih diam jauh hidup,0,{}
2187,fear,ngeri nyata popok seklai pakai jadi picu utama infeksi salur kencing jangan lengah praktis popok sekali pakai tak perhati bahaya dekat sih kecil,0,{}
2188,happy,hari ganti sore rasa letih makin tingkat tetap semangat,0,{}
2189,sadness,innalillahi wa inna ilaihi rojiun turut duka cita atas tinggal ibunda cinta sohib gua memendurehmen moga almarhumah husnul khotimah amal ibadah terima sis,0,{}
2190,anger,kamu bilang sayang bila bangun lanjut apa kamu pikir presiden ikut bangun bilang sayang hutang gunung jokowi lanjut hingga negara bangkrut selamat jadi cebi syarat memang otak pakai,1,{'USERNAME': 1}
2191,sadness,mubalig versi menagsdh ditatarbahan ceramah sesuai menaglucu jugaceramah terkendalijika mubalig tolak menag munduriya dongkalo punya harga diri,1,"{'USERNAME': 1, 'URL': 1}"
2192,anger,jilbaber baju natal norak anjing kalian mnyambut hotel wahai intel setan apep ahmad tardiyana urbane anjing pola ulah intel busuk lo ikut orang kemnpun taekkkk alat teror bngsat kalian pasang kamar kerjasama hotel taek,2,{'USERNAME': 2}
2193,happy,serius kalo pak kalah mending kalah sama yusril sama prabowo kan enggak mungkin kalah yahahaha,1,"{'USERNAME': 1, 'URL': 1}"
2194,fear,moga besok umum baik allah amin lancar segala benarbenar deh judul sekarang tuh gue penuh tidak pasti nanti huhuhu benarbenar bagai aspek tenang enggak sih nih hidup,0,{}
2195,fear,dek cuma takut asa lebih batas kakak kelas henti sekalipun alas kamu abar bosan,0,{}
2196,sadness,memang allah maha baik bahkan banyak ajar hal-hal kecil jadi semalem bilang sabar jalan jangan bawa kalut dulu memang dasar iman cetek bukan nenangin diri malah sibuk ngeluhin sih bapak,0,{}
2197,sadness,jarak rindu hanya angan jarak tak jelas aku lihat rupa jarak tak benar-benar aku,0,{}
2198,sadness,duh sakit sekali orang jujur bakal bilang kalau asa sama paksa balas asa biar kejar orang suka,0,{}
2199,fear,me as a girlfriend always pujuk my bf if rajuk because i dont want lose him asa takut automatik datang bila deh sayang hmm,0,{}
2200,happy,yakin aja datang pergi begitu balik ganti mungkin nol ajar lah proses mau ajar,0,{}
2201,love,apa jadi hadap wujud impi hati yakin tuhan restu cinta kan abadi lama dunia putar cinta tak pudar tiada pernah ubah abadi panjang masaaaaaa aahhseeeek,0,{}
2202,fear,mau jalan kaki luar kosan takut kena jambret mau nenteng kamera handphone alhasil gabut dalem kamar sendiri laptop kue basah beri kamar tetangga,0,{}
2203,fear,tiap malam kayak begini aku selalu resah semua jadi apa jadi esok malam aku resah berita muncul tanggal kemaren,0,{}
2204,sadness,lama bilang kalo sedih lihat temen-temennya ngalamin masa sulit bahkan enggak mau punyagrup chatting khawatir kalo enggak balas malah jadi sakit asa se soft lho,1,{'USERNAME': 1}
2205,fear,kabar akhir sih timi enggak berani pulang tidur serambi masjid trauma diri campa sang milik,0,{}
2206,love,gue lemah sama ke-daddy-an kayak lo bri lu bikin gue makin sayang tau enggak kalo begini cerita pengin hilang gue lah,0,{'URL': 1}
2207,anger,nama orangtua memang wajib kan bayarin anak sekolah jadi enggak nama buang duit semua dilakuin sama baik benar apa enggak enggak bakal sia sia enggak usah takut gagal enggak usah mikir buruk justru sia sia kalian ngejudge orglain kayak begini,0,{}
2208,fear,guys gua mau upload twibbon universitas instagram minder univnya swasta takut pandang remeh enggak layak buat pajang diinstagram salty-in enggak apaapa kok,0,{'askmf': 1}
2209,love,park woojin sayang cinta apresiasi beri makan enak beri peluk hangat beri kopi panas cokelat panas serah deh penting bahagia pokok inti park woojin buat bahagia,0,{}
2210,fear,iya untungnyaaa jangan manta dulu deh kemarin sepupu pulang bal disaranin pakai pesawat mobilny tinggal jogja habis nyebrangnya coy horor,0,{}
2211,sadness,kalo nanggung kea sekarang lebih betein ketimbang pas pendek dulu yes sekarang no mungkin ambek selalu potong tahun enggak pernah lewat bahu and lu kak,1,{'USERNAME': 1}
2212,sadness,alas aing jarang balas chat obrol sama manusia lebih seru banding chat kadang enggak jelas bahas apa,0,{'URL': 1}
2213,fear,benar aku enggak masalah kalau lihat isi medsosku from time time catat apa risiko tanggung sendiri kalau tukeran username password mungkin baja aku malas,1,{'USERNAME': 1}
2214,sadness,kalo enggak duli perhati kalo tak mau dengar bicara kepada kalo putus pergi tahan ikut tak perlu cari jawab kamu perlu hilang kalo,0,{}
2215,fear,ih ngeri edar foto luna maya jadi suzzanna bikin merinding,0,{'URL': 1}
2216,love,kalo dokter panggil dok - kalo suster panggil sus - nah kalo apoteker ap tek ker iya yah bingung aku pribadi sih lebih senang kamu panggil sayang warms sama heart,0,{}
2217,fear,bagaimana jalur lewat jalur lewat truck aku mikir begini sayang enggak sih sama nyawa beberapa umpat lain jalan kurang terang banyak sekali lawan a- jalan,0,{}
2218,anger,sih gendut kalau suruh ogah jalan dasar kebo,0,{}
2219,fear,seram kangkl macet padahal tol semua yaahoror mah,0,{}
2220,anger,jadi dulu pernah bilang begini mas lu cuma maen doang sama gua kagak lah bege kalo buat main doang kapai gua tunggu lu tahun rajin banget gua and finally putus wkwkw makan tuh,0,{}
2221,love,paling buat hari-hari selalu indah kamu kamu asik anugerah sempurna indah hidup ku,2,{'USERNAME': 2}
2222,anger,kurang intensitas kabar jadi tak kabar tiap hari yakali tiap hari banget begadang cuman buat face time telpon kantor tidur nama juang det enggak sih bejuang enggak konyol saat lah,0,{}
2223,love,yoongiii kangen banget atit nih akunyaaa akirnya update uga makin putih enggak pernah keluar kamar keknyaa lama summer yaaa sayang anet sama yoongiii,0,{}
2224,happy,usaha ikhlas pasrah hasil serahin sama atas allah atur segala tau baik buat umat usaha enggak menghianati hasil kok semangatindirisendiri,0,{}
2225,sadness,hm bagaimana lihat orangorang against via vallen leceh leceh mau verbal fisik jadi ingat pernah begitu hmm,0,{}
2226,sadness,makin modern gaya hidup makin banyak kamu produksi sampah plastik believe orang not coba hari kalo kamu makan berapa sedot gelas plastik plastik makan kamu buang,1,{'USERNAME': 1}
2227,fear,cerita a cerita b cerita sih aku harap hubung suami isteri halal lah huhu jangan bawa main tau cerai ni bahaya,0,{}
2228,love,ah panjang pokok tuh aku sayang kamu i love you saranghae,0,{}
2229,sadness,turut dukacita atas korban gempa bumi lombok moga tuhan senantiasa ikan baik cc,1,"{'USERNAME': 1, 'URL': 1}"
2230,fear,baca aku jadi takut padahal pakai sehari-hari syar kerudung tutup dada selalu pakai rok,0,{}
2231,anger,orang enggak tau diri kursi belah kosong buat naruh jakettas enggak bagi kursi diri belah tetap enggak mindahin barang,0,{}
2232,sadness,wah sekarang enggak tulis apollo pollo damai masa lalu tinggal mbak nih damai ah sudah haha,0,{}
2233,sadness,malam aku doa moga apa apa overdosis negeri segera dosis apa sedang sedang aja tengah tengah aja lebih enggak baeek,0,{}
2234,anger,omong sih ayo sama sama windu lebih gilir sekarang chat enggak balas telpon reject ajak ketemu bilang sibuk pokok deh juta alas kerbaushit-nya kalo mau ngindarin bilang sih enggak usah gitu classic banget anjir,0,{}
2235,fear,masa aku baru pacar kemarin enggak saling kabar-kabaran mau chat nya random aja te- aku mau ngabarin kayak mikir x takut nya ganggu wajar enggak sih,0,{'askMF': 1}
2236,fear,hhh sekarang pikir sama mahasiswa suicide skripsi pressure orang takut kalo gue nanti kayak gt pikir skripsi stres banget tambah pressure orang orang dekat nanyain kapan lulus takut entar pas gue skripsi-,0,{}
2237,fear,allah ngeri banget tadi b-an sawa ukur pipa pralon gt makanya gue tutup sela pintu tkt badan elastis masuk sela,0,{'URL': 1}
2238,anger,gilir lantai produksi mastiin nanyain langsung apa tulis malah digangguindimintain foto yaampunnnn mas mas pusing akutu pengin cepat kelar te- balik jogja malah begini mmbbzzzz,0,{}
2239,anger,tak tahu fine kalo selalu bilang tak tahu kok jadi enggak erti cari aman ah sudah maju kota bahagia warga,0,{}
2240,sadness,kan benar mas fisip enggak bekal bagaimana skripsi minimal motivasi rohani hadap skripsi wkwk,1,{'USERNAME': 1}
2241,sadness,wah gila sih lokasi mirip selly oal dixy persis pengkol jalan sayang dulu enggak mas british kayak gin kalo mungkin gue sering nongkrong dixy bukan pus,0,{}
2242,happy,aku tanya apa sih memang bawah udah ikut aja ajak aku ekor belakang nyata mcflurry ha- kalo hujan begini beli anget eh malah kata udah enggak apa kan kamu tadi beli hujan canda kamu toleh tertawa,0,{}
2243,love,orang kata satu cara buat wanita jatuh cinta buat nya tertawa aku tak pernah nyata tertawa justru aku makin cinta,0,{}
2244,sadness,kalau disaat-saat kayak begini rasa gue pengin banget tinggal kampung allah daerah gue enggak adat istiadat sundanya huhu monangis,0,{}
2245,sadness,main ludo lawan komputer sempat kalah gilani - izam enggak apaapa penting pernah menang biar enggak jadi loser te-,0,{'URL': 1}
2246,love,oppa nih aku flower bucket buat kamu maafin aku bikin kamu ambek enggak ngabarin tadi aku sayang kamuuu,0,{}
2247,love,cowok romantis mah pokok cowok idam aku arti enggak langsung sayang banget sama aku segala perhati,1,{'USERNAME': 1}
2248,fear,dulu pernah depresi sering hina orang dekat suka dibully broken home minder punya hasrat sexual lewat enggak nyalurin takut dosa kayak biasa serius enggak arah hidup,0,{'URL': 1}
2249,sadness,segenap pegawai lingkung menteri hubung sedang duka atas musibah timpa rumah proses madam api hasil laku walaupun rekan jadi korban,0,{}
2250,love,kalo pasang sakit rewel bad moodkasi perhati kasih sayang lebih meski memang kalo kondisi cenderung sebal bikin mumetdimaklumin aja justru kondisi kayak butuh banget cinta perhati sabar lo,0,{}
2251,fear,pertama kali nya komen ig orangorang debatgils sok iye banget sih guee ngeri nyinyir balik sama orang nih woy pegang gue cuma aja sama allah deng,0,{}
2252,fear,kalo presentasi kalian maaf nih kurang suka sama bicara depan umum suka awkward enggak sih takut salah ngmg,0,{'askMF': 1}
2253,fear,kalau bukti kuat coba makar guling perintah sah siapa proses hukum,3,{'USERNAME': 3}
