,label,tweet,masked_word_count,pattern_counts
3301,love,aku ramal kamu datang rumah temu orangtuaku entah tamu undang nikah justru damping aku yakin,0,{}
3302,anger,paling suka orang sombong tanah hektar aset limpah saldo rekening digit itu baru satu rekening punya banyak investasi dubai diam-diam,0,{}
3303,fear,ku takut aku tampak te- jalan tak oleh ajar akan semua asa aman nyata batas angan-angan tinggal sesal,0,{}
3304,fear,mu guys aku mau ngecat rambut belum aku pernah ngecat rambut mau minta saran warna apa jangan heboh aku takut kaget,0,{}
3305,love,seluruh cinta apa diri lekat jadi indah cinta leku tubuh semua sisi segala ketidaksempurnaanmu sempurna jadi milik,0,{'URL': 1}
3306,fear,takut lewat magrib jam nyiapin buka masak beli cari tempat buka pasca buka leyeh leyeh ngopi sc punya vietnam kopi enak imho pulang jam ngantukk bgt goler tak tidur sosmed muter yt twitter gag pubg jam bangun set,0,{}
3307,sadness,umur aku tanya cita-cita apa tak jawab usia sekarang erti ada privilege masyarakat banyak milik penuh butuh sehari-hari masa datang cukup,0,{}
3308,anger,suatu jadi tindak aparat paksa laku tendang bebas,3,{'USERNAME': 3}
3309,fear,rumah lantai dekat tangga cium bau pandan nyengat banget padahal enggak apaapa sana makan pandan enggak te- gue takut,0,{}
3310,happy,terima kasih kak cantik lukis digital kak dinda,1,{'USERNAME': 1}
3311,love,kalo konteks suka pakai alesan kayak gue suka ganteng kalo konteks sayang gaperlu pakai alesan lg apa laku ngebuat jatuh cinta sama alas titik,1,{'USERNAME': 1}
3312,happy,ira beli wkwkwk maksud tuh ongkos gojek yhaa aduuu cian gapapa lah buat sendiri beli buat orang eh enggak makan kalo enggak dikasihin orang bagus mandiri lama sendiri tetap manja,0,{}
3313,sadness,jempol imut etik isi hati gundah gulana kita mikir untung nya apa keluar unek-unek disosmed semua makhluk sosmed tau aib-aib konsumsi sendiri indak malah diketawain sok mikir,0,{}
3314,happy,turut koalisi keummatan main elit partai sajarakyat akar rumput tau siapa pimpin pilih pilih jujur tau kerja kerja kerja,1,{'USERNAME': 1}
3315,sadness,hari batas apa kamu ajar deras hadap tak mudah jalan cerita hari batas ambil semangat hati semua kamu percaya tuntun langkah pulang sini,0,{}
3316,anger,kalau pilkada photo panas sebab orang undur diri tentu indonesian idol wajib mundur bentuk video,1,{'USERNAME': 1}
3317,happy,huhahiheho mas dongho happy birthday sayang pokok sayang sama kamu perkara tuhan mengijinkan u- belakang moga kamu bahagia te- mas sehat te- bahagia te- biar aku ikut bahagia,0,{}
3318,love,masuk bulan pertama mensive gua sama tetap baikbaik aja enggak masalah sedikit baik ramah perhati orang erti banget enggak banyak tuntut gua bikin gua sayang banget sama,0,{}
3319,happy,selamat siang sahabat pos kirim sebut terima sahabat terima kasih percaya guna layan fd,1,"{'USERNAME': 1, 'URL': 1}"
3320,sadness,ngbrol masalah gaji atas aing waktu bagaimana sih ndre detail gaji jelasin pak aing enggak tau pak nanyain gaji malah marahin atas aing aing savage langsung backsound mobile legend,0,{}
3321,happy,ceri sama teman-teman baru sangat mengasikkan salam gowes republiksepeda mtb indo bikestable gowesnusantara gowes holic,2,"{'USERNAME': 2, 'URL': 1}"
3322,sadness,dulu hingga sekarang bagaimana biasa kali pasuk bulan ramadan giat pariwisata indonesia asa lesu ras jumlah jalan wisatawan nusantara tanah air cenderung alami turun,0,{}
3323,happy,selalu optimis saing tim mana lihat siap panjang jalan lalu lebih lihat hasil tanding hari pertama dua baru jalan,0,{}
3324,fear,esok pagi aku tanya sama bapak emak apa tadi malam nyalain tv eh nyata enggak tau siapa nyalain tuh tv iihhh aku jadi pikir nggak-nggak aku pikir kalo genderuwo nyalain tuh tv iihhhserem,0,{}
3325,sadness,sial haha kamu galau we hehe kamu memang sana stres div,0,{}
3326,fear,jadi kalau misal gagal tinggi badan tetap dialihin prodi mohon jelas soal degdegan kemarin haha,4,{'USERNAME': 4}
3327,fear,nyata black campaign jadi negeri miris sekaligus ngeri bila oleh jabat hasil fitnah bohong,1,{'USERNAME': 1}
3328,love,moga allah meridhoi niat sayang mudah gampang lancar selaha niat baik kamu sayang saat nant tiba jadi sabar ber istiar lah amin robb alamin,0,{'URL': 1}
3329,fear,gue mau cerita kalo akrab sama susin cuma bulan kerja kayak akrab bgt kayak teman sekolah aja gue tahu bagaimana kpribadian susin sbnernya sih kalo gue perhtiin ngeri kalo ajak ngobrol,0,{}
3330,happy,character developmentnya sih gua paling suka walaupun memang film pertama rada apa sih ostnya bagus semua gapaham,0,{}
3331,fear,jadi hari sendiri rumah dengar lagu pakai speaker eh tbtb mati sendiri padahal pakai charge biasa kalo low tanda kan seram deh abistu ingat film sabrina lalu bilang begini,0,{'URL': 1}
3332,sadness,apa beda diri selalu diam lama pergi jauh abai masalah datang nyata ku akhir,0,{}
3333,anger,bagaimana sih awal gasuka kalo diperjuangin te- jadi rada suka arti beneran kalo diperjuangin jangan kurang ajar diperjuangin eh malah pasif kasihan merjuangin tuh,0,{}
3334,sadness,bunga mawar milik duri jikalau memang ingin mungkin kena sedikit gores kulit hidup kadang rasa perih atau luka nikmat kebahagian dalam jar,0,{}
3335,anger,sianjiirrrdemen banget bikin kontroversi,1,{'USERNAME': 1}
3336,fear,tungkai gemetar bukan main duduk hati-hati jangan peluh jatuh hadap atas satu kelompok mafia buat hampir gila,0,{}
3337,love,selamat hari tetas tahu bulat versi korea kuhhh exols sayang kamuuuuuuuuuu lebih kamu tau hu tahu bulat,0,{}
3338,love,modal haha-haha bareng jatuh cinta nyaman datang receh,0,{}
3339,love,rindu penjara aku betah dekam dalam coba kata bagaimana cara bebas kata rupa kutu buru te- laju degub jantung,0,{}
3340,anger,barang kirim no resi kok antar padahal tanggal jam wib angke pagi kok enggak te- alamat tuju,1,"{'USERNAME': 1, 'URL': 1}"
3341,love,alhamdulillah kakak sama teteh baikkkkk banget sayang banget sama aku allah jadi kangen teteh aku suka banget manja aku kalo kakak aku suka banget belanjain aku padahal aku enggak minta pokok aku sayang banget sama,0,{}
3342,happy,yuk siap berihtikaf malam tiga terakhirmudahan dapat malam bulan tahun depan ketemu bulan penuh maghfiroh,0,{'URL': 1}
3343,love,kalo aku bilang sayang sama kamu tanda aku bohong sama kamu kalo aku benar sayang aku nikah kamu makanya aku mau nikah kamu,0,{}
3344,love,cewek suka bola mata cowok cantik nambah biarpun mata panda,0,{}
3345,happy,aku hamil sama abang masa hamil sama setan aku hamil sama abang masa hamil sama siluman playlist nyata sering puter radio mobil pagi berangkat school haha,0,{}
3346,anger,dear kena jadi mohon kai ambil tindak tegas selalu guna jasa kak hampir tiap bulan gambir semarang - semarang gambir memohin sangat baik bapak tunggu bawah ijin kan tumpang turun dulu,1,"{'USERNAME': 1, 'URL': 1}"
3347,anger,sering jadi bahan diskusi mlht kondisi indonesia bbrapa tahun akhir utamanyasbg warga negara peduli situasi dirasakn kalo mlht latar blkg pdidikn bpk tahu sdri,0,{'URL': 1}
3348,love,sayang banget bangga banget besok gilir pamerin ijazah kelulus bangga kalian enggak langsung sukses te- mas-mas ayo juang bareng,0,{'URL': 1}
3349,sadness,hari ibu usia tahun ulang tahun kue drku aku dktnya qyara kau tau ingin aku selalu moment hidup betapa aku hadir segala senang hidup tak laku syng,0,{}
3350,anger,cewek gue salut banget sama via vallen buat cewek tindak leceh macam aib enggak pengin orang tau berani thats why gue sangat emosi baca komen hujat sama cewek bukan saling kuat malah jatuh sok sad,0,{}
3351,sadness,aku rasa hidup jiwa orang miskin kayak sama ganas harta bagai binatang rimba nocturno,0,{}
3352,sadness,gitar pinjam teman kembali kata aku balikinnya pas kamu pulang bukber orang mau balikin barang gue malah ajak bukber sekali,0,{}
3353,love,gue lebih sayang internet friends lebih peduli bahkan selalu cheer up pas gue down keti bikin mood gue bangkit bikin gue ketawa cuma lewat layar hp i dont deserve them but i cinta them sm,0,{}
3354,love,beda ngenalin semua enggak pernah gue tau belum enggak pernah nunjukin apa apa disosmed ajar gue buat cinta sama alam makanya gue enggak move on sekarang hes the one,0,{}
3355,fear,lo punya t-t issues lebih bau cinta akhir cinta life lo enggak pernah jalan mulus penuh tidak percaya,0,{}
3356,fear,lama dlem kmr aku suruh pacar bwa tmennya u- ghaib tuh lama dlem kamar aku dengar cinta teriak ketawa kunti erang keras gt langsung hampir jam,0,{}
3357,sadness,aku tadi enggak mau baca beres skripsi wkwk padahal pas bedah buku catat juang aku dateng fix banget semhas habis libur lebaran huhu waktu tepat,1,{'USERNAME': 1}
3358,love,baby you came capek sayang sedikit enggak banding kalo hilang kamu flat face cium dulu dong,0,{'URL': 1}
3359,happy,nyante dulu sruput kopi biar tambah bijak,0,{}
3360,happy,marak ramadhan bulan milad al quran tahu kapan mulai turun wahyu bawa malaikat-nya sampai nabi muhammad saw,1,{'USERNAME': 1}
3361,fear,kadang asa dilema ibarat orang meni lalu hadap kdrt trauma besar hendak mulai hubung baru aku aku jadi rendah diri trauma cari kerja baru mental jatuh aku hari lebih loser,0,{}
3362,happy,gp hitam manis laku cuma ngakuin pacar orang yeh,0,{}
3363,anger,hari lalu ane pernah begini dekat cuma km argo rb bayar rb mau cancel kasihan tunggu lama kata enggak mau lah iya enggak mau driver nya kalo kayak begini cs nya,1,{'USERNAME': 1}
3364,sadness,biasa marketing ngejar cust gue balik lhooo gue kejar cust muluusampe kadangkadang cari cara bagaimana cara nolak,0,{}
3365,love,sayang lo selalu enggak dda ganti lo walaupun lo bukan milik gue gue kan tetap sayang sama lo gue lebih sayang sama lo dibandingin rsa sayang gue cowok gue,0,{}
3366,love,sambut cinta duhai sayang cinta lama biar sentuh hati sendiri selamat malam wanita akhir tak mungkin kan temu indah bila ku nanti kau jadi milik ku,0,{}
3367,anger,tentu bekas hal-hal sayang elak bekas panas banget bekas kalau weekend soremalam macet banget sebut diatasin sih kalau panas pakai ac ngindarin macet rencana jadwal keluar rumah,0,{}
3368,anger,aju paylater tolak alas krg rinci apa bantu alas lebih pasti rasa foto ktp info ikan cukup jelas kriteria apa ingin traveloka,1,"{'USERNAME': 1, 'URL': 1}"
3369,anger,kemarin listrik segel lambat bayar laku lunas lapor mll call center progress reportnya sangat lamban,2,{'USERNAME': 2}
3370,fear,kurang jelas ku molor paman seperti pas puter balik sih motor langsung masuk jalur busway jangan ikut yaa pelisss gue horor lihat,1,{'USERNAME': 1}
3371,sadness,sedih ig banya hate comment via vallen mungkin pernah rasai sakit sexual harasmen even bukan kontak fisik bayang diri sendiri nilai segitu rendah pengin ngaplok orang be true aja,0,{}
3372,love,ku setia sorang iaitu kamu nr aa nya aku pegang jnjiku nih ku shidup mati dgnmu allah maha mengatahui doa baik yakin doa kte ble dah krje jauh ku harap kamu faham satunye ku sayang kamu nr aa na t-t me,0,{}
3373,love,gue sayang allah i want them be happy their entire life pengin sukses jodoh baik punya rumah tangga langgeng punya anak lucu gue selalu doa moga tetap bareng gede jadi ibuibu nenek nenek,0,{}
3374,love,enggak tau deh nyaman sama enggak kayak segi bahas pokok enggak buat bosan padahal akutu bosenan orang akutu orang susah marah kalo sayang hmm ah,0,{}
3375,anger,hmmtapi kok ngganjel bawah menara tegang tinggi kirakira kasih kam apa lihat bikin jalan tuju menara,4,"{'USERNAME': 4, 'URL': 1}"
3376,love,cinta negara rupa bentuk bela tanah air jadi pahlawan negara bentuk manifestasi harga tamu negara sedang undang negara,1,{'USERNAME': 1}
3377,sadness,ig post foto mulu bilang alay post tulis bilang galau mulu save bikin whatsapp story kalo marah sama gebetan sak ro lalu otw mbalang kalem,0,{}
3378,fear,coba cari te- siapa tahu cebur jatuh perangkap dalam gua gua gelap banjir jadi licin ajach kepleset,0,{}
3379,love,suka sama cewek beda kelas dong gue kelas a waktu sih cewek c kalo enggak lupa untuk kamu cinta pertama,0,{}
3380,sadness,galau sih solusi utama ku sih bikin target rencana mau kapai umur sekian te- fokus usaha capai biar enggak te- pikir problem quarter life crisis,0,{}
3381,happy,enggak apaapa miss exols bakal tetap tunggu tau susah payah nya buat datangin exo semagat miss fighting aeris waktu bakalam ketemu uri exo jangan sedih,0,{}
3382,sadness,moon cintars sedi banget dong kayak cinta segienam banyak matek harap sih nikah sama sih malah nikah sama sih sad ending,1,{'USERNAME': 1}
3383,anger,beberapa tempat sedia tmp contoh pasar gembrong tetap pakai trotoar harga dagang negeri punya atur semua happy,3,{'USERNAME': 3}
3384,happy,inshallah kalo gua rejeki foto bareng tom gua enggak bakal kasih atur ina inu ribet gua post kesini bukan buat pamer bagi kebahagian jadi croplah muka gua suka hati,0,{'URL': 1}
3385,love,tanggap aku cinta kamu apa ada eak apa aku erti sisi diri kita kembaranaku erti kalo kamu orang hitung organized samasama enggak pikir penampilam pasang sisi perfectionist pokok i feel you,0,{}
3386,love,kasih sayang rupa suatu anugerah besar hidup lebih milik orang mau beri ikhlas tulus diri,0,{}
3387,happy,uns universitas negeri surakarta daftar kampus cuma butuh kamu terima selamat kalah sekian ribu orang,0,{}
3388,sadness,benar sepi hanya kondisi lupa lupa tuhan selalu sama,0,{}
3389,sadness,te- emak gue taksir semua sama baju gue beli dong te- nih beliau pengin gamis hasil gue blusukan satu tengah jam cuma lalu bsk beliau minta beliin,0,{}
3390,love,selamat sore aa gervan jangan lupa makan sore sayang jangan cape kamu aku sayang kamu,0,{}
3391,fear,kemarin jalan mau ngampus tibatiba sakit perut bulan pulang deh galfok kan nyata penuh sakit enggak parah kayak biasa garagara mungkin hari nyeri plus serang nervous agenda besok gatenang euy,0,{}
3392,fear,sukses tim ombudsman ri segala mohon benar fakta tindak lanjut serius tempo singkat jadi banyak masalah buat tunggu lama mirip tunda laru,1,{'USERNAME': 1}
3393,love,kali kamu senyum pada hati lambung tinggi mata mulai bingung aku cinta kamu buah kalimat aku dengar keluar bibir -d-,0,{}
3394,anger,kalau kenal hayu te- ngajakin tmuan gilir kenal puas tinggal entar kalau butuh nongol hadeh lo kira gue boneka suka hati lo,0,{}
3395,fear,apa aku tak repot sensei tanya khawatir hifumi ambil sandal lalu maka sedikit besar tak apa sandal rumah,0,{}
3396,fear,aku takut asa makin dalam te- sama lebih semenjak aku tau hati tunggu hyung aku makin takut,0,{'URL': 1}
3397,love,enggak tau omong apa pokok aku sayang longguo,0,{}
3398,sadness,jam pagi baru balik lokasi pagi langsung ngerjain begini kantorbener karyawan dedikasi tinggi,0,{}
3399,fear,takut woy sumpah benar paralyzed gemeteran enggak ngapa kapai enggak mikir teman teman gua bilang lu galar lari anjir malah diam situ gua kalo jadi lu lari dah well i would said the same thing if i were you lu enggak tau rasa,0,{}
3400,love,rp hai ele maaf gua enggak romantis gua cuma mau ungkap asa gua kalo gua tarik sama lu gua sayang sama lu gua cinta sama lu gua mau serius asa gua deh enggak usah panjang ele will you be mine,1,"{'USERNAME': 1, 'URL': 1}"
3401,love,enggaaaaaaa sayang tida pandang umur aku bakal bucinin pasang aku jadi mau tua muda nya bakal aku ikut te-sd,0,{}
3402,anger,uang ikut program bukan balik usul program uang sini plot uang dulu baru nyusun program jadi gin uang banyak bangun enggak sentuh,1,{'USERNAME': 1}
3403,happy,hepi besdey pappa allello condropramonozld panjang umur sehat sentosa banyak rejeki makin soleh amin rabb malang,0,{'URL': 1}
3404,fear,jadi malam pulang jam langsung ganti baju te- mau cuci muka pas baru selesai cuci muka kmd pas handukin muka tbtb suara belakang aku persis jadi beberapa kali sesring kirakira apa seram banget lamalama ganggu,0,{}
3405,happy,malam super random banget beli tiket makassar padahal habis beli tiket baru pikir mau kapai makassar kangen jalan se-random dulu,0,{}
3406,anger,tinjau ulang sama team nya kalo benar mau ngundang masuk sexual harassment mohon bijak ulang terima kasih,1,"{'USERNAME': 1, 'URL': 1}"
3407,fear,seru banget jadi manusia banyak hubung sama manusia seru sih seru kadang ngebingungin jg jadi gaenak malah mau gimana lebih ngontrol enggak baik lepas tangan enggak bener sembunyi yaudahh dijalanin one step at a time aja,0,{}
3408,love,sayangkuuuu manusia normal disiniiii terima kasih banyak atas ucap terima kasih dulu mau bange gabung sini padahal oa ecek ecek pokok aku sayang banget i love you,0,{}
3409,happy,walopun doi buka sekolah isi video ignya tuh tahu buat modelling semua wonder hasnt she think about all the pro model that could look into her profile instead and stole all the knowledge memang beda lah kalo orang humble,0,{}
3410,love,apa ha- minta syafaat sayyidi rasullullah cintaaku cinta layak kau cinta apa ha- cari ridhamu sayyidi rasullullah akhlaqaku jaga budi pekerti layak kau budi pekerti umat,0,{}
3411,anger,nge catfish lo nyokap lo sendiri foto wa enggak pernah pakai foto sendiri selalu pakai foto gue banyak klien tibatiba ganjen tibatiba ajak ketemu lah padahal gue nya boroboro modusin,0,{}
3412,fear,temu harimau jawa kampung halaman saksi percaya makin turun jumlah makan kijang banyak buru milik senapan kuatir lambat laun gesek manusia,2,{'USERNAME': 2}
3413,love,malah ketawa padahal sini buat mewek tau sendiri kan aing kalo sayang sama orang gimana walaupun cuma sama bayang-bayangnya lol,0,{}
3414,sadness,aku gatau aku jaga cukup biaya hidup aku batas ku aku punya butuh ku gaya hidup tinggi aku takut ingat,0,{}
3415,happy,program anak paling gari ramah anak recomended layak tonton admin syukur data tunjuk - anak umur - tahun demen tonton arti generasi muda harap good job,4,"{'USERNAME': 4, 'URL': 1}"
3416,sadness,jam tanggal juli fix gue rasa aneh rasa lo ubah biasa obayk understand,0,{}
3417,sadness,pas cerita pak puh bapak sepuhmasnya bapak memang liat beliau langsung ikut kosan pas lihat nyata memang nongkrongnya depan gudang enggak bilang wujud bagaimana hmm,1,{'USERNAME': 1}
3418,sadness,gue katai sama perempuan putus rantai julit memang susah owislah ibarate sego uwis dadi bubur flying money money,0,{}
3419,love,aww thank you ainin sayang amin moga moga mudah i love you even more hahahahhaa okey ill change right now hehehehe thank yiu againss,0,{}
3420,fear,menang motor memang gapada takut tbtb bawa motor jadi enggak fokus malah jatuh tabrak gua pernah menang motor enggak histeris malah pikir seram entar tbtb gua tabrak garagara enggak fokus nyetir drama memang,0,{'URL': 1}
3421,fear,celaka kamar hotel tiket tak jual sebut kandung fixed cost relatif sama airlines pesawat habis bahan bakar hampir sama baik kursi pesawat sebut kosong isi tumpang,0,{}
3422,sadness,moga mama bapa -ing teman teman lombok semua baik baik aja gempa susul moga rinjani lekas evakuasi,0,{}
3423,fear,guys temenku nyilet tangan sendiri aku takut depresi macam aku teman bagaimana beda kota skrg apa aku kasih tau ortunya gaenak huhu,0,{'askmf': 1}
3424,sadness,aku bingung kok tiba tiba diam enggak manggil aku tanyatanya nah tak dengar benarbenar kok nafas anteng banget eh nyata buat nyaman sama bantal guling kasur,0,{}
3425,sadness,mau banget disposable cameranya memang dulu pengin punya sempat sayang duit,0,{}
3426,happy,satu pilih meni daftar pilih haha jadi inti bebas pikir pilih hidup intervensi pihak mana,0,{}
3427,love,cinta mulai tutup logika tiup sukma hati apa kamu laku sempurna bagi aku temu ganjil diri,0,{}
3428,fear,aku rasai kok ekspresi kamu waktu aku mau beli toner kamu takut wajah aku tambah parah padahal aku rasa mending banget sejak pakai skincare,0,{}
3429,anger,marbot masjid semester akhir sahuuuur sahuuur sahuuuuur buru sahurwoy skripsi tuh dilanjutin jangan diliat-liatin aja niat lulus gak via vallen mulu kampret lu ahhh,0,{}
3430,fear,gue pagi mau naroh baju cuci lihat kepala bayi nongol pintu gudang kayak gue ngelantur abis gue takut banget waktu,0,{}
3431,anger,bajar orangtuamu kalian tau orang tua kalian banting tulang panas panas hujan,0,{'BELAJARLAH DEMI ORANGTUAMU!!!': 1}
3432,sadness,obral jomblo semua nih depan baru putus satu belakang deh enggak tahu kapan jomblonya with satu kata enggak mau mantion,1,"{'USERNAME': 1, 'URL': 1}"
3433,anger,yaslalu obat urgent hapus bpjsada penggantinyakahklo sih gppjgn kira alas rugi te- abatyg perlu hapus,1,{'USERNAME': 1}
3434,happy,special thanks for you tetap anggap ku adek tak pernah sekalipun sakit ku harga ku apa ku laku,0,{}
3435,fear,aku mulai takut hadap hari siksa dadak aku takut,0,{}
3436,anger,cuma mau nunjukkin kak kalo linimasa aku begini kamu samain sama gugah isu-isu busuk politik dah aku bilang apa,1,"{'USERNAME': 1, 'URL': 1}"
3437,love,peluk adek sayang sabar adek hamil kan jangan emosi mulu bahaya loh buat kandung adek kan vian bilang kecup kening adek,0,{}
3438,love,halo en maaf baru bikin threadnya t-t bow happy mensive ke- aku sayang kalian terima kasih nde kalian mau nampung arin absurd aneh enggak jelas t-t you all are my family this fake world you are sok precious me,0,{}
3439,happy,pagi selalu ajar harap langkah hidup,0,{}
3440,happy,satu hari kau ikhlas hujat fitnah adu domba lang ringan hari hitung hukum terima dunia semua ikhlas terima jahat pada u- mrk biar allah tangan,0,{}
3441,love,armyyyyyy aku mau bilang aku sayang kalian huhuhuhu sayang bts jugaaaaa,0,{}
3442,anger,siapa bilang pilkada panas bukti marah-marah batal jadi calon gubernur jatim,0,{}
3443,sadness,moga selamat anak-anak gue pernah gua pindul rasa cekik padahal gua gede banget enggak bayang gua sempit bagaimana rasa,0,{}
3444,happy,sahabat perlu filosopi milik nilai hidup beri nilai langsung hidup happy friendship day,0,{}
3445,happy,akhir ku putar thamrin pening kok gue melihat-lihat yuk kno wat banyak banget dong baju kemeja koko bomber jacket kaos cakep banget buat brondong mantan w,0,{}
3446,happy,tempat sandar lebih banyak diam diam arti lupa semua hiruk piruk kerja macet tempat temu senyum iklas enggak kamu dapat tempat mana,0,{'URL': 1}
3447,love,cium dulu sayang,0,{}
3448,sadness,sesat bgt kamu ajar bagai macam teori sosial sini kamu kasih bagai macam angka rumus bikin enggak nyaman jatuh malah jadi orang paling tinggal kelas,0,{}
3449,fear,rasa takut mati paling benar semua takut risiko celaka orang mati,0,{}
3450,happy,aku orang dtng hidup ibu puruk aku dtng banyak tanya hidup tak tak jawab sendiri semua jawab aku dapat ibu hadir disaan semua jauh tinggal kusendri jawab semua tanya hidup,0,{}
3451,happy,bau nya indak amis bersih kalo belanja ikan cumi baru besar te- harga tawar kalo ketemu nelayan beli ikan pasr ikan harga jauuhh lebih murah,0,{}
3452,happy,obrol sama dek doain mamah dek blablabla dek bantu doa manggut-manggut senyum tulus banget muka meski enggak erti apa maksud tiap bilang doain dek senyum smbl peluk,0,{}
3453,sadness,jujur sedih enggak nurutin ambisi lama dipengenin memang ajar ikhlas ridho benar-benar serah semua tuhan kudu legowo,0,{}
3454,love,indah jatuh cinta orang suka waktu tengok senyum senyum balik kat,0,{}
3455,sadness,muka minder sabar nggih semeton punya istri kok,0,{}
3456,love,sayang apaa sayang banget banget banget susah buat ngungkapinnya sayang tuh beda banget enggak kayak fan idol kayak saudara sendiri kayak adek sendiri kayak anak sendiri rela banget buat,0,{}
3457,anger,aku ci haha enga lah enak kamu - -,0,{}
3458,sadness,perlu jadi siapa-siapa usah jadi siapa-siapa usah jadi apa-apa cukup happy cukup lega bangga meski jadi butir debu tempel tiang bendera nu sempat usap kiamat kh munif zuhri,0,{}
3459,happy,selamat malam moga hari jadi ajar besok enggak laku salah tetap semangat tuhan sayang,0,{}
3460,love,nih manusia tibatiba nyita perhati garagara kira orang kalem nyata allahu bobrok banget tambah bobrok tambah cinta huhu bucin banget sori,1,"{'USERNAME': 1, 'URL': 1}"
3461,fear,kok pilih sih takut malu universitas walaupun kampus diri orang sendiri kan lawan mahasiswa seluruh indonesia kali bor,0,{}
3462,sadness,dear pak pak benar ta indak libur hari raya pak masa tanggal merah hari pakk baru pulang sholat-takbiran masa langsung rantau pak,1,"{'USERNAME': 1, 'URL': 1}"
3463,happy,percayalahsetiap cobaanpasti balik semua hikmahnyadan uji berapa jauh usaha jalan,1,{'USERNAME': 1}
3464,love,cinta baik buat jadi lebih baik belum bila cinta buat hidup lebih buruk jangan takut lepas pergi,0,{}
3465,love,laku janji sebut kelvin lepas jari kelingking erat peluk tubuh daniel aku sayang kamu niel,0,{}
3466,fear,trauma sakit almarhum kakak gue sangat besar gue paling enggak lihat orang sakit gue orang dekat gue rasa mau ledak,0,{}
3467,happy,gaya presiden jokowi blusukan datang masyarakat tanya dengar diskus tak lupa salam masyarakat jumpa,0,{}
3468,love,tamak sedikit gerak kepala bibir sentuh bagi atas kepala haruhi kecup kening sang kasih kalau aku puluh kali lebih rindu bisik tamak,0,{}
3469,love,ira knightleeeeeyy biasa gue enggak demen cowok diem sok cool entah gerak gerik mr darcy kok bikin geli geli hahaha,0,{}
3470,sadness,icip belah sate gang lele mahal rasa biasa bakmi gang lele,0,{}
3471,fear,wah bagus deh mau duet legend btw omong mau dueg kapan iya sihcuma takut suara jadi -akberubah salah teknik,1,{'USERNAME': 1}
3472,sadness,wah iya banget mas tempat kerja sering banget enggak ngenakin cowok nganggepnya becandaan cewe nganggepnya salah begini,0,{}
3473,happy,lebih tenang lebih berani tahan bola akhir lfc punya dm padan fernandinhonya city matic nya mu kantenya chelsea siap saing deh musim depan,2,{'USERNAME': 2}
3474,love,selalu ketawa selalu cubit cubit online aku benar rasai sayang sama utuh walaupun aku enggak nyentuh kamu nyata paruh aku pengin banget asih,0,{'URL': 1}
3475,anger,dear sistem deteksi baharu ubah harga ongkir tahun nih nombok te- kirim paket garagara ongkir enggak sesuai,1,{'USERNAME': 1}
3476,fear,kemudian bayang diri sana amat jelas ritual bawa makhluk sini aku sama sekali tak erti apa jadi pikir terlalu penuh rasa bingung takut,0,{}
3477,happy,acara nya seru bange pas kak abdul nyanyi suara nya bikin hati adem the best deh,2,{'USERNAME': 2}
